22:34:17 [INFO] __main__: ============================================================
22:34:17 [INFO] __main__: AUSTIN Optuna Training (200 trials)
22:34:17 [INFO] __main__: Optimization objective: within2
22:34:17 [INFO] __main__: ============================================================
22:34:17 [INFO] __main__: Loading from training cache: data/training_cache/austin/full.parquet
22:34:17 [INFO] __main__: Loaded 486,912 rows, 237 columns
22:34:18 [INFO] __main__: Data range after filtering: 2023-01-01 to 2025-12-03
22:34:19 [INFO] __main__: Total days: 1068
22:34:19 [INFO] __main__: Training: 2023-01-01 to 2025-05-04 (855 days)
22:34:19 [INFO] __main__: Testing:  2025-05-05 to 2025-12-03 (213 days)
22:34:19 [INFO] __main__: 
Training samples: 389,784
22:34:19 [INFO] __main__: Training days: 855
22:34:19 [INFO] __main__: Test samples: 97,128
22:34:19 [INFO] __main__: Test days: 213
22:34:19 [INFO] __main__: 
Station-city features: ['station_city_temp_gap', 'station_city_max_gap_sofar', 'station_city_mean_gap_sofar', 'station_city_gap_std', 'station_city_gap_trend', 'station_city_gap_x_fcst_gap']
22:34:19 [INFO] __main__:   station_city_temp_gap: 389,688/389,784 non-null (100.0%)
22:34:19 [INFO] __main__:   station_city_max_gap_sofar: 389,688/389,784 non-null (100.0%)
22:34:19 [INFO] __main__:   station_city_mean_gap_sofar: 389,688/389,784 non-null (100.0%)
22:34:19 [INFO] __main__:   station_city_gap_std: 389,688/389,784 non-null (100.0%)
22:34:19 [INFO] __main__:   station_city_gap_trend: 389,682/389,784 non-null (100.0%)
22:34:19 [INFO] __main__:   station_city_gap_x_fcst_gap: 389,688/389,784 non-null (100.0%)
22:34:19 [INFO] __main__: 
Multi-horizon features: ['fcst_multi_mean', 'fcst_multi_median', 'fcst_multi_ema', 'fcst_multi_std', 'fcst_multi_range', 'fcst_multi_t1_t2_diff', 'fcst_multi_drift', 'fcst_multi_cv', 'fcst_multi_range_pct']
22:34:19 [INFO] __main__:   fcst_multi_mean: 389,784/389,784 non-null (100.0%)
22:34:19 [INFO] __main__:   fcst_multi_median: 389,784/389,784 non-null (100.0%)
22:34:19 [INFO] __main__:   fcst_multi_ema: 389,784/389,784 non-null (100.0%)
22:34:19 [INFO] __main__:   fcst_multi_std: 389,784/389,784 non-null (100.0%)
22:34:19 [INFO] __main__:   fcst_multi_range: 389,784/389,784 non-null (100.0%)
22:34:19 [INFO] __main__:   fcst_multi_t1_t2_diff: 389,784/389,784 non-null (100.0%)
22:34:19 [INFO] __main__:   fcst_multi_drift: 389,784/389,784 non-null (100.0%)
22:34:19 [INFO] __main__:   fcst_multi_cv: 389,784/389,784 non-null (100.0%)
22:34:19 [INFO] __main__:   fcst_multi_range_pct: 389,784/389,784 non-null (100.0%)
22:34:19 [INFO] models.training.ordinal_trainer: Training ordinal model (catboost) on 389784 samples
22:34:20 [INFO] models.training.ordinal_trainer: City delta range: [-12, 12]
22:34:20 [INFO] models.training.ordinal_trainer: Training 24 threshold classifiers: [-11, -10, -9, -8, -7, -6, -5, -4, -3, -2, -1, 0, 1, 2, 3, 4, 5, 6, 7, 8, 9, 10, 11, 12]
22:34:20 [INFO] models.training.ordinal_trainer: Starting Optuna tuning with 200 trials (objective=within2)

============================================================
OPTUNA TRAINING (200 trials, objective=within2)
============================================================
  0%|          | 0/200 [00:00<?, ?it/s]Best trial: 0. Best value: 0.556872:   0%|          | 0/200 [00:16<?, ?it/s]Best trial: 0. Best value: 0.556872:   0%|          | 1/200 [00:16<53:51, 16.24s/it]Best trial: 0. Best value: 0.556872:   0%|          | 1/200 [00:44<53:51, 16.24s/it]Best trial: 0. Best value: 0.556872:   1%|          | 2/200 [00:44<1:16:19, 23.13s/it]Best trial: 0. Best value: 0.556872:   1%|          | 2/200 [01:11<1:16:19, 23.13s/it]Best trial: 0. Best value: 0.556872:   2%|▏         | 3/200 [01:11<1:22:35, 25.16s/it]Best trial: 0. Best value: 0.556872:   2%|▏         | 3/200 [01:31<1:22:35, 25.16s/it]Best trial: 0. Best value: 0.556872:   2%|▏         | 4/200 [01:31<1:15:07, 23.00s/it]Best trial: 0. Best value: 0.556872:   2%|▏         | 4/200 [02:06<1:15:07, 23.00s/it]Best trial: 0. Best value: 0.556872:   2%|▎         | 5/200 [02:06<1:28:34, 27.25s/it]Best trial: 0. Best value: 0.556872:   2%|▎         | 5/200 [02:29<1:28:34, 27.25s/it]Best trial: 0. Best value: 0.556872:   3%|▎         | 6/200 [02:29<1:23:54, 25.95s/it]Best trial: 0. Best value: 0.556872:   3%|▎         | 6/200 [02:54<1:23:54, 25.95s/it]Best trial: 0. Best value: 0.556872:   4%|▎         | 7/200 [02:54<1:22:31, 25.66s/it]Best trial: 0. Best value: 0.556872:   4%|▎         | 7/200 [03:15<1:22:31, 25.66s/it]Best trial: 0. Best value: 0.556872:   4%|▍         | 8/200 [03:15<1:17:12, 24.13s/it]Best trial: 0. Best value: 0.556872:   4%|▍         | 8/200 [03:59<1:17:12, 24.13s/it]Best trial: 0. Best value: 0.556872:   4%|▍         | 9/200 [03:59<1:36:18, 30.26s/it]Best trial: 0. Best value: 0.556872:   4%|▍         | 9/200 [04:40<1:36:18, 30.26s/it]Best trial: 0. Best value: 0.556872:   5%|▌         | 10/200 [04:40<1:46:08, 33.52s/it]Best trial: 0. Best value: 0.556872:   5%|▌         | 10/200 [05:00<1:46:08, 33.52s/it]Best trial: 0. Best value: 0.556872:   6%|▌         | 11/200 [05:00<1:33:13, 29.60s/it]Best trial: 0. Best value: 0.556872:   6%|▌         | 11/200 [05:16<1:33:13, 29.60s/it]Best trial: 0. Best value: 0.556872:   6%|▌         | 12/200 [05:16<1:19:23, 25.34s/it]Best trial: 0. Best value: 0.556872:   6%|▌         | 12/200 [05:35<1:19:23, 25.34s/it]Best trial: 0. Best value: 0.556872:   6%|▋         | 13/200 [05:35<1:13:09, 23.47s/it]Best trial: 0. Best value: 0.556872:   6%|▋         | 13/200 [05:56<1:13:09, 23.47s/it]Best trial: 0. Best value: 0.556872:   7%|▋         | 14/200 [05:56<1:10:34, 22.76s/it]Best trial: 0. Best value: 0.556872:   7%|▋         | 14/200 [06:15<1:10:34, 22.76s/it]Best trial: 0. Best value: 0.556872:   8%|▊         | 15/200 [06:15<1:06:19, 21.51s/it]Best trial: 0. Best value: 0.556872:   8%|▊         | 15/200 [06:43<1:06:19, 21.51s/it]Best trial: 0. Best value: 0.556872:   8%|▊         | 16/200 [06:43<1:12:20, 23.59s/it]Best trial: 0. Best value: 0.556872:   8%|▊         | 16/200 [07:02<1:12:20, 23.59s/it]Best trial: 0. Best value: 0.556872:   8%|▊         | 17/200 [07:02<1:07:07, 22.01s/it]Best trial: 0. Best value: 0.556872:   8%|▊         | 17/200 [07:22<1:07:07, 22.01s/it]Best trial: 0. Best value: 0.556872:   9%|▉         | 18/200 [07:22<1:05:29, 21.59s/it]Best trial: 0. Best value: 0.556872:   9%|▉         | 18/200 [07:42<1:05:29, 21.59s/it]Best trial: 0. Best value: 0.556872:  10%|▉         | 19/200 [07:42<1:03:37, 21.09s/it]Best trial: 0. Best value: 0.556872:  10%|▉         | 19/200 [08:04<1:03:37, 21.09s/it]Best trial: 0. Best value: 0.556872:  10%|█         | 20/200 [08:04<1:04:06, 21.37s/it]Best trial: 0. Best value: 0.556872:  10%|█         | 20/200 [08:22<1:04:06, 21.37s/it]Best trial: 0. Best value: 0.556872:  10%|█         | 21/200 [08:22<1:00:25, 20.25s/it]Best trial: 0. Best value: 0.556872:  10%|█         | 21/200 [08:37<1:00:25, 20.25s/it]Best trial: 0. Best value: 0.556872:  11%|█         | 22/200 [08:37<55:24, 18.68s/it]  Best trial: 0. Best value: 0.556872:  11%|█         | 22/200 [08:53<55:24, 18.68s/it]Best trial: 0. Best value: 0.556872:  12%|█▏        | 23/200 [08:53<53:18, 18.07s/it]Best trial: 0. Best value: 0.556872:  12%|█▏        | 23/200 [09:17<53:18, 18.07s/it]Best trial: 0. Best value: 0.556872:  12%|█▏        | 24/200 [09:17<58:04, 19.80s/it]Best trial: 0. Best value: 0.556872:  12%|█▏        | 24/200 [09:36<58:04, 19.80s/it]Best trial: 0. Best value: 0.556872:  12%|█▎        | 25/200 [09:36<56:30, 19.37s/it]Best trial: 0. Best value: 0.556872:  12%|█▎        | 25/200 [09:52<56:30, 19.37s/it]Best trial: 0. Best value: 0.556872:  13%|█▎        | 26/200 [09:52<53:36, 18.48s/it]Best trial: 0. Best value: 0.556872:  13%|█▎        | 26/200 [10:09<53:36, 18.48s/it]Best trial: 0. Best value: 0.556872:  14%|█▎        | 27/200 [10:09<51:38, 17.91s/it]Best trial: 0. Best value: 0.556872:  14%|█▎        | 27/200 [10:31<51:38, 17.91s/it]Best trial: 0. Best value: 0.556872:  14%|█▍        | 28/200 [10:31<54:49, 19.13s/it]Best trial: 0. Best value: 0.556872:  14%|█▍        | 28/200 [11:09<54:49, 19.13s/it]Best trial: 0. Best value: 0.556872:  14%|█▍        | 29/200 [11:09<1:11:00, 24.91s/it]Best trial: 0. Best value: 0.556872:  14%|█▍        | 29/200 [11:31<1:11:00, 24.91s/it]Best trial: 0. Best value: 0.556872:  15%|█▌        | 30/200 [11:31<1:07:47, 23.92s/it]Best trial: 0. Best value: 0.556872:  15%|█▌        | 30/200 [11:49<1:07:47, 23.92s/it]Best trial: 0. Best value: 0.556872:  16%|█▌        | 31/200 [11:49<1:03:01, 22.37s/it]Best trial: 0. Best value: 0.556872:  16%|█▌        | 31/200 [12:14<1:03:01, 22.37s/it]Best trial: 0. Best value: 0.556872:  16%|█▌        | 32/200 [12:14<1:04:26, 23.02s/it]Best trial: 0. Best value: 0.556872:  16%|█▌        | 32/200 [12:34<1:04:26, 23.02s/it]Best trial: 0. Best value: 0.556872:  16%|█▋        | 33/200 [12:34<1:01:51, 22.23s/it]Best trial: 0. Best value: 0.556872:  16%|█▋        | 33/200 [12:58<1:01:51, 22.23s/it]Best trial: 0. Best value: 0.556872:  17%|█▋        | 34/200 [12:58<1:02:19, 22.53s/it]Best trial: 0. Best value: 0.556872:  17%|█▋        | 34/200 [13:27<1:02:19, 22.53s/it]Best trial: 0. Best value: 0.556872:  18%|█▊        | 35/200 [13:27<1:07:47, 24.65s/it]Best trial: 0. Best value: 0.556872:  18%|█▊        | 35/200 [13:58<1:07:47, 24.65s/it]Best trial: 0. Best value: 0.556872:  18%|█▊        | 36/200 [13:58<1:12:11, 26.41s/it]Best trial: 0. Best value: 0.556872:  18%|█▊        | 36/200 [14:28<1:12:11, 26.41s/it]Best trial: 0. Best value: 0.556872:  18%|█▊        | 37/200 [14:28<1:15:02, 27.62s/it]Best trial: 0. Best value: 0.556872:  18%|█▊        | 37/200 [14:52<1:15:02, 27.62s/it]Best trial: 0. Best value: 0.556872:  19%|█▉        | 38/200 [14:52<1:11:31, 26.49s/it]Best trial: 0. Best value: 0.556872:  19%|█▉        | 38/200 [15:06<1:11:31, 26.49s/it]Best trial: 0. Best value: 0.556872:  20%|█▉        | 39/200 [15:06<1:01:09, 22.79s/it]Best trial: 0. Best value: 0.556872:  20%|█▉        | 39/200 [15:56<1:01:09, 22.79s/it]Best trial: 0. Best value: 0.556872:  20%|██        | 40/200 [15:56<1:22:31, 30.95s/it]Best trial: 0. Best value: 0.556872:  20%|██        | 40/200 [16:29<1:22:31, 30.95s/it]Best trial: 0. Best value: 0.556872:  20%|██        | 41/200 [16:29<1:23:50, 31.64s/it]Best trial: 0. Best value: 0.556872:  20%|██        | 41/200 [16:49<1:23:50, 31.64s/it]Best trial: 0. Best value: 0.556872:  21%|██        | 42/200 [16:49<1:13:32, 27.92s/it]Best trial: 0. Best value: 0.556872:  21%|██        | 42/200 [17:05<1:13:32, 27.92s/it]Best trial: 0. Best value: 0.556872:  22%|██▏       | 43/200 [17:05<1:03:40, 24.34s/it]Best trial: 0. Best value: 0.556872:  22%|██▏       | 43/200 [17:23<1:03:40, 24.34s/it]Best trial: 0. Best value: 0.556872:  22%|██▏       | 44/200 [17:23<58:24, 22.46s/it]  Best trial: 0. Best value: 0.556872:  22%|██▏       | 44/200 [17:40<58:24, 22.46s/it]Best trial: 0. Best value: 0.556872:  22%|██▎       | 45/200 [17:40<54:17, 21.02s/it]Best trial: 0. Best value: 0.556872:  22%|██▎       | 45/200 [18:07<54:17, 21.02s/it]Best trial: 0. Best value: 0.556872:  23%|██▎       | 46/200 [18:07<58:29, 22.79s/it]Best trial: 0. Best value: 0.556872:  23%|██▎       | 46/200 [18:22<58:29, 22.79s/it]Best trial: 0. Best value: 0.556872:  24%|██▎       | 47/200 [18:22<51:37, 20.25s/it]Best trial: 0. Best value: 0.556872:  24%|██▎       | 47/200 [18:41<51:37, 20.25s/it]Best trial: 0. Best value: 0.556872:  24%|██▍       | 48/200 [18:41<50:41, 20.01s/it]Best trial: 0. Best value: 0.556872:  24%|██▍       | 48/200 [19:08<50:41, 20.01s/it]Best trial: 0. Best value: 0.556872:  24%|██▍       | 49/200 [19:08<55:18, 21.98s/it]Best trial: 0. Best value: 0.556872:  24%|██▍       | 49/200 [19:54<55:18, 21.98s/it]Best trial: 0. Best value: 0.556872:  25%|██▌       | 50/200 [19:54<1:13:21, 29.34s/it]Best trial: 0. Best value: 0.556872:  25%|██▌       | 50/200 [20:18<1:13:21, 29.34s/it]Best trial: 0. Best value: 0.556872:  26%|██▌       | 51/200 [20:18<1:08:40, 27.65s/it]Best trial: 0. Best value: 0.556872:  26%|██▌       | 51/200 [20:36<1:08:40, 27.65s/it]Best trial: 0. Best value: 0.556872:  26%|██▌       | 52/200 [20:36<1:01:05, 24.77s/it]Best trial: 0. Best value: 0.556872:  26%|██▌       | 52/200 [20:52<1:01:05, 24.77s/it]Best trial: 0. Best value: 0.556872:  26%|██▋       | 53/200 [20:52<54:32, 22.26s/it]  Best trial: 53. Best value: 0.560735:  26%|██▋       | 53/200 [21:11<54:32, 22.26s/it]Best trial: 53. Best value: 0.560735:  27%|██▋       | 54/200 [21:11<51:23, 21.12s/it]Best trial: 53. Best value: 0.560735:  27%|██▋       | 54/200 [21:29<51:23, 21.12s/it]Best trial: 53. Best value: 0.560735:  28%|██▊       | 55/200 [21:29<48:54, 20.24s/it]Best trial: 53. Best value: 0.560735:  28%|██▊       | 55/200 [21:51<48:54, 20.24s/it]Best trial: 53. Best value: 0.560735:  28%|██▊       | 56/200 [21:51<49:51, 20.77s/it]Best trial: 53. Best value: 0.560735:  28%|██▊       | 56/200 [22:08<49:51, 20.77s/it]Best trial: 53. Best value: 0.560735:  28%|██▊       | 57/200 [22:08<46:34, 19.55s/it]Best trial: 53. Best value: 0.560735:  28%|██▊       | 57/200 [22:26<46:34, 19.55s/it]Best trial: 53. Best value: 0.560735:  29%|██▉       | 58/200 [22:26<45:22, 19.17s/it]Best trial: 58. Best value: 0.574891:  29%|██▉       | 58/200 [22:43<45:22, 19.17s/it]Best trial: 58. Best value: 0.574891:  30%|██▉       | 59/200 [22:43<43:55, 18.69s/it]Best trial: 58. Best value: 0.574891:  30%|██▉       | 59/200 [23:00<43:55, 18.69s/it]Best trial: 58. Best value: 0.574891:  30%|███       | 60/200 [23:00<41:55, 17.97s/it]Best trial: 58. Best value: 0.574891:  30%|███       | 60/200 [23:15<41:55, 17.97s/it]Best trial: 58. Best value: 0.574891:  30%|███       | 61/200 [23:15<39:30, 17.05s/it]Best trial: 58. Best value: 0.574891:  30%|███       | 61/200 [23:32<39:30, 17.05s/it]Best trial: 58. Best value: 0.574891:  31%|███       | 62/200 [23:32<39:25, 17.14s/it]Best trial: 58. Best value: 0.574891:  31%|███       | 62/200 [23:48<39:25, 17.14s/it]Best trial: 58. Best value: 0.574891:  32%|███▏      | 63/200 [23:48<38:18, 16.78s/it]Best trial: 58. Best value: 0.574891:  32%|███▏      | 63/200 [24:04<38:18, 16.78s/it]Best trial: 58. Best value: 0.574891:  32%|███▏      | 64/200 [24:04<37:35, 16.59s/it]Best trial: 58. Best value: 0.574891:  32%|███▏      | 64/200 [24:26<37:35, 16.59s/it]Best trial: 58. Best value: 0.574891:  32%|███▎      | 65/200 [24:26<41:13, 18.32s/it]Best trial: 58. Best value: 0.574891:  32%|███▎      | 65/200 [24:45<41:13, 18.32s/it]Best trial: 58. Best value: 0.574891:  33%|███▎      | 66/200 [24:45<40:48, 18.27s/it]Best trial: 58. Best value: 0.574891:  33%|███▎      | 66/200 [25:04<40:48, 18.27s/it]Best trial: 58. Best value: 0.574891:  34%|███▎      | 67/200 [25:04<41:07, 18.55s/it]Best trial: 58. Best value: 0.574891:  34%|███▎      | 67/200 [25:32<41:07, 18.55s/it]Best trial: 58. Best value: 0.574891:  34%|███▍      | 68/200 [25:32<47:09, 21.43s/it]Best trial: 58. Best value: 0.574891:  34%|███▍      | 68/200 [25:47<47:09, 21.43s/it]Best trial: 58. Best value: 0.574891:  34%|███▍      | 69/200 [25:47<42:48, 19.60s/it]Best trial: 58. Best value: 0.574891:  34%|███▍      | 69/200 [26:07<42:48, 19.60s/it]Best trial: 58. Best value: 0.574891:  35%|███▌      | 70/200 [26:07<42:24, 19.57s/it]Best trial: 58. Best value: 0.574891:  35%|███▌      | 70/200 [26:22<42:24, 19.57s/it]Best trial: 58. Best value: 0.574891:  36%|███▌      | 71/200 [26:22<39:30, 18.38s/it]Best trial: 58. Best value: 0.574891:  36%|███▌      | 71/200 [26:41<39:30, 18.38s/it]Best trial: 58. Best value: 0.574891:  36%|███▌      | 72/200 [26:41<39:24, 18.47s/it]Best trial: 58. Best value: 0.574891:  36%|███▌      | 72/200 [26:58<39:24, 18.47s/it]Best trial: 58. Best value: 0.574891:  36%|███▋      | 73/200 [26:58<38:05, 18.00s/it]Best trial: 58. Best value: 0.574891:  36%|███▋      | 73/200 [27:16<38:05, 18.00s/it]Best trial: 58. Best value: 0.574891:  37%|███▋      | 74/200 [27:16<37:37, 17.92s/it]Best trial: 58. Best value: 0.574891:  37%|███▋      | 74/200 [27:30<37:37, 17.92s/it]Best trial: 58. Best value: 0.574891:  38%|███▊      | 75/200 [27:30<35:06, 16.85s/it]Best trial: 58. Best value: 0.574891:  38%|███▊      | 75/200 [28:05<35:06, 16.85s/it]Best trial: 58. Best value: 0.574891:  38%|███▊      | 76/200 [28:05<45:58, 22.25s/it]Best trial: 58. Best value: 0.574891:  38%|███▊      | 76/200 [28:28<45:58, 22.25s/it]Best trial: 58. Best value: 0.574891:  38%|███▊      | 77/200 [28:28<46:14, 22.56s/it]Best trial: 58. Best value: 0.574891:  38%|███▊      | 77/200 [28:42<46:14, 22.56s/it]Best trial: 58. Best value: 0.574891:  39%|███▉      | 78/200 [28:42<40:26, 19.89s/it]Best trial: 58. Best value: 0.574891:  39%|███▉      | 78/200 [28:58<40:26, 19.89s/it]Best trial: 58. Best value: 0.574891:  40%|███▉      | 79/200 [28:58<37:54, 18.80s/it]Best trial: 58. Best value: 0.574891:  40%|███▉      | 79/200 [29:17<37:54, 18.80s/it]Best trial: 58. Best value: 0.574891:  40%|████      | 80/200 [29:17<37:25, 18.71s/it]Best trial: 58. Best value: 0.574891:  40%|████      | 80/200 [29:35<37:25, 18.71s/it]Best trial: 58. Best value: 0.574891:  40%|████      | 81/200 [29:35<36:47, 18.55s/it]Best trial: 58. Best value: 0.574891:  40%|████      | 81/200 [29:53<36:47, 18.55s/it]Best trial: 58. Best value: 0.574891:  41%|████      | 82/200 [29:53<36:08, 18.38s/it]Best trial: 58. Best value: 0.574891:  41%|████      | 82/200 [30:10<36:08, 18.38s/it]Best trial: 58. Best value: 0.574891:  42%|████▏     | 83/200 [30:10<35:08, 18.02s/it]Best trial: 58. Best value: 0.574891:  42%|████▏     | 83/200 [30:26<35:08, 18.02s/it]Best trial: 58. Best value: 0.574891:  42%|████▏     | 84/200 [30:26<33:52, 17.52s/it]Best trial: 58. Best value: 0.574891:  42%|████▏     | 84/200 [30:45<33:52, 17.52s/it]Best trial: 58. Best value: 0.574891:  42%|████▎     | 85/200 [30:45<34:18, 17.90s/it]Best trial: 58. Best value: 0.574891:  42%|████▎     | 85/200 [31:05<34:18, 17.90s/it]Best trial: 58. Best value: 0.574891:  43%|████▎     | 86/200 [31:05<35:16, 18.57s/it]Best trial: 58. Best value: 0.574891:  43%|████▎     | 86/200 [31:21<35:16, 18.57s/it]Best trial: 58. Best value: 0.574891:  44%|████▎     | 87/200 [31:21<33:09, 17.61s/it]Best trial: 58. Best value: 0.574891:  44%|████▎     | 87/200 [31:42<33:09, 17.61s/it]Best trial: 58. Best value: 0.574891:  44%|████▍     | 88/200 [31:42<35:06, 18.81s/it]Best trial: 58. Best value: 0.574891:  44%|████▍     | 88/200 [32:00<35:06, 18.81s/it]Best trial: 58. Best value: 0.574891:  44%|████▍     | 89/200 [32:00<34:21, 18.57s/it]Best trial: 58. Best value: 0.574891:  44%|████▍     | 89/200 [32:16<34:21, 18.57s/it]Best trial: 58. Best value: 0.574891:  45%|████▌     | 90/200 [32:16<32:21, 17.65s/it]Best trial: 58. Best value: 0.574891:  45%|████▌     | 90/200 [32:31<32:21, 17.65s/it]Best trial: 58. Best value: 0.574891:  46%|████▌     | 91/200 [32:31<30:49, 16.97s/it]Best trial: 58. Best value: 0.574891:  46%|████▌     | 91/200 [32:54<30:49, 16.97s/it]Best trial: 58. Best value: 0.574891:  46%|████▌     | 92/200 [32:54<33:49, 18.79s/it]Best trial: 58. Best value: 0.574891:  46%|████▌     | 92/200 [33:08<33:49, 18.79s/it]Best trial: 58. Best value: 0.574891:  46%|████▋     | 93/200 [33:08<31:03, 17.42s/it]Best trial: 58. Best value: 0.574891:  46%|████▋     | 93/200 [33:24<31:03, 17.42s/it]Best trial: 58. Best value: 0.574891:  47%|████▋     | 94/200 [33:24<29:42, 16.82s/it]Best trial: 58. Best value: 0.574891:  47%|████▋     | 94/200 [33:40<29:42, 16.82s/it]Best trial: 58. Best value: 0.574891:  48%|████▊     | 95/200 [33:40<29:19, 16.75s/it]Best trial: 58. Best value: 0.574891:  48%|████▊     | 95/200 [33:59<29:19, 16.75s/it]Best trial: 58. Best value: 0.574891:  48%|████▊     | 96/200 [33:59<29:53, 17.25s/it]Best trial: 58. Best value: 0.574891:  48%|████▊     | 96/200 [34:17<29:53, 17.25s/it]Best trial: 58. Best value: 0.574891:  48%|████▊     | 97/200 [34:17<30:07, 17.55s/it]Best trial: 58. Best value: 0.574891:  48%|████▊     | 97/200 [34:32<30:07, 17.55s/it]Best trial: 58. Best value: 0.574891:  49%|████▉     | 98/200 [34:32<28:29, 16.76s/it]Best trial: 58. Best value: 0.574891:  49%|████▉     | 98/200 [34:50<28:29, 16.76s/it]Best trial: 58. Best value: 0.574891:  50%|████▉     | 99/200 [34:50<29:01, 17.24s/it]Best trial: 58. Best value: 0.574891:  50%|████▉     | 99/200 [35:10<29:01, 17.24s/it]Best trial: 58. Best value: 0.574891:  50%|█████     | 100/200 [35:10<30:01, 18.01s/it]Best trial: 58. Best value: 0.574891:  50%|█████     | 100/200 [35:28<30:01, 18.01s/it]Best trial: 58. Best value: 0.574891:  50%|█████     | 101/200 [35:28<29:33, 17.91s/it]Best trial: 58. Best value: 0.574891:  50%|█████     | 101/200 [35:47<29:33, 17.91s/it]Best trial: 58. Best value: 0.574891:  51%|█████     | 102/200 [35:47<29:58, 18.35s/it]Best trial: 58. Best value: 0.574891:  51%|█████     | 102/200 [36:04<29:58, 18.35s/it]Best trial: 58. Best value: 0.574891:  52%|█████▏    | 103/200 [36:04<28:52, 17.86s/it]Best trial: 58. Best value: 0.574891:  52%|█████▏    | 103/200 [36:19<28:52, 17.86s/it]Best trial: 58. Best value: 0.574891:  52%|█████▏    | 104/200 [36:19<27:27, 17.16s/it]Best trial: 58. Best value: 0.574891:  52%|█████▏    | 104/200 [36:43<27:27, 17.16s/it]Best trial: 58. Best value: 0.574891:  52%|█████▎    | 105/200 [36:43<30:08, 19.04s/it]Best trial: 58. Best value: 0.574891:  52%|█████▎    | 105/200 [37:01<30:08, 19.04s/it]Best trial: 58. Best value: 0.574891:  53%|█████▎    | 106/200 [37:01<29:19, 18.72s/it]Best trial: 58. Best value: 0.574891:  53%|█████▎    | 106/200 [37:20<29:19, 18.72s/it]Best trial: 58. Best value: 0.574891:  54%|█████▎    | 107/200 [37:20<29:26, 18.99s/it]Best trial: 58. Best value: 0.574891:  54%|█████▎    | 107/200 [37:51<29:26, 18.99s/it]Best trial: 58. Best value: 0.574891:  54%|█████▍    | 108/200 [37:51<34:33, 22.54s/it]Best trial: 58. Best value: 0.574891:  54%|█████▍    | 108/200 [38:06<34:33, 22.54s/it]Best trial: 58. Best value: 0.574891:  55%|█████▍    | 109/200 [38:06<30:43, 20.26s/it]Best trial: 58. Best value: 0.574891:  55%|█████▍    | 109/200 [38:25<30:43, 20.26s/it]Best trial: 58. Best value: 0.574891:  55%|█████▌    | 110/200 [38:25<29:53, 19.93s/it]Best trial: 58. Best value: 0.574891:  55%|█████▌    | 110/200 [38:40<29:53, 19.93s/it]Best trial: 58. Best value: 0.574891:  56%|█████▌    | 111/200 [38:40<27:22, 18.45s/it]Best trial: 58. Best value: 0.574891:  56%|█████▌    | 111/200 [38:55<27:22, 18.45s/it]Best trial: 58. Best value: 0.574891:  56%|█████▌    | 112/200 [38:55<25:16, 17.23s/it]Best trial: 58. Best value: 0.574891:  56%|█████▌    | 112/200 [39:12<25:16, 17.23s/it]Best trial: 58. Best value: 0.574891:  56%|█████▋    | 113/200 [39:12<25:10, 17.36s/it]Best trial: 58. Best value: 0.574891:  56%|█████▋    | 113/200 [39:30<25:10, 17.36s/it]Best trial: 58. Best value: 0.574891:  57%|█████▋    | 114/200 [39:30<24:47, 17.30s/it]Best trial: 58. Best value: 0.574891:  57%|█████▋    | 114/200 [39:53<24:47, 17.30s/it]Best trial: 58. Best value: 0.574891:  57%|█████▊    | 115/200 [39:53<27:05, 19.13s/it]Best trial: 58. Best value: 0.574891:  57%|█████▊    | 115/200 [40:10<27:05, 19.13s/it]Best trial: 58. Best value: 0.574891:  58%|█████▊    | 116/200 [40:10<25:47, 18.42s/it]Best trial: 58. Best value: 0.574891:  58%|█████▊    | 116/200 [40:24<25:47, 18.42s/it]Best trial: 58. Best value: 0.574891:  58%|█████▊    | 117/200 [40:24<23:48, 17.21s/it]Best trial: 58. Best value: 0.574891:  58%|█████▊    | 117/200 [40:41<23:48, 17.21s/it]Best trial: 58. Best value: 0.574891:  59%|█████▉    | 118/200 [40:41<23:31, 17.21s/it]Best trial: 58. Best value: 0.574891:  59%|█████▉    | 118/200 [41:06<23:31, 17.21s/it]Best trial: 58. Best value: 0.574891:  60%|█████▉    | 119/200 [41:06<26:17, 19.47s/it]Best trial: 58. Best value: 0.574891:  60%|█████▉    | 119/200 [41:23<26:17, 19.47s/it]Best trial: 58. Best value: 0.574891:  60%|██████    | 120/200 [41:23<24:47, 18.60s/it]Best trial: 58. Best value: 0.574891:  60%|██████    | 120/200 [41:41<24:47, 18.60s/it]Best trial: 58. Best value: 0.574891:  60%|██████    | 121/200 [41:41<24:17, 18.45s/it]Best trial: 58. Best value: 0.574891:  60%|██████    | 121/200 [41:56<24:17, 18.45s/it]Best trial: 58. Best value: 0.574891:  61%|██████    | 122/200 [41:56<22:49, 17.56s/it]Best trial: 58. Best value: 0.574891:  61%|██████    | 122/200 [42:12<22:49, 17.56s/it]Best trial: 58. Best value: 0.574891:  62%|██████▏   | 123/200 [42:12<21:46, 16.97s/it]Best trial: 58. Best value: 0.574891:  62%|██████▏   | 123/200 [42:27<21:46, 16.97s/it]Best trial: 58. Best value: 0.574891:  62%|██████▏   | 124/200 [42:27<21:00, 16.59s/it]Best trial: 58. Best value: 0.574891:  62%|██████▏   | 124/200 [42:44<21:00, 16.59s/it]Best trial: 58. Best value: 0.574891:  62%|██████▎   | 125/200 [42:44<20:38, 16.51s/it]Best trial: 58. Best value: 0.574891:  62%|██████▎   | 125/200 [43:02<20:38, 16.51s/it]Best trial: 58. Best value: 0.574891:  63%|██████▎   | 126/200 [43:02<20:56, 16.97s/it]Best trial: 58. Best value: 0.574891:  63%|██████▎   | 126/200 [43:18<20:56, 16.97s/it]Best trial: 58. Best value: 0.574891:  64%|██████▎   | 127/200 [43:18<20:22, 16.75s/it]Best trial: 58. Best value: 0.574891:  64%|██████▎   | 127/200 [43:36<20:22, 16.75s/it]Best trial: 58. Best value: 0.574891:  64%|██████▍   | 128/200 [43:36<20:20, 16.95s/it]Best trial: 58. Best value: 0.574891:  64%|██████▍   | 128/200 [43:52<20:20, 16.95s/it]Best trial: 58. Best value: 0.574891:  64%|██████▍   | 129/200 [43:52<19:59, 16.90s/it]Best trial: 58. Best value: 0.574891:  64%|██████▍   | 129/200 [44:10<19:59, 16.90s/it]Best trial: 58. Best value: 0.574891:  65%|██████▌   | 130/200 [44:10<20:07, 17.25s/it]Best trial: 58. Best value: 0.574891:  65%|██████▌   | 130/200 [44:28<20:07, 17.25s/it]Best trial: 58. Best value: 0.574891:  66%|██████▌   | 131/200 [44:28<20:06, 17.49s/it]Best trial: 58. Best value: 0.574891:  66%|██████▌   | 131/200 [44:46<20:06, 17.49s/it]Best trial: 58. Best value: 0.574891:  66%|██████▌   | 132/200 [44:46<19:56, 17.60s/it]Best trial: 58. Best value: 0.574891:  66%|██████▌   | 132/200 [45:02<19:56, 17.60s/it]Best trial: 58. Best value: 0.574891:  66%|██████▋   | 133/200 [45:02<19:02, 17.06s/it]Best trial: 58. Best value: 0.574891:  66%|██████▋   | 133/200 [45:17<19:02, 17.06s/it]Best trial: 58. Best value: 0.574891:  67%|██████▋   | 134/200 [45:17<18:10, 16.53s/it]Best trial: 58. Best value: 0.574891:  67%|██████▋   | 134/200 [45:34<18:10, 16.53s/it]Best trial: 58. Best value: 0.574891:  68%|██████▊   | 135/200 [45:34<17:53, 16.51s/it]Best trial: 58. Best value: 0.574891:  68%|██████▊   | 135/200 [45:49<17:53, 16.51s/it]Best trial: 58. Best value: 0.574891:  68%|██████▊   | 136/200 [45:49<17:11, 16.11s/it]Best trial: 58. Best value: 0.574891:  68%|██████▊   | 136/200 [46:04<17:11, 16.11s/it]Best trial: 58. Best value: 0.574891:  68%|██████▊   | 137/200 [46:04<16:42, 15.90s/it]Best trial: 58. Best value: 0.574891:  68%|██████▊   | 137/200 [46:24<16:42, 15.90s/it]Best trial: 58. Best value: 0.574891:  69%|██████▉   | 138/200 [46:24<17:35, 17.02s/it]Best trial: 58. Best value: 0.574891:  69%|██████▉   | 138/200 [46:42<17:35, 17.02s/it]Best trial: 58. Best value: 0.574891:  70%|██████▉   | 139/200 [46:42<17:27, 17.18s/it]Best trial: 58. Best value: 0.574891:  70%|██████▉   | 139/200 [47:15<17:27, 17.18s/it]Best trial: 58. Best value: 0.574891:  70%|███████   | 140/200 [47:15<22:00, 22.01s/it]Best trial: 58. Best value: 0.574891:  70%|███████   | 140/200 [47:32<22:00, 22.01s/it]Best trial: 58. Best value: 0.574891:  70%|███████   | 141/200 [47:32<20:10, 20.52s/it]Best trial: 58. Best value: 0.574891:  70%|███████   | 141/200 [47:49<20:10, 20.52s/it]Best trial: 58. Best value: 0.574891:  71%|███████   | 142/200 [47:49<18:54, 19.56s/it]Best trial: 58. Best value: 0.574891:  71%|███████   | 142/200 [48:05<18:54, 19.56s/it]Best trial: 58. Best value: 0.574891:  72%|███████▏  | 143/200 [48:05<17:34, 18.50s/it]Best trial: 58. Best value: 0.574891:  72%|███████▏  | 143/200 [48:23<17:34, 18.50s/it]Best trial: 58. Best value: 0.574891:  72%|███████▏  | 144/200 [48:23<16:57, 18.16s/it]Best trial: 58. Best value: 0.574891:  72%|███████▏  | 144/200 [48:40<16:57, 18.16s/it]Best trial: 58. Best value: 0.574891:  72%|███████▎  | 145/200 [48:40<16:24, 17.89s/it]Best trial: 58. Best value: 0.574891:  72%|███████▎  | 145/200 [48:55<16:24, 17.89s/it]Best trial: 58. Best value: 0.574891:  73%|███████▎  | 146/200 [48:55<15:14, 16.93s/it]Best trial: 58. Best value: 0.574891:  73%|███████▎  | 146/200 [49:23<15:14, 16.93s/it]Best trial: 58. Best value: 0.574891:  74%|███████▎  | 147/200 [49:23<18:05, 20.47s/it]Best trial: 58. Best value: 0.574891:  74%|███████▎  | 147/200 [49:37<18:05, 20.47s/it]Best trial: 58. Best value: 0.574891:  74%|███████▍  | 148/200 [49:37<16:04, 18.55s/it]Best trial: 58. Best value: 0.574891:  74%|███████▍  | 148/200 [49:58<16:04, 18.55s/it]Best trial: 58. Best value: 0.574891:  74%|███████▍  | 149/200 [49:58<16:20, 19.23s/it]Best trial: 58. Best value: 0.574891:  74%|███████▍  | 149/200 [50:16<16:20, 19.23s/it]Best trial: 58. Best value: 0.574891:  75%|███████▌  | 150/200 [50:16<15:46, 18.93s/it]Best trial: 58. Best value: 0.574891:  75%|███████▌  | 150/200 [50:35<15:46, 18.93s/it]Best trial: 58. Best value: 0.574891:  76%|███████▌  | 151/200 [50:35<15:27, 18.94s/it]Best trial: 58. Best value: 0.574891:  76%|███████▌  | 151/200 [50:51<15:27, 18.94s/it]Best trial: 58. Best value: 0.574891:  76%|███████▌  | 152/200 [50:51<14:20, 17.92s/it]Best trial: 58. Best value: 0.574891:  76%|███████▌  | 152/200 [51:10<14:20, 17.92s/it]Best trial: 58. Best value: 0.574891:  76%|███████▋  | 153/200 [51:10<14:14, 18.17s/it]Best trial: 58. Best value: 0.574891:  76%|███████▋  | 153/200 [51:27<14:14, 18.17s/it]Best trial: 58. Best value: 0.574891:  77%|███████▋  | 154/200 [51:27<13:46, 17.97s/it]Best trial: 58. Best value: 0.574891:  77%|███████▋  | 154/200 [51:43<13:46, 17.97s/it]Best trial: 58. Best value: 0.574891:  78%|███████▊  | 155/200 [51:43<12:53, 17.19s/it]Best trial: 58. Best value: 0.574891:  78%|███████▊  | 155/200 [52:00<12:53, 17.19s/it]Best trial: 58. Best value: 0.574891:  78%|███████▊  | 156/200 [52:00<12:45, 17.40s/it]Best trial: 58. Best value: 0.574891:  78%|███████▊  | 156/200 [52:16<12:45, 17.40s/it]Best trial: 58. Best value: 0.574891:  78%|███████▊  | 157/200 [52:16<12:08, 16.95s/it]Best trial: 58. Best value: 0.574891:  78%|███████▊  | 157/200 [52:31<12:08, 16.95s/it]Best trial: 58. Best value: 0.574891:  79%|███████▉  | 158/200 [52:31<11:18, 16.16s/it]Best trial: 58. Best value: 0.574891:  79%|███████▉  | 158/200 [52:55<11:18, 16.16s/it]Best trial: 58. Best value: 0.574891:  80%|███████▉  | 159/200 [52:55<12:42, 18.60s/it]Best trial: 58. Best value: 0.574891:  80%|███████▉  | 159/200 [53:10<12:42, 18.60s/it]Best trial: 58. Best value: 0.574891:  80%|████████  | 160/200 [53:10<11:38, 17.47s/it]Best trial: 58. Best value: 0.574891:  80%|████████  | 160/200 [53:24<11:38, 17.47s/it]Best trial: 58. Best value: 0.574891:  80%|████████  | 161/200 [53:24<10:44, 16.52s/it]Best trial: 58. Best value: 0.574891:  80%|████████  | 161/200 [53:41<10:44, 16.52s/it]Best trial: 58. Best value: 0.574891:  81%|████████  | 162/200 [53:41<10:28, 16.55s/it]Best trial: 58. Best value: 0.574891:  81%|████████  | 162/200 [53:56<10:28, 16.55s/it]Best trial: 58. Best value: 0.574891:  82%|████████▏ | 163/200 [53:56<10:02, 16.28s/it]Best trial: 58. Best value: 0.574891:  82%|████████▏ | 163/200 [54:14<10:02, 16.28s/it]Best trial: 58. Best value: 0.574891:  82%|████████▏ | 164/200 [54:14<10:01, 16.71s/it]Best trial: 58. Best value: 0.574891:  82%|████████▏ | 164/200 [54:30<10:01, 16.71s/it]Best trial: 58. Best value: 0.574891:  82%|████████▎ | 165/200 [54:30<09:41, 16.61s/it]Best trial: 58. Best value: 0.574891:  82%|████████▎ | 165/200 [54:47<09:41, 16.61s/it]Best trial: 58. Best value: 0.574891:  83%|████████▎ | 166/200 [54:47<09:22, 16.54s/it]Best trial: 58. Best value: 0.574891:  83%|████████▎ | 166/200 [55:03<09:22, 16.54s/it]Best trial: 58. Best value: 0.574891:  84%|████████▎ | 167/200 [55:03<08:57, 16.29s/it]Best trial: 58. Best value: 0.574891:  84%|████████▎ | 167/200 [55:19<08:57, 16.29s/it]Best trial: 58. Best value: 0.574891:  84%|████████▍ | 168/200 [55:19<08:46, 16.46s/it]Best trial: 58. Best value: 0.574891:  84%|████████▍ | 168/200 [55:39<08:46, 16.46s/it]Best trial: 58. Best value: 0.574891:  84%|████████▍ | 169/200 [55:39<08:55, 17.29s/it]Best trial: 58. Best value: 0.574891:  84%|████████▍ | 169/200 [55:59<08:55, 17.29s/it]Best trial: 58. Best value: 0.574891:  85%|████████▌ | 170/200 [55:59<09:08, 18.29s/it]Best trial: 58. Best value: 0.574891:  85%|████████▌ | 170/200 [56:17<09:08, 18.29s/it]Best trial: 58. Best value: 0.574891:  86%|████████▌ | 171/200 [56:17<08:47, 18.20s/it]Best trial: 58. Best value: 0.574891:  86%|████████▌ | 171/200 [56:40<08:47, 18.20s/it]Best trial: 58. Best value: 0.574891:  86%|████████▌ | 172/200 [56:40<09:09, 19.61s/it]Best trial: 58. Best value: 0.574891:  86%|████████▌ | 172/200 [57:03<09:09, 19.61s/it]Best trial: 58. Best value: 0.574891:  86%|████████▋ | 173/200 [57:03<09:17, 20.65s/it]Best trial: 58. Best value: 0.574891:  86%|████████▋ | 173/200 [57:36<09:17, 20.65s/it]Best trial: 58. Best value: 0.574891:  87%|████████▋ | 174/200 [57:36<10:32, 24.33s/it]Best trial: 58. Best value: 0.574891:  87%|████████▋ | 174/200 [58:01<10:32, 24.33s/it]Best trial: 58. Best value: 0.574891:  88%|████████▊ | 175/200 [58:01<10:11, 24.45s/it]Best trial: 58. Best value: 0.574891:  88%|████████▊ | 175/200 [58:24<10:11, 24.45s/it]Best trial: 58. Best value: 0.574891:  88%|████████▊ | 176/200 [58:24<09:38, 24.11s/it]Best trial: 58. Best value: 0.574891:  88%|████████▊ | 176/200 [58:43<09:38, 24.11s/it]Best trial: 58. Best value: 0.574891:  88%|████████▊ | 177/200 [58:43<08:40, 22.62s/it]Best trial: 58. Best value: 0.574891:  88%|████████▊ | 177/200 [59:01<08:40, 22.62s/it]Best trial: 58. Best value: 0.574891:  89%|████████▉ | 178/200 [59:01<07:43, 21.08s/it]Best trial: 58. Best value: 0.574891:  89%|████████▉ | 178/200 [59:20<07:43, 21.08s/it]Best trial: 58. Best value: 0.574891:  90%|████████▉ | 179/200 [59:20<07:10, 20.50s/it]Best trial: 58. Best value: 0.574891:  90%|████████▉ | 179/200 [59:41<07:10, 20.50s/it]Best trial: 58. Best value: 0.574891:  90%|█████████ | 180/200 [59:41<06:52, 20.65s/it]Best trial: 58. Best value: 0.574891:  90%|█████████ | 180/200 [59:56<06:52, 20.65s/it]Best trial: 58. Best value: 0.574891:  90%|█████████ | 181/200 [59:56<05:57, 18.83s/it]Best trial: 58. Best value: 0.574891:  90%|█████████ | 181/200 [1:00:16<05:57, 18.83s/it]Best trial: 58. Best value: 0.574891:  91%|█████████ | 182/200 [1:00:16<05:48, 19.34s/it]Best trial: 58. Best value: 0.574891:  91%|█████████ | 182/200 [1:00:32<05:48, 19.34s/it]Best trial: 58. Best value: 0.574891:  92%|█████████▏| 183/200 [1:00:32<05:12, 18.40s/it]Best trial: 58. Best value: 0.574891:  92%|█████████▏| 183/200 [1:00:46<05:12, 18.40s/it]Best trial: 58. Best value: 0.574891:  92%|█████████▏| 184/200 [1:00:46<04:30, 16.88s/it]Best trial: 58. Best value: 0.574891:  92%|█████████▏| 184/200 [1:01:04<04:30, 16.88s/it]Best trial: 58. Best value: 0.574891:  92%|█████████▎| 185/200 [1:01:04<04:18, 17.22s/it]Best trial: 58. Best value: 0.574891:  92%|█████████▎| 185/200 [1:01:18<04:18, 17.22s/it]Best trial: 58. Best value: 0.574891:  93%|█████████▎| 186/200 [1:01:18<03:49, 16.41s/it]Best trial: 58. Best value: 0.574891:  93%|█████████▎| 186/200 [1:01:36<03:49, 16.41s/it]Best trial: 58. Best value: 0.574891:  94%|█████████▎| 187/200 [1:01:36<03:40, 16.98s/it]Best trial: 58. Best value: 0.574891:  94%|█████████▎| 187/200 [1:01:53<03:40, 16.98s/it]Best trial: 58. Best value: 0.574891:  94%|█████████▍| 188/200 [1:01:53<03:22, 16.86s/it]Best trial: 58. Best value: 0.574891:  94%|█████████▍| 188/200 [1:02:27<03:22, 16.86s/it]Best trial: 58. Best value: 0.574891:  94%|█████████▍| 189/200 [1:02:27<04:00, 21.86s/it]Best trial: 58. Best value: 0.574891:  94%|█████████▍| 189/200 [1:02:47<04:00, 21.86s/it]Best trial: 58. Best value: 0.574891:  95%|█████████▌| 190/200 [1:02:47<03:32, 21.29s/it]Best trial: 58. Best value: 0.574891:  95%|█████████▌| 190/200 [1:03:13<03:32, 21.29s/it]Best trial: 58. Best value: 0.574891:  96%|█████████▌| 191/200 [1:03:13<03:24, 22.72s/it]Best trial: 58. Best value: 0.574891:  96%|█████████▌| 191/200 [1:03:33<03:24, 22.72s/it]Best trial: 58. Best value: 0.574891:  96%|█████████▌| 192/200 [1:03:33<02:56, 22.02s/it]Best trial: 58. Best value: 0.574891:  96%|█████████▌| 192/200 [1:03:49<02:56, 22.02s/it]Best trial: 58. Best value: 0.574891:  96%|█████████▋| 193/200 [1:03:49<02:20, 20.10s/it]Best trial: 58. Best value: 0.574891:  96%|█████████▋| 193/200 [1:04:07<02:20, 20.10s/it]Best trial: 58. Best value: 0.574891:  97%|█████████▋| 194/200 [1:04:07<01:57, 19.66s/it]Best trial: 58. Best value: 0.574891:  97%|█████████▋| 194/200 [1:04:33<01:57, 19.66s/it]Best trial: 58. Best value: 0.574891:  98%|█████████▊| 195/200 [1:04:33<01:46, 21.38s/it]Best trial: 58. Best value: 0.574891:  98%|█████████▊| 195/200 [1:05:04<01:46, 21.38s/it]Best trial: 58. Best value: 0.574891:  98%|█████████▊| 196/200 [1:05:04<01:37, 24.40s/it]Best trial: 58. Best value: 0.574891:  98%|█████████▊| 196/200 [1:05:24<01:37, 24.40s/it]Best trial: 58. Best value: 0.574891:  98%|█████████▊| 197/200 [1:05:24<01:09, 23.07s/it]Best trial: 58. Best value: 0.574891:  98%|█████████▊| 197/200 [1:05:50<01:09, 23.07s/it]Best trial: 58. Best value: 0.574891:  99%|█████████▉| 198/200 [1:05:50<00:48, 24.07s/it]Best trial: 58. Best value: 0.574891:  99%|█████████▉| 198/200 [1:06:15<00:48, 24.07s/it]Best trial: 58. Best value: 0.574891: 100%|█████████▉| 199/200 [1:06:15<00:24, 24.16s/it]Best trial: 58. Best value: 0.574891: 100%|█████████▉| 199/200 [1:06:30<00:24, 24.16s/it]Best trial: 58. Best value: 0.574891: 100%|██████████| 200/200 [1:06:30<00:00, 21.33s/it]Best trial: 58. Best value: 0.574891: 100%|██████████| 200/200 [1:06:30<00:00, 19.95s/it]
23:40:50 [INFO] models.training.ordinal_trainer: Best params: {'bootstrap_type': 'Bayesian', 'grow_policy': 'SymmetricTree', 'depth': 5, 'iterations': 240, 'learning_rate': 0.0216372071218948, 'border_count': 77, 'l2_leaf_reg': 1.5103200226223634, 'min_data_in_leaf': 46, 'random_strength': 1.4561510192407128, 'colsample_bylevel': 0.6970362809387675, 'bagging_temperature': 0.7585338899183619}
23:40:50 [INFO] models.training.ordinal_trainer: Best Within-2 Rate: 0.5749
23:40:52 [INFO] models.training.ordinal_trainer:   Threshold -11: trained (pos_rate=94.5%)
23:40:54 [INFO] models.training.ordinal_trainer:   Threshold -10: trained (pos_rate=93.6%)
23:40:56 [INFO] models.training.ordinal_trainer:   Threshold -9: trained (pos_rate=92.4%)
23:40:57 [INFO] models.training.ordinal_trainer:   Threshold -8: trained (pos_rate=91.6%)
23:40:59 [INFO] models.training.ordinal_trainer:   Threshold -7: trained (pos_rate=89.6%)
23:41:01 [INFO] models.training.ordinal_trainer:   Threshold -6: trained (pos_rate=88.3%)
23:41:06 [INFO] models.training.ordinal_trainer:   Threshold -5: trained (pos_rate=85.8%)
23:41:07 [INFO] models.training.ordinal_trainer:   Threshold -4: trained (pos_rate=83.6%)
23:41:10 [INFO] models.training.ordinal_trainer:   Threshold -3: trained (pos_rate=80.0%)
23:41:13 [INFO] models.training.ordinal_trainer:   Threshold -2: trained (pos_rate=76.6%)
23:41:16 [INFO] models.training.ordinal_trainer:   Threshold -1: trained (pos_rate=70.9%)
23:41:19 [INFO] models.training.ordinal_trainer:   Threshold +0: trained (pos_rate=65.0%)
23:41:24 [INFO] models.training.ordinal_trainer:   Threshold +1: trained (pos_rate=46.5%)
23:41:27 [INFO] models.training.ordinal_trainer:   Threshold +2: trained (pos_rate=38.1%)
23:41:29 [INFO] models.training.ordinal_trainer:   Threshold +3: trained (pos_rate=30.2%)
23:41:31 [INFO] models.training.ordinal_trainer:   Threshold +4: trained (pos_rate=25.4%)
23:41:33 [INFO] models.training.ordinal_trainer:   Threshold +5: trained (pos_rate=19.8%)
23:41:36 [INFO] models.training.ordinal_trainer:   Threshold +6: trained (pos_rate=16.9%)
23:41:38 [INFO] models.training.ordinal_trainer:   Threshold +7: trained (pos_rate=13.8%)
23:41:40 [INFO] models.training.ordinal_trainer:   Threshold +8: trained (pos_rate=11.7%)
23:41:43 [INFO] models.training.ordinal_trainer:   Threshold +9: trained (pos_rate=9.2%)
23:41:47 [INFO] models.training.ordinal_trainer:   Threshold +10: trained (pos_rate=7.9%)
23:41:52 [INFO] models.training.ordinal_trainer:   Threshold +11: trained (pos_rate=6.3%)
23:41:56 [INFO] models.training.ordinal_trainer:   Threshold +12: trained (pos_rate=5.5%)
23:41:56 [INFO] models.training.ordinal_trainer: Ordinal training complete: 24 classifiers
23:41:58 [INFO] models.training.ordinal_trainer: Saved ordinal model to models/saved/austin/ordinal_catboost_optuna.pkl
23:41:58 [INFO] __main__: 
Saved model to models/saved/austin/ordinal_catboost_optuna.pkl
23:41:58 [INFO] __main__: Saved best params to models/saved/austin/best_params.json
23:41:58 [INFO] __main__: Saved final metrics to models/saved/austin/final_metrics_austin.json

============================================================
EVALUATION
============================================================

Test Set Metrics:
----------------------------------------
  delta_accuracy: 0.2497
  delta_mae: 2.3953
  off_by_1_rate: 0.2440
  off_by_2plus_rate: 0.5063
  within_1_rate: 0.4937
  within_2_rate: 0.6556

============================================================
FEATURE IMPORTANCE
============================================================

Top 30 Features:
                           feature  importance
0             fcst_peak_hour_float    6.493017
1          temp_zscore_vs_forecast    5.897062
2                   fcst_obs_ratio    5.811851
3            fcst_prev_hour_of_max    5.306311
4                err_max_pos_sofar    4.096922
5                 obs_fcst_max_gap    4.010899
6          confidence_weighted_gap    3.117029
7                 remaining_upside    2.958535
8             log_abs_obs_fcst_gap    2.919767
9             obs_fcst_gap_squared    2.702592
10      minutes_since_max_observed    2.695833
11           gap_x_hours_remaining    1.828104
12                  vc_q90_f_sofar    1.826945
13        fcst_peak_band_width_min    1.685068
14        fcst_remaining_potential    1.662735
15            fcst_cloudcover_mean    1.482564
16          log_minutes_since_open    1.373258
17      fcst_humidity_morning_mean    1.264021
18             fcst_cloudcover_max    1.240412
19        pred_plateau_20min_sofar    1.216941
20               fcst_multi_median    1.110683
21                         doy_sin    1.080584
22  log_expected_delta_uncertainty    1.078449
23                 fcst_prev_std_f    1.070769
24      expected_delta_uncertainty    1.010084
25              fcst_humidity_mean    0.958802
26                           month    0.949256
27               num_samples_sofar    0.945967
28    fcst_humidity_afternoon_mean    0.938336
29            hours_until_fcst_max    0.911157

----------------------------------------
Station-city feature importance:
                         feature  importance
53    station_city_max_gap_sofar    0.501776
67   station_city_mean_gap_sofar    0.354411
118         station_city_gap_std    0.027450
120       station_city_gap_trend    0.025578
154        station_city_temp_gap    0.000000
176  station_city_gap_x_fcst_gap    0.000000
  station_city_max_gap_sofar: rank 54/201
  station_city_mean_gap_sofar: rank 68/201
  station_city_gap_std: rank 119/201
  station_city_gap_trend: rank 121/201
  station_city_temp_gap: rank 155/201
  station_city_gap_x_fcst_gap: rank 177/201

----------------------------------------
Multi-horizon feature importance:
                  feature  importance
20      fcst_multi_median    1.110683
33  fcst_multi_t1_t2_diff    0.824233
43        fcst_multi_mean    0.596511
47   fcst_multi_range_pct    0.556091
52         fcst_multi_ema    0.509183
65          fcst_multi_cv    0.359779
69       fcst_multi_range    0.339544
79         fcst_multi_std    0.228968
83       fcst_multi_drift    0.212085
  fcst_multi_median: rank 21/201
  fcst_multi_t1_t2_diff: rank 34/201
  fcst_multi_mean: rank 44/201
  fcst_multi_range_pct: rank 48/201
  fcst_multi_ema: rank 53/201
  fcst_multi_cv: rank 66/201
  fcst_multi_range: rank 70/201
  fcst_multi_std: rank 80/201
  fcst_multi_drift: rank 84/201

============================================================
SUMMARY
============================================================
City: austin
Model: models/saved/austin/ordinal_catboost_optuna.pkl
Params: models/saved/austin/best_params.json
Metrics: models/saved/austin/final_metrics_austin.json
Training samples: 389,784
Test samples: 97,128
Optuna trials: 200
Best params: {'bootstrap_type': 'Bayesian', 'grow_policy': 'SymmetricTree', 'depth': 5, 'iterations': 240, 'learning_rate': 0.0216372071218948, 'border_count': 77, 'l2_leaf_reg': 1.5103200226223634, 'min_data_in_leaf': 46, 'random_strength': 1.4561510192407128, 'colsample_bylevel': 0.6970362809387675, 'bagging_temperature': 0.7585338899183619}

Key Metrics:
  Accuracy: 25.0%
  MAE: 2.40
  Within 1: 49.4%
  Within 2: 65.6%

============================================================
DONE
============================================================
