23:41:58 [INFO] __main__: ============================================================
23:41:58 [INFO] __main__: CHICAGO Optuna Training (200 trials)
23:41:58 [INFO] __main__: Optimization objective: within2
23:41:58 [INFO] __main__: ============================================================
23:41:58 [INFO] __main__: Loading from training cache: data/training_cache/chicago/full.parquet
23:41:59 [INFO] __main__: Loaded 486,912 rows, 237 columns
23:41:59 [INFO] __main__: Data range after filtering: 2023-01-01 to 2025-12-03
23:42:00 [INFO] __main__: Total days: 1068
23:42:00 [INFO] __main__: Training: 2023-01-01 to 2025-05-04 (855 days)
23:42:00 [INFO] __main__: Testing:  2025-05-05 to 2025-12-03 (213 days)
23:42:00 [INFO] __main__: 
Training samples: 389,784
23:42:00 [INFO] __main__: Training days: 855
23:42:00 [INFO] __main__: Test samples: 97,128
23:42:00 [INFO] __main__: Test days: 213
23:42:00 [INFO] __main__: 
Station-city features: ['station_city_temp_gap', 'station_city_max_gap_sofar', 'station_city_mean_gap_sofar', 'station_city_gap_std', 'station_city_gap_trend', 'station_city_gap_x_fcst_gap']
23:42:00 [INFO] __main__:   station_city_temp_gap: 389,592/389,784 non-null (100.0%)
23:42:00 [INFO] __main__:   station_city_max_gap_sofar: 389,592/389,784 non-null (100.0%)
23:42:00 [INFO] __main__:   station_city_mean_gap_sofar: 389,592/389,784 non-null (100.0%)
23:42:00 [INFO] __main__:   station_city_gap_std: 389,592/389,784 non-null (100.0%)
23:42:00 [INFO] __main__:   station_city_gap_trend: 389,583/389,784 non-null (99.9%)
23:42:00 [INFO] __main__:   station_city_gap_x_fcst_gap: 388,680/389,784 non-null (99.7%)
23:42:00 [INFO] __main__: 
Multi-horizon features: ['fcst_multi_mean', 'fcst_multi_median', 'fcst_multi_ema', 'fcst_multi_std', 'fcst_multi_range', 'fcst_multi_t1_t2_diff', 'fcst_multi_drift', 'fcst_multi_cv', 'fcst_multi_range_pct']
23:42:00 [INFO] __main__:   fcst_multi_mean: 389,784/389,784 non-null (100.0%)
23:42:00 [INFO] __main__:   fcst_multi_median: 389,784/389,784 non-null (100.0%)
23:42:00 [INFO] __main__:   fcst_multi_ema: 389,784/389,784 non-null (100.0%)
23:42:00 [INFO] __main__:   fcst_multi_std: 389,784/389,784 non-null (100.0%)
23:42:00 [INFO] __main__:   fcst_multi_range: 389,784/389,784 non-null (100.0%)
23:42:00 [INFO] __main__:   fcst_multi_t1_t2_diff: 387,960/389,784 non-null (99.5%)
23:42:00 [INFO] __main__:   fcst_multi_drift: 387,960/389,784 non-null (99.5%)
23:42:00 [INFO] __main__:   fcst_multi_cv: 389,784/389,784 non-null (100.0%)
23:42:00 [INFO] __main__:   fcst_multi_range_pct: 389,784/389,784 non-null (100.0%)
23:42:00 [INFO] models.training.ordinal_trainer: Training ordinal model (catboost) on 389784 samples
23:42:02 [INFO] models.training.ordinal_trainer: City delta range: [-12, 12]
23:42:02 [INFO] models.training.ordinal_trainer: Training 24 threshold classifiers: [-11, -10, -9, -8, -7, -6, -5, -4, -3, -2, -1, 0, 1, 2, 3, 4, 5, 6, 7, 8, 9, 10, 11, 12]
23:42:02 [INFO] models.training.ordinal_trainer: Starting Optuna tuning with 200 trials (objective=within2)

============================================================
OPTUNA TRAINING (200 trials, objective=within2)
============================================================
  0%|          | 0/200 [00:00<?, ?it/s]Best trial: 0. Best value: 0.438199:   0%|          | 0/200 [00:20<?, ?it/s]Best trial: 0. Best value: 0.438199:   0%|          | 1/200 [00:20<1:07:27, 20.34s/it]Best trial: 0. Best value: 0.438199:   0%|          | 1/200 [00:55<1:07:27, 20.34s/it]Best trial: 0. Best value: 0.438199:   1%|          | 2/200 [00:55<1:35:45, 29.02s/it]Best trial: 2. Best value: 0.465596:   1%|          | 2/200 [01:26<1:35:45, 29.02s/it]Best trial: 2. Best value: 0.465596:   2%|▏         | 3/200 [01:26<1:37:56, 29.83s/it]Best trial: 3. Best value: 0.51124:   2%|▏         | 3/200 [01:51<1:37:56, 29.83s/it] Best trial: 3. Best value: 0.51124:   2%|▏         | 4/200 [01:51<1:31:12, 27.92s/it]Best trial: 3. Best value: 0.51124:   2%|▏         | 4/200 [02:24<1:31:12, 27.92s/it]Best trial: 3. Best value: 0.51124:   2%|▎         | 5/200 [02:24<1:37:19, 29.95s/it]Best trial: 3. Best value: 0.51124:   2%|▎         | 5/200 [02:41<1:37:19, 29.95s/it]Best trial: 3. Best value: 0.51124:   3%|▎         | 6/200 [02:41<1:21:56, 25.34s/it]Best trial: 3. Best value: 0.51124:   3%|▎         | 6/200 [03:09<1:21:56, 25.34s/it]Best trial: 3. Best value: 0.51124:   4%|▎         | 7/200 [03:09<1:24:32, 26.28s/it]Best trial: 3. Best value: 0.51124:   4%|▎         | 7/200 [03:52<1:24:32, 26.28s/it]Best trial: 3. Best value: 0.51124:   4%|▍         | 8/200 [03:52<1:41:04, 31.58s/it]Best trial: 3. Best value: 0.51124:   4%|▍         | 8/200 [04:21<1:41:04, 31.58s/it]Best trial: 3. Best value: 0.51124:   4%|▍         | 9/200 [04:21<1:37:55, 30.76s/it]Best trial: 3. Best value: 0.51124:   4%|▍         | 9/200 [05:06<1:37:55, 30.76s/it]Best trial: 3. Best value: 0.51124:   5%|▌         | 10/200 [05:06<1:51:23, 35.18s/it]Best trial: 3. Best value: 0.51124:   5%|▌         | 10/200 [05:28<1:51:23, 35.18s/it]Best trial: 3. Best value: 0.51124:   6%|▌         | 11/200 [05:28<1:37:54, 31.08s/it]Best trial: 3. Best value: 0.51124:   6%|▌         | 11/200 [05:48<1:37:54, 31.08s/it]Best trial: 3. Best value: 0.51124:   6%|▌         | 12/200 [05:48<1:27:26, 27.91s/it]Best trial: 12. Best value: 0.512809:   6%|▌         | 12/200 [06:08<1:27:26, 27.91s/it]Best trial: 12. Best value: 0.512809:   6%|▋         | 13/200 [06:08<1:19:26, 25.49s/it]Best trial: 12. Best value: 0.512809:   6%|▋         | 13/200 [06:33<1:19:26, 25.49s/it]Best trial: 12. Best value: 0.512809:   7%|▋         | 14/200 [06:33<1:18:39, 25.37s/it]Best trial: 12. Best value: 0.512809:   7%|▋         | 14/200 [06:58<1:18:39, 25.37s/it]Best trial: 12. Best value: 0.512809:   8%|▊         | 15/200 [06:58<1:17:58, 25.29s/it]Best trial: 12. Best value: 0.512809:   8%|▊         | 15/200 [07:16<1:17:58, 25.29s/it]Best trial: 12. Best value: 0.512809:   8%|▊         | 16/200 [07:16<1:10:16, 22.92s/it]Best trial: 12. Best value: 0.512809:   8%|▊         | 16/200 [07:37<1:10:16, 22.92s/it]Best trial: 12. Best value: 0.512809:   8%|▊         | 17/200 [07:37<1:08:05, 22.33s/it]Best trial: 12. Best value: 0.512809:   8%|▊         | 17/200 [07:57<1:08:05, 22.33s/it]Best trial: 12. Best value: 0.512809:   9%|▉         | 18/200 [07:57<1:05:42, 21.66s/it]Best trial: 12. Best value: 0.512809:   9%|▉         | 18/200 [08:15<1:05:42, 21.66s/it]Best trial: 12. Best value: 0.512809:  10%|▉         | 19/200 [08:15<1:01:57, 20.54s/it]Best trial: 12. Best value: 0.512809:  10%|▉         | 19/200 [08:33<1:01:57, 20.54s/it]Best trial: 12. Best value: 0.512809:  10%|█         | 20/200 [08:33<59:41, 19.90s/it]  Best trial: 12. Best value: 0.512809:  10%|█         | 20/200 [09:03<59:41, 19.90s/it]Best trial: 12. Best value: 0.512809:  10%|█         | 21/200 [09:03<1:08:21, 22.91s/it]Best trial: 12. Best value: 0.512809:  10%|█         | 21/200 [09:29<1:08:21, 22.91s/it]Best trial: 12. Best value: 0.512809:  11%|█         | 22/200 [09:29<1:10:52, 23.89s/it]Best trial: 12. Best value: 0.512809:  11%|█         | 22/200 [09:51<1:10:52, 23.89s/it]Best trial: 12. Best value: 0.512809:  12%|█▏        | 23/200 [09:51<1:08:14, 23.13s/it]Best trial: 12. Best value: 0.512809:  12%|█▏        | 23/200 [10:19<1:08:14, 23.13s/it]Best trial: 12. Best value: 0.512809:  12%|█▏        | 24/200 [10:19<1:12:19, 24.65s/it]Best trial: 12. Best value: 0.512809:  12%|█▏        | 24/200 [10:40<1:12:19, 24.65s/it]Best trial: 12. Best value: 0.512809:  12%|█▎        | 25/200 [10:40<1:09:13, 23.73s/it]Best trial: 12. Best value: 0.512809:  12%|█▎        | 25/200 [11:00<1:09:13, 23.73s/it]Best trial: 12. Best value: 0.512809:  13%|█▎        | 26/200 [11:00<1:05:07, 22.46s/it]Best trial: 12. Best value: 0.512809:  13%|█▎        | 26/200 [11:20<1:05:07, 22.46s/it]Best trial: 12. Best value: 0.512809:  14%|█▎        | 27/200 [11:20<1:03:02, 21.87s/it]Best trial: 12. Best value: 0.512809:  14%|█▎        | 27/200 [11:42<1:03:02, 21.87s/it]Best trial: 12. Best value: 0.512809:  14%|█▍        | 28/200 [11:42<1:02:33, 21.82s/it]Best trial: 12. Best value: 0.512809:  14%|█▍        | 28/200 [11:57<1:02:33, 21.82s/it]Best trial: 12. Best value: 0.512809:  14%|█▍        | 29/200 [11:57<56:00, 19.65s/it]  Best trial: 12. Best value: 0.512809:  14%|█▍        | 29/200 [12:37<56:00, 19.65s/it]Best trial: 12. Best value: 0.512809:  15%|█▌        | 30/200 [12:37<1:12:51, 25.72s/it]Best trial: 12. Best value: 0.512809:  15%|█▌        | 30/200 [13:01<1:12:51, 25.72s/it]Best trial: 12. Best value: 0.512809:  16%|█▌        | 31/200 [13:01<1:11:04, 25.23s/it]Best trial: 12. Best value: 0.512809:  16%|█▌        | 31/200 [13:26<1:11:04, 25.23s/it]Best trial: 12. Best value: 0.512809:  16%|█▌        | 32/200 [13:26<1:10:17, 25.10s/it]Best trial: 12. Best value: 0.512809:  16%|█▌        | 32/200 [13:42<1:10:17, 25.10s/it]Best trial: 12. Best value: 0.512809:  16%|█▋        | 33/200 [13:42<1:02:43, 22.53s/it]Best trial: 12. Best value: 0.512809:  16%|█▋        | 33/200 [14:08<1:02:43, 22.53s/it]Best trial: 12. Best value: 0.512809:  17%|█▋        | 34/200 [14:08<1:05:28, 23.67s/it]Best trial: 12. Best value: 0.512809:  17%|█▋        | 34/200 [14:29<1:05:28, 23.67s/it]Best trial: 12. Best value: 0.512809:  18%|█▊        | 35/200 [14:29<1:02:52, 22.86s/it]Best trial: 12. Best value: 0.512809:  18%|█▊        | 35/200 [14:47<1:02:52, 22.86s/it]Best trial: 12. Best value: 0.512809:  18%|█▊        | 36/200 [14:47<58:18, 21.33s/it]  Best trial: 12. Best value: 0.512809:  18%|█▊        | 36/200 [15:16<58:18, 21.33s/it]Best trial: 12. Best value: 0.512809:  18%|█▊        | 37/200 [15:16<1:04:18, 23.67s/it]Best trial: 37. Best value: 0.513528:  18%|█▊        | 37/200 [15:39<1:04:18, 23.67s/it]Best trial: 37. Best value: 0.513528:  19%|█▉        | 38/200 [15:39<1:02:56, 23.31s/it]Best trial: 37. Best value: 0.513528:  19%|█▉        | 38/200 [16:30<1:02:56, 23.31s/it]Best trial: 37. Best value: 0.513528:  20%|█▉        | 39/200 [16:30<1:24:50, 31.62s/it]Best trial: 37. Best value: 0.513528:  20%|█▉        | 39/200 [16:55<1:24:50, 31.62s/it]Best trial: 37. Best value: 0.513528:  20%|██        | 40/200 [16:55<1:18:56, 29.60s/it]Best trial: 37. Best value: 0.513528:  20%|██        | 40/200 [17:42<1:18:56, 29.60s/it]Best trial: 37. Best value: 0.513528:  20%|██        | 41/200 [17:42<1:32:12, 34.80s/it]Best trial: 37. Best value: 0.513528:  20%|██        | 41/200 [17:59<1:32:12, 34.80s/it]Best trial: 37. Best value: 0.513528:  21%|██        | 42/200 [17:59<1:17:57, 29.60s/it]Best trial: 37. Best value: 0.513528:  21%|██        | 42/200 [18:20<1:17:57, 29.60s/it]Best trial: 37. Best value: 0.513528:  22%|██▏       | 43/200 [18:20<1:10:55, 27.10s/it]Best trial: 37. Best value: 0.513528:  22%|██▏       | 43/200 [18:36<1:10:55, 27.10s/it]Best trial: 37. Best value: 0.513528:  22%|██▏       | 44/200 [18:36<1:01:45, 23.75s/it]Best trial: 37. Best value: 0.513528:  22%|██▏       | 44/200 [18:58<1:01:45, 23.75s/it]Best trial: 37. Best value: 0.513528:  22%|██▎       | 45/200 [18:58<59:58, 23.22s/it]  Best trial: 37. Best value: 0.513528:  22%|██▎       | 45/200 [19:20<59:58, 23.22s/it]Best trial: 37. Best value: 0.513528:  23%|██▎       | 46/200 [19:20<58:34, 22.82s/it]Best trial: 37. Best value: 0.513528:  23%|██▎       | 46/200 [19:40<58:34, 22.82s/it]Best trial: 37. Best value: 0.513528:  24%|██▎       | 47/200 [19:40<55:58, 21.95s/it]Best trial: 37. Best value: 0.513528:  24%|██▎       | 47/200 [20:24<55:58, 21.95s/it]Best trial: 37. Best value: 0.513528:  24%|██▍       | 48/200 [20:24<1:12:07, 28.47s/it]Best trial: 37. Best value: 0.513528:  24%|██▍       | 48/200 [20:52<1:12:07, 28.47s/it]Best trial: 37. Best value: 0.513528:  24%|██▍       | 49/200 [20:52<1:11:25, 28.38s/it]Best trial: 37. Best value: 0.513528:  24%|██▍       | 49/200 [21:05<1:11:25, 28.38s/it]Best trial: 37. Best value: 0.513528:  25%|██▌       | 50/200 [21:05<59:52, 23.95s/it]  Best trial: 37. Best value: 0.513528:  25%|██▌       | 50/200 [21:30<59:52, 23.95s/it]Best trial: 37. Best value: 0.513528:  26%|██▌       | 51/200 [21:30<1:00:08, 24.22s/it]Best trial: 51. Best value: 0.523173:  26%|██▌       | 51/200 [21:54<1:00:08, 24.22s/it]Best trial: 51. Best value: 0.523173:  26%|██▌       | 52/200 [21:54<59:41, 24.20s/it]  Best trial: 51. Best value: 0.523173:  26%|██▌       | 52/200 [22:20<59:41, 24.20s/it]Best trial: 51. Best value: 0.523173:  26%|██▋       | 53/200 [22:20<1:00:21, 24.64s/it]Best trial: 51. Best value: 0.523173:  26%|██▋       | 53/200 [22:46<1:00:21, 24.64s/it]Best trial: 51. Best value: 0.523173:  27%|██▋       | 54/200 [22:46<1:00:30, 24.87s/it]Best trial: 51. Best value: 0.523173:  27%|██▋       | 54/200 [23:20<1:00:30, 24.87s/it]Best trial: 51. Best value: 0.523173:  28%|██▊       | 55/200 [23:20<1:07:02, 27.74s/it]Best trial: 51. Best value: 0.523173:  28%|██▊       | 55/200 [23:47<1:07:02, 27.74s/it]Best trial: 51. Best value: 0.523173:  28%|██▊       | 56/200 [23:47<1:05:57, 27.48s/it]Best trial: 51. Best value: 0.523173:  28%|██▊       | 56/200 [24:05<1:05:57, 27.48s/it]Best trial: 51. Best value: 0.523173:  28%|██▊       | 57/200 [24:05<58:52, 24.70s/it]  Best trial: 51. Best value: 0.523173:  28%|██▊       | 57/200 [24:23<58:52, 24.70s/it]Best trial: 51. Best value: 0.523173:  29%|██▉       | 58/200 [24:23<53:17, 22.51s/it]Best trial: 51. Best value: 0.523173:  29%|██▉       | 58/200 [24:42<53:17, 22.51s/it]Best trial: 51. Best value: 0.523173:  30%|██▉       | 59/200 [24:42<50:29, 21.48s/it]Best trial: 51. Best value: 0.523173:  30%|██▉       | 59/200 [24:58<50:29, 21.48s/it]Best trial: 51. Best value: 0.523173:  30%|███       | 60/200 [24:58<46:33, 19.96s/it]Best trial: 51. Best value: 0.523173:  30%|███       | 60/200 [25:17<46:33, 19.96s/it]Best trial: 51. Best value: 0.523173:  30%|███       | 61/200 [25:17<45:36, 19.69s/it]Best trial: 51. Best value: 0.523173:  30%|███       | 61/200 [25:39<45:36, 19.69s/it]Best trial: 51. Best value: 0.523173:  31%|███       | 62/200 [25:39<46:34, 20.25s/it]Best trial: 51. Best value: 0.523173:  31%|███       | 62/200 [25:59<46:34, 20.25s/it]Best trial: 51. Best value: 0.523173:  32%|███▏      | 63/200 [25:59<46:12, 20.24s/it]Best trial: 51. Best value: 0.523173:  32%|███▏      | 63/200 [26:22<46:12, 20.24s/it]Best trial: 51. Best value: 0.523173:  32%|███▏      | 64/200 [26:22<48:06, 21.23s/it]Best trial: 51. Best value: 0.523173:  32%|███▏      | 64/200 [26:44<48:06, 21.23s/it]Best trial: 51. Best value: 0.523173:  32%|███▎      | 65/200 [26:44<47:44, 21.22s/it]Best trial: 51. Best value: 0.523173:  32%|███▎      | 65/200 [27:05<47:44, 21.22s/it]Best trial: 51. Best value: 0.523173:  33%|███▎      | 66/200 [27:05<47:34, 21.30s/it]Best trial: 51. Best value: 0.523173:  33%|███▎      | 66/200 [27:25<47:34, 21.30s/it]Best trial: 51. Best value: 0.523173:  34%|███▎      | 67/200 [27:25<46:38, 21.04s/it]Best trial: 51. Best value: 0.523173:  34%|███▎      | 67/200 [27:45<46:38, 21.04s/it]Best trial: 51. Best value: 0.523173:  34%|███▍      | 68/200 [27:45<44:57, 20.44s/it]Best trial: 51. Best value: 0.523173:  34%|███▍      | 68/200 [28:21<44:57, 20.44s/it]Best trial: 51. Best value: 0.523173:  34%|███▍      | 69/200 [28:21<55:27, 25.40s/it]Best trial: 51. Best value: 0.523173:  34%|███▍      | 69/200 [29:28<55:27, 25.40s/it]Best trial: 51. Best value: 0.523173:  35%|███▌      | 70/200 [29:28<1:21:27, 37.60s/it]Best trial: 51. Best value: 0.523173:  35%|███▌      | 70/200 [29:58<1:21:27, 37.60s/it]Best trial: 51. Best value: 0.523173:  36%|███▌      | 71/200 [29:58<1:16:03, 35.38s/it]Best trial: 51. Best value: 0.523173:  36%|███▌      | 71/200 [30:20<1:16:03, 35.38s/it]Best trial: 51. Best value: 0.523173:  36%|███▌      | 72/200 [30:20<1:07:07, 31.47s/it]Best trial: 51. Best value: 0.523173:  36%|███▌      | 72/200 [31:08<1:07:07, 31.47s/it]Best trial: 51. Best value: 0.523173:  36%|███▋      | 73/200 [31:08<1:17:02, 36.40s/it]Best trial: 51. Best value: 0.523173:  36%|███▋      | 73/200 [31:36<1:17:02, 36.40s/it]Best trial: 51. Best value: 0.523173:  37%|███▋      | 74/200 [31:36<1:11:00, 33.82s/it]Best trial: 51. Best value: 0.523173:  37%|███▋      | 74/200 [31:56<1:11:00, 33.82s/it]Best trial: 51. Best value: 0.523173:  38%|███▊      | 75/200 [31:56<1:01:44, 29.63s/it]Best trial: 51. Best value: 0.523173:  38%|███▊      | 75/200 [32:28<1:01:44, 29.63s/it]Best trial: 51. Best value: 0.523173:  38%|███▊      | 76/200 [32:28<1:02:40, 30.32s/it]Best trial: 51. Best value: 0.523173:  38%|███▊      | 76/200 [32:51<1:02:40, 30.32s/it]Best trial: 51. Best value: 0.523173:  38%|███▊      | 77/200 [32:51<57:57, 28.28s/it]  Best trial: 51. Best value: 0.523173:  38%|███▊      | 77/200 [33:06<57:57, 28.28s/it]Best trial: 51. Best value: 0.523173:  39%|███▉      | 78/200 [33:06<49:25, 24.31s/it]Best trial: 51. Best value: 0.523173:  39%|███▉      | 78/200 [33:32<49:25, 24.31s/it]Best trial: 51. Best value: 0.523173:  40%|███▉      | 79/200 [33:32<50:13, 24.90s/it]Best trial: 51. Best value: 0.523173:  40%|███▉      | 79/200 [33:53<50:13, 24.90s/it]Best trial: 51. Best value: 0.523173:  40%|████      | 80/200 [33:53<47:18, 23.65s/it]Best trial: 51. Best value: 0.523173:  40%|████      | 80/200 [34:14<47:18, 23.65s/it]Best trial: 51. Best value: 0.523173:  40%|████      | 81/200 [34:14<45:11, 22.78s/it]Best trial: 51. Best value: 0.523173:  40%|████      | 81/200 [34:33<45:11, 22.78s/it]Best trial: 51. Best value: 0.523173:  41%|████      | 82/200 [34:33<42:50, 21.79s/it]Best trial: 51. Best value: 0.523173:  41%|████      | 82/200 [34:53<42:50, 21.79s/it]Best trial: 51. Best value: 0.523173:  42%|████▏     | 83/200 [34:53<41:07, 21.09s/it]Best trial: 51. Best value: 0.523173:  42%|████▏     | 83/200 [35:15<41:07, 21.09s/it]Best trial: 51. Best value: 0.523173:  42%|████▏     | 84/200 [35:15<41:09, 21.29s/it]Best trial: 51. Best value: 0.523173:  42%|████▏     | 84/200 [35:34<41:09, 21.29s/it]Best trial: 51. Best value: 0.523173:  42%|████▎     | 85/200 [35:34<39:49, 20.77s/it]Best trial: 51. Best value: 0.523173:  42%|████▎     | 85/200 [35:52<39:49, 20.77s/it]Best trial: 51. Best value: 0.523173:  43%|████▎     | 86/200 [35:52<37:47, 19.89s/it]Best trial: 51. Best value: 0.523173:  43%|████▎     | 86/200 [36:11<37:47, 19.89s/it]Best trial: 51. Best value: 0.523173:  44%|████▎     | 87/200 [36:11<36:54, 19.60s/it]Best trial: 51. Best value: 0.523173:  44%|████▎     | 87/200 [36:29<36:54, 19.60s/it]Best trial: 51. Best value: 0.523173:  44%|████▍     | 88/200 [36:29<35:58, 19.27s/it]Best trial: 51. Best value: 0.523173:  44%|████▍     | 88/200 [36:50<35:58, 19.27s/it]Best trial: 51. Best value: 0.523173:  44%|████▍     | 89/200 [36:50<36:23, 19.67s/it]Best trial: 51. Best value: 0.523173:  44%|████▍     | 89/200 [37:08<36:23, 19.67s/it]Best trial: 51. Best value: 0.523173:  45%|████▌     | 90/200 [37:08<34:52, 19.02s/it]Best trial: 51. Best value: 0.523173:  45%|████▌     | 90/200 [37:26<34:52, 19.02s/it]Best trial: 51. Best value: 0.523173:  46%|████▌     | 91/200 [37:26<34:13, 18.84s/it]Best trial: 51. Best value: 0.523173:  46%|████▌     | 91/200 [37:45<34:13, 18.84s/it]Best trial: 51. Best value: 0.523173:  46%|████▌     | 92/200 [37:45<33:48, 18.78s/it]Best trial: 51. Best value: 0.523173:  46%|████▌     | 92/200 [38:02<33:48, 18.78s/it]Best trial: 51. Best value: 0.523173:  46%|████▋     | 93/200 [38:02<32:38, 18.31s/it]Best trial: 51. Best value: 0.523173:  46%|████▋     | 93/200 [38:21<32:38, 18.31s/it]Best trial: 51. Best value: 0.523173:  47%|████▋     | 94/200 [38:21<32:56, 18.65s/it]Best trial: 51. Best value: 0.523173:  47%|████▋     | 94/200 [38:40<32:56, 18.65s/it]Best trial: 51. Best value: 0.523173:  48%|████▊     | 95/200 [38:40<32:55, 18.81s/it]Best trial: 51. Best value: 0.523173:  48%|████▊     | 95/200 [38:59<32:55, 18.81s/it]Best trial: 51. Best value: 0.523173:  48%|████▊     | 96/200 [38:59<32:39, 18.84s/it]Best trial: 51. Best value: 0.523173:  48%|████▊     | 96/200 [39:21<32:39, 18.84s/it]Best trial: 51. Best value: 0.523173:  48%|████▊     | 97/200 [39:21<33:50, 19.71s/it]Best trial: 51. Best value: 0.523173:  48%|████▊     | 97/200 [39:38<33:50, 19.71s/it]Best trial: 51. Best value: 0.523173:  49%|████▉     | 98/200 [39:38<31:56, 18.79s/it]Best trial: 51. Best value: 0.523173:  49%|████▉     | 98/200 [40:06<31:56, 18.79s/it]Best trial: 51. Best value: 0.523173:  50%|████▉     | 99/200 [40:06<36:37, 21.76s/it]Best trial: 51. Best value: 0.523173:  50%|████▉     | 99/200 [40:38<36:37, 21.76s/it]Best trial: 51. Best value: 0.523173:  50%|█████     | 100/200 [40:38<40:57, 24.58s/it]Best trial: 51. Best value: 0.523173:  50%|█████     | 100/200 [40:57<40:57, 24.58s/it]Best trial: 51. Best value: 0.523173:  50%|█████     | 101/200 [40:57<37:57, 23.00s/it]Best trial: 51. Best value: 0.523173:  50%|█████     | 101/200 [41:23<37:57, 23.00s/it]Best trial: 51. Best value: 0.523173:  51%|█████     | 102/200 [41:23<39:04, 23.92s/it]Best trial: 51. Best value: 0.523173:  51%|█████     | 102/200 [41:40<39:04, 23.92s/it]Best trial: 51. Best value: 0.523173:  52%|█████▏    | 103/200 [41:40<35:09, 21.75s/it]Best trial: 51. Best value: 0.523173:  52%|█████▏    | 103/200 [41:56<35:09, 21.75s/it]Best trial: 51. Best value: 0.523173:  52%|█████▏    | 104/200 [41:56<32:27, 20.28s/it]Best trial: 51. Best value: 0.523173:  52%|█████▏    | 104/200 [42:14<32:27, 20.28s/it]Best trial: 51. Best value: 0.523173:  52%|█████▎    | 105/200 [42:14<30:42, 19.39s/it]Best trial: 51. Best value: 0.523173:  52%|█████▎    | 105/200 [42:37<30:42, 19.39s/it]Best trial: 51. Best value: 0.523173:  53%|█████▎    | 106/200 [42:37<31:56, 20.39s/it]Best trial: 51. Best value: 0.523173:  53%|█████▎    | 106/200 [42:54<31:56, 20.39s/it]Best trial: 51. Best value: 0.523173:  54%|█████▎    | 107/200 [42:54<30:12, 19.48s/it]Best trial: 51. Best value: 0.523173:  54%|█████▎    | 107/200 [43:14<30:12, 19.48s/it]Best trial: 51. Best value: 0.523173:  54%|█████▍    | 108/200 [43:14<30:18, 19.77s/it]Best trial: 51. Best value: 0.523173:  54%|█████▍    | 108/200 [43:35<30:18, 19.77s/it]Best trial: 51. Best value: 0.523173:  55%|█████▍    | 109/200 [43:35<30:36, 20.18s/it]Best trial: 51. Best value: 0.523173:  55%|█████▍    | 109/200 [44:06<30:36, 20.18s/it]Best trial: 51. Best value: 0.523173:  55%|█████▌    | 110/200 [44:06<35:08, 23.43s/it]Best trial: 51. Best value: 0.523173:  55%|█████▌    | 110/200 [44:25<35:08, 23.43s/it]Best trial: 51. Best value: 0.523173:  56%|█████▌    | 111/200 [44:25<32:29, 21.91s/it]Best trial: 51. Best value: 0.523173:  56%|█████▌    | 111/200 [44:43<32:29, 21.91s/it]Best trial: 51. Best value: 0.523173:  56%|█████▌    | 112/200 [44:43<30:30, 20.81s/it]Best trial: 51. Best value: 0.523173:  56%|█████▌    | 112/200 [45:02<30:30, 20.81s/it]Best trial: 51. Best value: 0.523173:  56%|█████▋    | 113/200 [45:02<29:21, 20.25s/it]Best trial: 51. Best value: 0.523173:  56%|█████▋    | 113/200 [45:23<29:21, 20.25s/it]Best trial: 51. Best value: 0.523173:  57%|█████▋    | 114/200 [45:23<29:32, 20.61s/it]Best trial: 51. Best value: 0.523173:  57%|█████▋    | 114/200 [45:45<29:32, 20.61s/it]Best trial: 51. Best value: 0.523173:  57%|█████▊    | 115/200 [45:45<29:28, 20.81s/it]Best trial: 51. Best value: 0.523173:  57%|█████▊    | 115/200 [46:10<29:28, 20.81s/it]Best trial: 51. Best value: 0.523173:  58%|█████▊    | 116/200 [46:10<30:47, 22.00s/it]Best trial: 51. Best value: 0.523173:  58%|█████▊    | 116/200 [46:38<30:47, 22.00s/it]Best trial: 51. Best value: 0.523173:  58%|█████▊    | 117/200 [46:38<33:13, 24.02s/it]Best trial: 51. Best value: 0.523173:  58%|█████▊    | 117/200 [46:59<33:13, 24.02s/it]Best trial: 51. Best value: 0.523173:  59%|█████▉    | 118/200 [46:59<31:34, 23.11s/it]Best trial: 51. Best value: 0.523173:  59%|█████▉    | 118/200 [47:18<31:34, 23.11s/it]Best trial: 51. Best value: 0.523173:  60%|█████▉    | 119/200 [47:18<29:28, 21.83s/it]Best trial: 51. Best value: 0.523173:  60%|█████▉    | 119/200 [47:37<29:28, 21.83s/it]Best trial: 51. Best value: 0.523173:  60%|██████    | 120/200 [47:37<27:47, 20.84s/it]Best trial: 51. Best value: 0.523173:  60%|██████    | 120/200 [48:18<27:47, 20.84s/it]Best trial: 51. Best value: 0.523173:  60%|██████    | 121/200 [48:18<35:36, 27.04s/it]Best trial: 51. Best value: 0.523173:  60%|██████    | 121/200 [48:47<35:36, 27.04s/it]Best trial: 51. Best value: 0.523173:  61%|██████    | 122/200 [48:47<35:59, 27.69s/it]Best trial: 51. Best value: 0.523173:  61%|██████    | 122/200 [49:16<35:59, 27.69s/it]Best trial: 51. Best value: 0.523173:  62%|██████▏   | 123/200 [49:16<35:51, 27.94s/it]Best trial: 51. Best value: 0.523173:  62%|██████▏   | 123/200 [49:35<35:51, 27.94s/it]Best trial: 51. Best value: 0.523173:  62%|██████▏   | 124/200 [49:35<32:04, 25.32s/it]Best trial: 51. Best value: 0.523173:  62%|██████▏   | 124/200 [50:05<32:04, 25.32s/it]Best trial: 51. Best value: 0.523173:  62%|██████▎   | 125/200 [50:05<33:21, 26.68s/it]Best trial: 51. Best value: 0.523173:  62%|██████▎   | 125/200 [50:23<33:21, 26.68s/it]Best trial: 51. Best value: 0.523173:  63%|██████▎   | 126/200 [50:23<29:53, 24.24s/it]Best trial: 51. Best value: 0.523173:  63%|██████▎   | 126/200 [50:50<29:53, 24.24s/it]Best trial: 51. Best value: 0.523173:  64%|██████▎   | 127/200 [50:50<30:19, 24.93s/it]Best trial: 51. Best value: 0.523173:  64%|██████▎   | 127/200 [51:11<30:19, 24.93s/it]Best trial: 51. Best value: 0.523173:  64%|██████▍   | 128/200 [51:11<28:32, 23.79s/it]Best trial: 51. Best value: 0.523173:  64%|██████▍   | 128/200 [51:30<28:32, 23.79s/it]Best trial: 51. Best value: 0.523173:  64%|██████▍   | 129/200 [51:30<26:17, 22.21s/it]Best trial: 51. Best value: 0.523173:  64%|██████▍   | 129/200 [51:53<26:17, 22.21s/it]Best trial: 51. Best value: 0.523173:  65%|██████▌   | 130/200 [51:53<26:12, 22.47s/it]Best trial: 51. Best value: 0.523173:  65%|██████▌   | 130/200 [52:11<26:12, 22.47s/it]Best trial: 51. Best value: 0.523173:  66%|██████▌   | 131/200 [52:11<24:23, 21.21s/it]Best trial: 51. Best value: 0.523173:  66%|██████▌   | 131/200 [52:27<24:23, 21.21s/it]Best trial: 51. Best value: 0.523173:  66%|██████▌   | 132/200 [52:27<22:14, 19.62s/it]Best trial: 51. Best value: 0.523173:  66%|██████▌   | 132/200 [52:48<22:14, 19.62s/it]Best trial: 51. Best value: 0.523173:  66%|██████▋   | 133/200 [52:48<22:17, 19.96s/it]Best trial: 51. Best value: 0.523173:  66%|██████▋   | 133/200 [53:13<22:17, 19.96s/it]Best trial: 51. Best value: 0.523173:  67%|██████▋   | 134/200 [53:13<23:37, 21.48s/it]Best trial: 51. Best value: 0.523173:  67%|██████▋   | 134/200 [53:29<23:37, 21.48s/it]Best trial: 51. Best value: 0.523173:  68%|██████▊   | 135/200 [53:29<21:29, 19.84s/it]Best trial: 51. Best value: 0.523173:  68%|██████▊   | 135/200 [53:52<21:29, 19.84s/it]Best trial: 51. Best value: 0.523173:  68%|██████▊   | 136/200 [53:52<22:10, 20.79s/it]Best trial: 51. Best value: 0.523173:  68%|██████▊   | 136/200 [54:06<22:10, 20.79s/it]Best trial: 51. Best value: 0.523173:  68%|██████▊   | 137/200 [54:06<19:54, 18.97s/it]Best trial: 51. Best value: 0.523173:  68%|██████▊   | 137/200 [54:30<19:54, 18.97s/it]Best trial: 51. Best value: 0.523173:  69%|██████▉   | 138/200 [54:30<20:56, 20.27s/it]Best trial: 51. Best value: 0.523173:  69%|██████▉   | 138/200 [54:46<20:56, 20.27s/it]Best trial: 51. Best value: 0.523173:  70%|██████▉   | 139/200 [54:46<19:29, 19.18s/it]Best trial: 51. Best value: 0.523173:  70%|██████▉   | 139/200 [55:27<19:29, 19.18s/it]Best trial: 51. Best value: 0.523173:  70%|███████   | 140/200 [55:27<25:31, 25.53s/it]Best trial: 51. Best value: 0.523173:  70%|███████   | 140/200 [55:48<25:31, 25.53s/it]Best trial: 51. Best value: 0.523173:  70%|███████   | 141/200 [55:48<23:46, 24.17s/it]Best trial: 51. Best value: 0.523173:  70%|███████   | 141/200 [56:16<23:46, 24.17s/it]Best trial: 51. Best value: 0.523173:  71%|███████   | 142/200 [56:16<24:28, 25.31s/it]Best trial: 51. Best value: 0.523173:  71%|███████   | 142/200 [56:43<24:28, 25.31s/it]Best trial: 51. Best value: 0.523173:  72%|███████▏  | 143/200 [56:43<24:32, 25.82s/it]Best trial: 51. Best value: 0.523173:  72%|███████▏  | 143/200 [57:10<24:32, 25.82s/it]Best trial: 51. Best value: 0.523173:  72%|███████▏  | 144/200 [57:10<24:24, 26.16s/it]Best trial: 51. Best value: 0.523173:  72%|███████▏  | 144/200 [57:39<24:24, 26.16s/it]Best trial: 51. Best value: 0.523173:  72%|███████▎  | 145/200 [57:39<24:45, 27.01s/it]Best trial: 51. Best value: 0.523173:  72%|███████▎  | 145/200 [58:11<24:45, 27.01s/it]Best trial: 51. Best value: 0.523173:  73%|███████▎  | 146/200 [58:11<25:53, 28.76s/it]Best trial: 51. Best value: 0.523173:  73%|███████▎  | 146/200 [58:33<25:53, 28.76s/it]Best trial: 51. Best value: 0.523173:  74%|███████▎  | 147/200 [58:33<23:23, 26.47s/it]Best trial: 51. Best value: 0.523173:  74%|███████▎  | 147/200 [58:53<23:23, 26.47s/it]Best trial: 51. Best value: 0.523173:  74%|███████▍  | 148/200 [58:53<21:23, 24.69s/it]Best trial: 51. Best value: 0.523173:  74%|███████▍  | 148/200 [59:18<21:23, 24.69s/it]Best trial: 51. Best value: 0.523173:  74%|███████▍  | 149/200 [59:18<20:56, 24.64s/it]Best trial: 51. Best value: 0.523173:  74%|███████▍  | 149/200 [59:39<20:56, 24.64s/it]Best trial: 51. Best value: 0.523173:  75%|███████▌  | 150/200 [59:39<19:46, 23.73s/it]Best trial: 51. Best value: 0.523173:  75%|███████▌  | 150/200 [1:00:03<19:46, 23.73s/it]Best trial: 51. Best value: 0.523173:  76%|███████▌  | 151/200 [1:00:03<19:26, 23.81s/it]Best trial: 51. Best value: 0.523173:  76%|███████▌  | 151/200 [1:00:30<19:26, 23.81s/it]Best trial: 51. Best value: 0.523173:  76%|███████▌  | 152/200 [1:00:30<19:49, 24.78s/it]Best trial: 51. Best value: 0.523173:  76%|███████▌  | 152/200 [1:01:00<19:49, 24.78s/it]Best trial: 51. Best value: 0.523173:  76%|███████▋  | 153/200 [1:01:00<20:31, 26.20s/it]Best trial: 51. Best value: 0.523173:  76%|███████▋  | 153/200 [1:01:29<20:31, 26.20s/it]Best trial: 51. Best value: 0.523173:  77%|███████▋  | 154/200 [1:01:29<20:51, 27.20s/it]Best trial: 51. Best value: 0.523173:  77%|███████▋  | 154/200 [1:01:53<20:51, 27.20s/it]Best trial: 51. Best value: 0.523173:  78%|███████▊  | 155/200 [1:01:53<19:33, 26.08s/it]Best trial: 51. Best value: 0.523173:  78%|███████▊  | 155/200 [1:02:11<19:33, 26.08s/it]Best trial: 51. Best value: 0.523173:  78%|███████▊  | 156/200 [1:02:11<17:24, 23.73s/it]Best trial: 51. Best value: 0.523173:  78%|███████▊  | 156/200 [1:02:28<17:24, 23.73s/it]Best trial: 51. Best value: 0.523173:  78%|███████▊  | 157/200 [1:02:28<15:34, 21.74s/it]Best trial: 51. Best value: 0.523173:  78%|███████▊  | 157/200 [1:02:51<15:34, 21.74s/it]Best trial: 51. Best value: 0.523173:  79%|███████▉  | 158/200 [1:02:51<15:24, 22.02s/it]Best trial: 51. Best value: 0.523173:  79%|███████▉  | 158/200 [1:03:18<15:24, 22.02s/it]Best trial: 51. Best value: 0.523173:  80%|███████▉  | 159/200 [1:03:18<16:01, 23.45s/it]Best trial: 51. Best value: 0.523173:  80%|███████▉  | 159/200 [1:03:51<16:01, 23.45s/it]Best trial: 51. Best value: 0.523173:  80%|████████  | 160/200 [1:03:51<17:32, 26.31s/it]Best trial: 51. Best value: 0.523173:  80%|████████  | 160/200 [1:04:06<17:32, 26.31s/it]Best trial: 51. Best value: 0.523173:  80%|████████  | 161/200 [1:04:06<14:54, 22.94s/it]Best trial: 51. Best value: 0.523173:  80%|████████  | 161/200 [1:04:46<14:54, 22.94s/it]Best trial: 51. Best value: 0.523173:  81%|████████  | 162/200 [1:04:46<17:54, 28.28s/it]Best trial: 51. Best value: 0.523173:  81%|████████  | 162/200 [1:05:18<17:54, 28.28s/it]Best trial: 51. Best value: 0.523173:  82%|████████▏ | 163/200 [1:05:18<18:03, 29.28s/it]Best trial: 51. Best value: 0.523173:  82%|████████▏ | 163/200 [1:05:47<18:03, 29.28s/it]Best trial: 51. Best value: 0.523173:  82%|████████▏ | 164/200 [1:05:47<17:33, 29.27s/it]Best trial: 51. Best value: 0.523173:  82%|████████▏ | 164/200 [1:06:12<17:33, 29.27s/it]Best trial: 51. Best value: 0.523173:  82%|████████▎ | 165/200 [1:06:12<16:20, 28.02s/it]Best trial: 51. Best value: 0.523173:  82%|████████▎ | 165/200 [1:06:33<16:20, 28.02s/it]Best trial: 51. Best value: 0.523173:  83%|████████▎ | 166/200 [1:06:33<14:36, 25.79s/it]Best trial: 51. Best value: 0.523173:  83%|████████▎ | 166/200 [1:07:00<14:36, 25.79s/it]Best trial: 51. Best value: 0.523173:  84%|████████▎ | 167/200 [1:07:00<14:24, 26.21s/it]Best trial: 51. Best value: 0.523173:  84%|████████▎ | 167/200 [1:07:22<14:24, 26.21s/it]Best trial: 51. Best value: 0.523173:  84%|████████▍ | 168/200 [1:07:22<13:15, 24.86s/it]Best trial: 51. Best value: 0.523173:  84%|████████▍ | 168/200 [1:07:48<13:15, 24.86s/it]Best trial: 51. Best value: 0.523173:  84%|████████▍ | 169/200 [1:07:48<12:59, 25.14s/it]Best trial: 51. Best value: 0.523173:  84%|████████▍ | 169/200 [1:08:13<12:59, 25.14s/it]Best trial: 51. Best value: 0.523173:  85%|████████▌ | 170/200 [1:08:13<12:33, 25.12s/it]Best trial: 51. Best value: 0.523173:  85%|████████▌ | 170/200 [1:08:33<12:33, 25.12s/it]Best trial: 51. Best value: 0.523173:  86%|████████▌ | 171/200 [1:08:33<11:28, 23.75s/it]Best trial: 51. Best value: 0.523173:  86%|████████▌ | 171/200 [1:08:52<11:28, 23.75s/it]Best trial: 51. Best value: 0.523173:  86%|████████▌ | 172/200 [1:08:52<10:24, 22.31s/it]Best trial: 51. Best value: 0.523173:  86%|████████▌ | 172/200 [1:09:10<10:24, 22.31s/it]Best trial: 51. Best value: 0.523173:  86%|████████▋ | 173/200 [1:09:10<09:27, 21.01s/it]Best trial: 51. Best value: 0.523173:  86%|████████▋ | 173/200 [1:09:30<09:27, 21.01s/it]Best trial: 51. Best value: 0.523173:  87%|████████▋ | 174/200 [1:09:30<08:52, 20.49s/it]Best trial: 51. Best value: 0.523173:  87%|████████▋ | 174/200 [1:09:51<08:52, 20.49s/it]Best trial: 51. Best value: 0.523173:  88%|████████▊ | 175/200 [1:09:51<08:40, 20.81s/it]Best trial: 51. Best value: 0.523173:  88%|████████▊ | 175/200 [1:10:10<08:40, 20.81s/it]Best trial: 51. Best value: 0.523173:  88%|████████▊ | 176/200 [1:10:10<08:03, 20.16s/it]Best trial: 51. Best value: 0.523173:  88%|████████▊ | 176/200 [1:10:29<08:03, 20.16s/it]Best trial: 51. Best value: 0.523173:  88%|████████▊ | 177/200 [1:10:29<07:36, 19.84s/it]Best trial: 51. Best value: 0.523173:  88%|████████▊ | 177/200 [1:10:47<07:36, 19.84s/it]Best trial: 51. Best value: 0.523173:  89%|████████▉ | 178/200 [1:10:47<07:08, 19.46s/it]Best trial: 51. Best value: 0.523173:  89%|████████▉ | 178/200 [1:11:08<07:08, 19.46s/it]Best trial: 51. Best value: 0.523173:  90%|████████▉ | 179/200 [1:11:08<06:56, 19.83s/it]Best trial: 51. Best value: 0.523173:  90%|████████▉ | 179/200 [1:11:27<06:56, 19.83s/it]Best trial: 51. Best value: 0.523173:  90%|█████████ | 180/200 [1:11:27<06:32, 19.61s/it]Best trial: 51. Best value: 0.523173:  90%|█████████ | 180/200 [1:11:45<06:32, 19.61s/it]Best trial: 51. Best value: 0.523173:  90%|█████████ | 181/200 [1:11:45<06:04, 19.20s/it]Best trial: 51. Best value: 0.523173:  90%|█████████ | 181/200 [1:12:04<06:04, 19.20s/it]Best trial: 51. Best value: 0.523173:  91%|█████████ | 182/200 [1:12:04<05:45, 19.17s/it]Best trial: 51. Best value: 0.523173:  91%|█████████ | 182/200 [1:12:24<05:45, 19.17s/it]Best trial: 51. Best value: 0.523173:  92%|█████████▏| 183/200 [1:12:24<05:27, 19.28s/it]Best trial: 51. Best value: 0.523173:  92%|█████████▏| 183/200 [1:12:43<05:27, 19.28s/it]Best trial: 51. Best value: 0.523173:  92%|█████████▏| 184/200 [1:12:43<05:06, 19.13s/it]Best trial: 51. Best value: 0.523173:  92%|█████████▏| 184/200 [1:13:01<05:06, 19.13s/it]Best trial: 51. Best value: 0.523173:  92%|█████████▎| 185/200 [1:13:01<04:44, 18.99s/it]Best trial: 51. Best value: 0.523173:  92%|█████████▎| 185/200 [1:13:20<04:44, 18.99s/it]Best trial: 51. Best value: 0.523173:  93%|█████████▎| 186/200 [1:13:20<04:25, 18.95s/it]Best trial: 51. Best value: 0.523173:  93%|█████████▎| 186/200 [1:13:40<04:25, 18.95s/it]Best trial: 51. Best value: 0.523173:  94%|█████████▎| 187/200 [1:13:40<04:09, 19.23s/it]Best trial: 51. Best value: 0.523173:  94%|█████████▎| 187/200 [1:13:59<04:09, 19.23s/it]Best trial: 51. Best value: 0.523173:  94%|█████████▍| 188/200 [1:13:59<03:47, 19.00s/it]Best trial: 51. Best value: 0.523173:  94%|█████████▍| 188/200 [1:14:18<03:47, 19.00s/it]Best trial: 51. Best value: 0.523173:  94%|█████████▍| 189/200 [1:14:18<03:29, 19.01s/it]Best trial: 51. Best value: 0.523173:  94%|█████████▍| 189/200 [1:14:37<03:29, 19.01s/it]Best trial: 51. Best value: 0.523173:  95%|█████████▌| 190/200 [1:14:37<03:12, 19.22s/it]Best trial: 51. Best value: 0.523173:  95%|█████████▌| 190/200 [1:14:57<03:12, 19.22s/it]Best trial: 51. Best value: 0.523173:  96%|█████████▌| 191/200 [1:14:57<02:54, 19.38s/it]Best trial: 51. Best value: 0.523173:  96%|█████████▌| 191/200 [1:15:17<02:54, 19.38s/it]Best trial: 51. Best value: 0.523173:  96%|█████████▌| 192/200 [1:15:17<02:35, 19.41s/it]Best trial: 51. Best value: 0.523173:  96%|█████████▌| 192/200 [1:15:39<02:35, 19.41s/it]Best trial: 51. Best value: 0.523173:  96%|█████████▋| 193/200 [1:15:39<02:22, 20.37s/it]Best trial: 51. Best value: 0.523173:  96%|█████████▋| 193/200 [1:15:59<02:22, 20.37s/it]Best trial: 51. Best value: 0.523173:  97%|█████████▋| 194/200 [1:15:59<02:00, 20.09s/it]Best trial: 51. Best value: 0.523173:  97%|█████████▋| 194/200 [1:16:20<02:00, 20.09s/it]Best trial: 51. Best value: 0.523173:  98%|█████████▊| 195/200 [1:16:20<01:41, 20.40s/it]Best trial: 51. Best value: 0.523173:  98%|█████████▊| 195/200 [1:16:40<01:41, 20.40s/it]Best trial: 51. Best value: 0.523173:  98%|█████████▊| 196/200 [1:16:40<01:21, 20.30s/it]Best trial: 51. Best value: 0.523173:  98%|█████████▊| 196/200 [1:16:58<01:21, 20.30s/it]Best trial: 51. Best value: 0.523173:  98%|█████████▊| 197/200 [1:16:58<00:59, 19.70s/it]Best trial: 51. Best value: 0.523173:  98%|█████████▊| 197/200 [1:17:17<00:59, 19.70s/it]Best trial: 51. Best value: 0.523173:  99%|█████████▉| 198/200 [1:17:17<00:39, 19.54s/it]Best trial: 51. Best value: 0.523173:  99%|█████████▉| 198/200 [1:17:31<00:39, 19.54s/it]Best trial: 51. Best value: 0.523173: 100%|█████████▉| 199/200 [1:17:31<00:17, 17.92s/it]Best trial: 51. Best value: 0.523173: 100%|█████████▉| 199/200 [1:17:52<00:17, 17.92s/it]Best trial: 51. Best value: 0.523173: 100%|██████████| 200/200 [1:17:52<00:00, 18.56s/it]Best trial: 51. Best value: 0.523173: 100%|██████████| 200/200 [1:17:52<00:00, 23.36s/it]
00:59:54 [INFO] models.training.ordinal_trainer: Best params: {'bootstrap_type': 'Bernoulli', 'grow_policy': 'Lossguide', 'depth': 4, 'iterations': 247, 'learning_rate': 0.015801614916875796, 'border_count': 202, 'l2_leaf_reg': 2.33348264190419, 'min_data_in_leaf': 25, 'random_strength': 1.9951597875471871, 'colsample_bylevel': 0.9093712950287384, 'max_leaves': 60, 'subsample': 0.7624329860569582}
00:59:54 [INFO] models.training.ordinal_trainer: Best Within-2 Rate: 0.5232
00:59:58 [INFO] models.training.ordinal_trainer:   Threshold -11: trained (pos_rate=91.1%)
01:00:01 [INFO] models.training.ordinal_trainer:   Threshold -10: trained (pos_rate=89.5%)
01:00:07 [INFO] models.training.ordinal_trainer:   Threshold -9: trained (pos_rate=87.6%)
01:00:13 [INFO] models.training.ordinal_trainer:   Threshold -8: trained (pos_rate=85.8%)
01:00:18 [INFO] models.training.ordinal_trainer:   Threshold -7: trained (pos_rate=83.5%)
01:00:24 [INFO] models.training.ordinal_trainer:   Threshold -6: trained (pos_rate=81.1%)
01:00:29 [INFO] models.training.ordinal_trainer:   Threshold -5: trained (pos_rate=78.8%)
01:00:34 [INFO] models.training.ordinal_trainer:   Threshold -4: trained (pos_rate=76.9%)
01:00:44 [INFO] models.training.ordinal_trainer:   Threshold -3: trained (pos_rate=71.6%)
01:00:47 [INFO] models.training.ordinal_trainer:   Threshold -2: trained (pos_rate=68.0%)
01:00:54 [INFO] models.training.ordinal_trainer:   Threshold -1: trained (pos_rate=63.0%)
01:01:01 [INFO] models.training.ordinal_trainer:   Threshold +0: trained (pos_rate=57.1%)
01:01:09 [INFO] models.training.ordinal_trainer:   Threshold +1: trained (pos_rate=41.2%)
01:01:14 [INFO] models.training.ordinal_trainer:   Threshold +2: trained (pos_rate=34.8%)
01:01:18 [INFO] models.training.ordinal_trainer:   Threshold +3: trained (pos_rate=29.0%)
01:01:25 [INFO] models.training.ordinal_trainer:   Threshold +4: trained (pos_rate=25.2%)
01:01:35 [INFO] models.training.ordinal_trainer:   Threshold +5: trained (pos_rate=20.6%)
01:01:45 [INFO] models.training.ordinal_trainer:   Threshold +6: trained (pos_rate=18.2%)
01:01:52 [INFO] models.training.ordinal_trainer:   Threshold +7: trained (pos_rate=15.1%)
01:01:57 [INFO] models.training.ordinal_trainer:   Threshold +8: trained (pos_rate=13.1%)
01:02:01 [INFO] models.training.ordinal_trainer:   Threshold +9: trained (pos_rate=10.7%)
01:02:05 [INFO] models.training.ordinal_trainer:   Threshold +10: trained (pos_rate=9.2%)
01:02:09 [INFO] models.training.ordinal_trainer:   Threshold +11: trained (pos_rate=7.2%)
01:02:14 [INFO] models.training.ordinal_trainer:   Threshold +12: trained (pos_rate=6.1%)
01:02:14 [INFO] models.training.ordinal_trainer: Ordinal training complete: 24 classifiers
01:02:16 [INFO] models.training.ordinal_trainer: Saved ordinal model to models/saved/chicago/ordinal_catboost_optuna.pkl
01:02:16 [INFO] __main__: 
Saved model to models/saved/chicago/ordinal_catboost_optuna.pkl
01:02:16 [INFO] __main__: Saved best params to models/saved/chicago/best_params.json
01:02:16 [INFO] __main__: Saved final metrics to models/saved/chicago/final_metrics_chicago.json

============================================================
EVALUATION
============================================================

Test Set Metrics:
----------------------------------------
  delta_accuracy: 0.2562
  delta_mae: 2.4917
  off_by_1_rate: 0.2266
  off_by_2plus_rate: 0.5172
  within_1_rate: 0.4828
  within_2_rate: 0.6137

============================================================
FEATURE IMPORTANCE
============================================================

Top 30 Features:
                           feature  importance
0                 obs_fcst_max_gap   26.053355
1                   fcst_obs_ratio    6.724324
2            gap_x_hours_remaining    5.033900
3         fcst_remaining_potential    4.993643
4          confidence_weighted_gap    4.698679
5                 remaining_upside    4.111224
6                 delta_vcmax_lag1    3.979834
7          temp_zscore_vs_forecast    3.385024
8            fcst_multi_t1_t2_diff    3.127144
9             fcst_peak_hour_float    1.910006
10            obs_fcst_gap_squared    1.793945
11            log_abs_obs_fcst_gap    1.699212
12           fcst_prev_hour_of_max    1.658798
13      minutes_since_max_observed    1.601073
14                         doy_sin    1.106249
15              log_hours_to_close    1.008548
16          log_minutes_since_open    0.969885
17         fcst_drift_mean_delta_f    0.952040
18                fcst_multi_range    0.650523
19               num_samples_sofar    0.646048
20         hours_since_market_open    0.632114
21     fcst_drift_slope_f_per_lead    0.631195
22            fcst_multi_range_pct    0.608813
23  log_expected_delta_uncertainty    0.587020
24      expected_delta_uncertainty    0.578033
25                 fcst_prev_std_f    0.572401
26                        week_sin    0.564624
27    fcst_humidity_afternoon_mean    0.558291
28             fcst_dewpoint_range    0.552940
29               fcst_humidity_max    0.535667

----------------------------------------
Station-city feature importance:
                         feature  importance
76    station_city_max_gap_sofar    0.166676
109         station_city_gap_std    0.073004
124       station_city_gap_trend    0.040035
128  station_city_gap_x_fcst_gap    0.038282
140  station_city_mean_gap_sofar    0.020727
173        station_city_temp_gap    0.001417
  station_city_max_gap_sofar: rank 77/201
  station_city_gap_std: rank 110/201
  station_city_gap_trend: rank 125/201
  station_city_gap_x_fcst_gap: rank 129/201
  station_city_mean_gap_sofar: rank 141/201
  station_city_temp_gap: rank 174/201

----------------------------------------
Multi-horizon feature importance:
                  feature  importance
8   fcst_multi_t1_t2_diff    3.127144
18       fcst_multi_range    0.650523
22   fcst_multi_range_pct    0.608813
45          fcst_multi_cv    0.284598
49         fcst_multi_std    0.275079
53       fcst_multi_drift    0.248798
56      fcst_multi_median    0.237592
61        fcst_multi_mean    0.208266
77         fcst_multi_ema    0.157572
  fcst_multi_t1_t2_diff: rank 9/201
  fcst_multi_range: rank 19/201
  fcst_multi_range_pct: rank 23/201
  fcst_multi_cv: rank 46/201
  fcst_multi_std: rank 50/201
  fcst_multi_drift: rank 54/201
  fcst_multi_median: rank 57/201
  fcst_multi_mean: rank 62/201
  fcst_multi_ema: rank 78/201

============================================================
SUMMARY
============================================================
City: chicago
Model: models/saved/chicago/ordinal_catboost_optuna.pkl
Params: models/saved/chicago/best_params.json
Metrics: models/saved/chicago/final_metrics_chicago.json
Training samples: 389,784
Test samples: 97,128
Optuna trials: 200
Best params: {'bootstrap_type': 'Bernoulli', 'grow_policy': 'Lossguide', 'depth': 4, 'iterations': 247, 'learning_rate': 0.015801614916875796, 'border_count': 202, 'l2_leaf_reg': 2.33348264190419, 'min_data_in_leaf': 25, 'random_strength': 1.9951597875471871, 'colsample_bylevel': 0.9093712950287384, 'max_leaves': 60, 'subsample': 0.7624329860569582}

Key Metrics:
  Accuracy: 25.6%
  MAE: 2.49
  Within 1: 48.3%
  Within 2: 61.4%

============================================================
DONE
============================================================
