01:02:17 [INFO] __main__: ============================================================
01:02:17 [INFO] __main__: DENVER Optuna Training (200 trials)
01:02:17 [INFO] __main__: Optimization objective: within2
01:02:17 [INFO] __main__: ============================================================
01:02:17 [INFO] __main__: Loading from training cache: data/training_cache/denver/full.parquet
01:02:17 [INFO] __main__: Loaded 486,924 rows, 237 columns
01:02:17 [INFO] __main__: Data range after filtering: 2023-01-01 to 2025-12-03
01:02:18 [INFO] __main__: Total days: 1068
01:02:18 [INFO] __main__: Training: 2023-01-01 to 2025-05-04 (855 days)
01:02:18 [INFO] __main__: Testing:  2025-05-05 to 2025-12-03 (213 days)
01:02:18 [INFO] __main__: 
Training samples: 389,796
01:02:18 [INFO] __main__: Training days: 855
01:02:18 [INFO] __main__: Test samples: 97,128
01:02:18 [INFO] __main__: Test days: 213
01:02:18 [INFO] __main__: 
Station-city features: ['station_city_temp_gap', 'station_city_max_gap_sofar', 'station_city_mean_gap_sofar', 'station_city_gap_std', 'station_city_gap_trend', 'station_city_gap_x_fcst_gap']
01:02:18 [INFO] __main__:   station_city_temp_gap: 389,712/389,796 non-null (100.0%)
01:02:18 [INFO] __main__:   station_city_max_gap_sofar: 389,712/389,796 non-null (100.0%)
01:02:18 [INFO] __main__:   station_city_mean_gap_sofar: 389,712/389,796 non-null (100.0%)
01:02:18 [INFO] __main__:   station_city_gap_std: 389,712/389,796 non-null (100.0%)
01:02:18 [INFO] __main__:   station_city_gap_trend: 389,706/389,796 non-null (100.0%)
01:02:18 [INFO] __main__:   station_city_gap_x_fcst_gap: 389,712/389,796 non-null (100.0%)
01:02:18 [INFO] __main__: 
Multi-horizon features: ['fcst_multi_mean', 'fcst_multi_median', 'fcst_multi_ema', 'fcst_multi_std', 'fcst_multi_range', 'fcst_multi_t1_t2_diff', 'fcst_multi_drift', 'fcst_multi_cv', 'fcst_multi_range_pct']
01:02:18 [INFO] __main__:   fcst_multi_mean: 389,796/389,796 non-null (100.0%)
01:02:18 [INFO] __main__:   fcst_multi_median: 389,796/389,796 non-null (100.0%)
01:02:18 [INFO] __main__:   fcst_multi_ema: 389,796/389,796 non-null (100.0%)
01:02:18 [INFO] __main__:   fcst_multi_std: 389,796/389,796 non-null (100.0%)
01:02:18 [INFO] __main__:   fcst_multi_range: 389,796/389,796 non-null (100.0%)
01:02:18 [INFO] __main__:   fcst_multi_t1_t2_diff: 389,796/389,796 non-null (100.0%)
01:02:18 [INFO] __main__:   fcst_multi_drift: 389,796/389,796 non-null (100.0%)
01:02:18 [INFO] __main__:   fcst_multi_cv: 389,796/389,796 non-null (100.0%)
01:02:18 [INFO] __main__:   fcst_multi_range_pct: 389,796/389,796 non-null (100.0%)
01:02:19 [INFO] models.training.ordinal_trainer: Training ordinal model (catboost) on 389796 samples
01:02:20 [INFO] models.training.ordinal_trainer: City delta range: [-12, 12]
01:02:20 [INFO] models.training.ordinal_trainer: Training 24 threshold classifiers: [-11, -10, -9, -8, -7, -6, -5, -4, -3, -2, -1, 0, 1, 2, 3, 4, 5, 6, 7, 8, 9, 10, 11, 12]
01:02:20 [INFO] models.training.ordinal_trainer: Starting Optuna tuning with 200 trials (objective=within2)

============================================================
OPTUNA TRAINING (200 trials, objective=within2)
============================================================
  0%|          | 0/200 [00:00<?, ?it/s]Best trial: 0. Best value: 0.465173:   0%|          | 0/200 [00:23<?, ?it/s]Best trial: 0. Best value: 0.465173:   0%|          | 1/200 [00:23<1:18:25, 23.65s/it]Best trial: 0. Best value: 0.465173:   0%|          | 1/200 [00:46<1:18:25, 23.65s/it]Best trial: 0. Best value: 0.465173:   1%|          | 2/200 [00:46<1:16:26, 23.17s/it]Best trial: 0. Best value: 0.465173:   1%|          | 2/200 [01:11<1:16:26, 23.17s/it]Best trial: 0. Best value: 0.465173:   2%|▏         | 3/200 [01:11<1:18:36, 23.94s/it]Best trial: 0. Best value: 0.465173:   2%|▏         | 3/200 [01:40<1:18:36, 23.94s/it]Best trial: 0. Best value: 0.465173:   2%|▏         | 4/200 [01:40<1:24:56, 26.00s/it]Best trial: 0. Best value: 0.465173:   2%|▏         | 4/200 [02:45<1:24:56, 26.00s/it]Best trial: 0. Best value: 0.465173:   2%|▎         | 5/200 [02:45<2:10:33, 40.17s/it]Best trial: 0. Best value: 0.465173:   2%|▎         | 5/200 [03:09<2:10:33, 40.17s/it]Best trial: 0. Best value: 0.465173:   3%|▎         | 6/200 [03:09<1:51:30, 34.49s/it]Best trial: 0. Best value: 0.465173:   3%|▎         | 6/200 [03:37<1:51:30, 34.49s/it]Best trial: 0. Best value: 0.465173:   4%|▎         | 7/200 [03:37<1:44:37, 32.53s/it]Best trial: 0. Best value: 0.465173:   4%|▎         | 7/200 [03:52<1:44:37, 32.53s/it]Best trial: 0. Best value: 0.465173:   4%|▍         | 8/200 [03:52<1:25:46, 26.80s/it]Best trial: 0. Best value: 0.465173:   4%|▍         | 8/200 [04:30<1:25:46, 26.80s/it]Best trial: 0. Best value: 0.465173:   4%|▍         | 9/200 [04:30<1:36:41, 30.37s/it]Best trial: 0. Best value: 0.465173:   4%|▍         | 9/200 [04:58<1:36:41, 30.37s/it]Best trial: 0. Best value: 0.465173:   5%|▌         | 10/200 [04:58<1:33:36, 29.56s/it]Best trial: 0. Best value: 0.465173:   5%|▌         | 10/200 [05:23<1:33:36, 29.56s/it]Best trial: 0. Best value: 0.465173:   6%|▌         | 11/200 [05:23<1:29:14, 28.33s/it]Best trial: 0. Best value: 0.465173:   6%|▌         | 11/200 [05:58<1:29:14, 28.33s/it]Best trial: 0. Best value: 0.465173:   6%|▌         | 12/200 [05:58<1:34:49, 30.26s/it]Best trial: 0. Best value: 0.465173:   6%|▌         | 12/200 [06:20<1:34:49, 30.26s/it]Best trial: 0. Best value: 0.465173:   6%|▋         | 13/200 [06:20<1:26:55, 27.89s/it]Best trial: 0. Best value: 0.465173:   6%|▋         | 13/200 [06:50<1:26:55, 27.89s/it]Best trial: 0. Best value: 0.465173:   7%|▋         | 14/200 [06:50<1:28:21, 28.50s/it]Best trial: 0. Best value: 0.465173:   7%|▋         | 14/200 [07:13<1:28:21, 28.50s/it]Best trial: 0. Best value: 0.465173:   8%|▊         | 15/200 [07:13<1:22:35, 26.79s/it]Best trial: 15. Best value: 0.48631:   8%|▊         | 15/200 [07:30<1:22:35, 26.79s/it]Best trial: 15. Best value: 0.48631:   8%|▊         | 16/200 [07:30<1:13:26, 23.95s/it]Best trial: 15. Best value: 0.48631:   8%|▊         | 16/200 [07:46<1:13:26, 23.95s/it]Best trial: 15. Best value: 0.48631:   8%|▊         | 17/200 [07:46<1:05:22, 21.43s/it]Best trial: 15. Best value: 0.48631:   8%|▊         | 17/200 [08:00<1:05:22, 21.43s/it]Best trial: 15. Best value: 0.48631:   9%|▉         | 18/200 [08:00<58:15, 19.20s/it]  Best trial: 15. Best value: 0.48631:   9%|▉         | 18/200 [08:14<58:15, 19.20s/it]Best trial: 15. Best value: 0.48631:  10%|▉         | 19/200 [08:14<53:16, 17.66s/it]Best trial: 15. Best value: 0.48631:  10%|▉         | 19/200 [08:29<53:16, 17.66s/it]Best trial: 15. Best value: 0.48631:  10%|█         | 20/200 [08:29<50:27, 16.82s/it]Best trial: 15. Best value: 0.48631:  10%|█         | 20/200 [08:43<50:27, 16.82s/it]Best trial: 15. Best value: 0.48631:  10%|█         | 21/200 [08:43<47:46, 16.01s/it]Best trial: 15. Best value: 0.48631:  10%|█         | 21/200 [08:59<47:46, 16.01s/it]Best trial: 15. Best value: 0.48631:  11%|█         | 22/200 [08:59<46:55, 15.82s/it]Best trial: 15. Best value: 0.48631:  11%|█         | 22/200 [09:14<46:55, 15.82s/it]Best trial: 15. Best value: 0.48631:  12%|█▏        | 23/200 [09:14<46:48, 15.87s/it]Best trial: 15. Best value: 0.48631:  12%|█▏        | 23/200 [09:30<46:48, 15.87s/it]Best trial: 15. Best value: 0.48631:  12%|█▏        | 24/200 [09:30<46:00, 15.68s/it]Best trial: 15. Best value: 0.48631:  12%|█▏        | 24/200 [09:44<46:00, 15.68s/it]Best trial: 15. Best value: 0.48631:  12%|█▎        | 25/200 [09:44<44:10, 15.15s/it]Best trial: 15. Best value: 0.48631:  12%|█▎        | 25/200 [09:59<44:10, 15.15s/it]Best trial: 15. Best value: 0.48631:  13%|█▎        | 26/200 [09:59<44:10, 15.23s/it]Best trial: 15. Best value: 0.48631:  13%|█▎        | 26/200 [10:14<44:10, 15.23s/it]Best trial: 15. Best value: 0.48631:  14%|█▎        | 27/200 [10:14<44:03, 15.28s/it]Best trial: 27. Best value: 0.487461:  14%|█▎        | 27/200 [10:32<44:03, 15.28s/it]Best trial: 27. Best value: 0.487461:  14%|█▍        | 28/200 [10:32<45:53, 16.01s/it]Best trial: 27. Best value: 0.487461:  14%|█▍        | 28/200 [10:48<45:53, 16.01s/it]Best trial: 27. Best value: 0.487461:  14%|█▍        | 29/200 [10:48<45:31, 15.97s/it]Best trial: 27. Best value: 0.487461:  14%|█▍        | 29/200 [11:06<45:31, 15.97s/it]Best trial: 27. Best value: 0.487461:  15%|█▌        | 30/200 [11:06<47:01, 16.60s/it]Best trial: 27. Best value: 0.487461:  15%|█▌        | 30/200 [11:23<47:01, 16.60s/it]Best trial: 27. Best value: 0.487461:  16%|█▌        | 31/200 [11:23<46:35, 16.54s/it]Best trial: 27. Best value: 0.487461:  16%|█▌        | 31/200 [11:38<46:35, 16.54s/it]Best trial: 27. Best value: 0.487461:  16%|█▌        | 32/200 [11:38<45:27, 16.23s/it]Best trial: 27. Best value: 0.487461:  16%|█▌        | 32/200 [11:52<45:27, 16.23s/it]Best trial: 27. Best value: 0.487461:  16%|█▋        | 33/200 [11:52<42:56, 15.43s/it]Best trial: 27. Best value: 0.487461:  16%|█▋        | 33/200 [12:07<42:56, 15.43s/it]Best trial: 27. Best value: 0.487461:  17%|█▋        | 34/200 [12:07<42:58, 15.53s/it]Best trial: 27. Best value: 0.487461:  17%|█▋        | 34/200 [12:24<42:58, 15.53s/it]Best trial: 27. Best value: 0.487461:  18%|█▊        | 35/200 [12:24<43:14, 15.72s/it]Best trial: 27. Best value: 0.487461:  18%|█▊        | 35/200 [12:45<43:14, 15.72s/it]Best trial: 27. Best value: 0.487461:  18%|█▊        | 36/200 [12:45<47:34, 17.41s/it]Best trial: 27. Best value: 0.487461:  18%|█▊        | 36/200 [13:01<47:34, 17.41s/it]Best trial: 27. Best value: 0.487461:  18%|█▊        | 37/200 [13:01<46:25, 17.09s/it]Best trial: 27. Best value: 0.487461:  18%|█▊        | 37/200 [13:41<46:25, 17.09s/it]Best trial: 27. Best value: 0.487461:  19%|█▉        | 38/200 [13:41<1:04:18, 23.82s/it]Best trial: 27. Best value: 0.487461:  19%|█▉        | 38/200 [13:56<1:04:18, 23.82s/it]Best trial: 27. Best value: 0.487461:  20%|█▉        | 39/200 [13:56<57:04, 21.27s/it]  Best trial: 27. Best value: 0.487461:  20%|█▉        | 39/200 [14:11<57:04, 21.27s/it]Best trial: 27. Best value: 0.487461:  20%|██        | 40/200 [14:11<51:37, 19.36s/it]Best trial: 27. Best value: 0.487461:  20%|██        | 40/200 [14:32<51:37, 19.36s/it]Best trial: 27. Best value: 0.487461:  20%|██        | 41/200 [14:32<52:27, 19.79s/it]Best trial: 27. Best value: 0.487461:  20%|██        | 41/200 [14:48<52:27, 19.79s/it]Best trial: 27. Best value: 0.487461:  21%|██        | 42/200 [14:48<49:01, 18.62s/it]Best trial: 27. Best value: 0.487461:  21%|██        | 42/200 [15:03<49:01, 18.62s/it]Best trial: 27. Best value: 0.487461:  22%|██▏       | 43/200 [15:03<46:15, 17.68s/it]Best trial: 27. Best value: 0.487461:  22%|██▏       | 43/200 [15:19<46:15, 17.68s/it]Best trial: 27. Best value: 0.487461:  22%|██▏       | 44/200 [15:19<44:45, 17.22s/it]Best trial: 27. Best value: 0.487461:  22%|██▏       | 44/200 [15:36<44:45, 17.22s/it]Best trial: 27. Best value: 0.487461:  22%|██▎       | 45/200 [15:36<43:43, 16.93s/it]Best trial: 27. Best value: 0.487461:  22%|██▎       | 45/200 [15:52<43:43, 16.93s/it]Best trial: 27. Best value: 0.487461:  23%|██▎       | 46/200 [15:52<43:12, 16.83s/it]Best trial: 27. Best value: 0.487461:  23%|██▎       | 46/200 [16:14<43:12, 16.83s/it]Best trial: 27. Best value: 0.487461:  24%|██▎       | 47/200 [16:14<46:29, 18.23s/it]Best trial: 27. Best value: 0.487461:  24%|██▎       | 47/200 [16:34<46:29, 18.23s/it]Best trial: 27. Best value: 0.487461:  24%|██▍       | 48/200 [16:34<47:52, 18.90s/it]Best trial: 27. Best value: 0.487461:  24%|██▍       | 48/200 [16:48<47:52, 18.90s/it]Best trial: 27. Best value: 0.487461:  24%|██▍       | 49/200 [16:48<43:46, 17.39s/it]Best trial: 27. Best value: 0.487461:  24%|██▍       | 49/200 [17:10<43:46, 17.39s/it]Best trial: 27. Best value: 0.487461:  25%|██▌       | 50/200 [17:10<46:54, 18.76s/it]Best trial: 27. Best value: 0.487461:  25%|██▌       | 50/200 [17:26<46:54, 18.76s/it]Best trial: 27. Best value: 0.487461:  26%|██▌       | 51/200 [17:26<44:55, 18.09s/it]Best trial: 27. Best value: 0.487461:  26%|██▌       | 51/200 [17:42<44:55, 18.09s/it]Best trial: 27. Best value: 0.487461:  26%|██▌       | 52/200 [17:42<42:42, 17.31s/it]Best trial: 27. Best value: 0.487461:  26%|██▌       | 52/200 [17:58<42:42, 17.31s/it]Best trial: 27. Best value: 0.487461:  26%|██▋       | 53/200 [17:58<41:30, 16.94s/it]Best trial: 27. Best value: 0.487461:  26%|██▋       | 53/200 [18:16<41:30, 16.94s/it]Best trial: 27. Best value: 0.487461:  27%|██▋       | 54/200 [18:16<41:43, 17.14s/it]Best trial: 27. Best value: 0.487461:  27%|██▋       | 54/200 [18:30<41:43, 17.14s/it]Best trial: 27. Best value: 0.487461:  28%|██▊       | 55/200 [18:30<39:04, 16.17s/it]Best trial: 27. Best value: 0.487461:  28%|██▊       | 55/200 [18:44<39:04, 16.17s/it]Best trial: 27. Best value: 0.487461:  28%|██▊       | 56/200 [18:44<37:52, 15.78s/it]Best trial: 27. Best value: 0.487461:  28%|██▊       | 56/200 [19:17<37:52, 15.78s/it]Best trial: 27. Best value: 0.487461:  28%|██▊       | 57/200 [19:17<49:32, 20.78s/it]Best trial: 27. Best value: 0.487461:  28%|██▊       | 57/200 [19:33<49:32, 20.78s/it]Best trial: 27. Best value: 0.487461:  29%|██▉       | 58/200 [19:33<45:45, 19.33s/it]Best trial: 27. Best value: 0.487461:  29%|██▉       | 58/200 [19:49<45:45, 19.33s/it]Best trial: 27. Best value: 0.487461:  30%|██▉       | 59/200 [19:49<43:00, 18.30s/it]Best trial: 27. Best value: 0.487461:  30%|██▉       | 59/200 [20:03<43:00, 18.30s/it]Best trial: 27. Best value: 0.487461:  30%|███       | 60/200 [20:03<39:45, 17.04s/it]Best trial: 27. Best value: 0.487461:  30%|███       | 60/200 [20:20<39:45, 17.04s/it]Best trial: 27. Best value: 0.487461:  30%|███       | 61/200 [20:20<39:15, 16.95s/it]Best trial: 27. Best value: 0.487461:  30%|███       | 61/200 [20:35<39:15, 16.95s/it]Best trial: 27. Best value: 0.487461:  31%|███       | 62/200 [20:35<37:40, 16.38s/it]Best trial: 27. Best value: 0.487461:  31%|███       | 62/200 [20:50<37:40, 16.38s/it]Best trial: 27. Best value: 0.487461:  32%|███▏      | 63/200 [20:50<37:01, 16.21s/it]Best trial: 27. Best value: 0.487461:  32%|███▏      | 63/200 [21:06<37:01, 16.21s/it]Best trial: 27. Best value: 0.487461:  32%|███▏      | 64/200 [21:06<36:26, 16.08s/it]Best trial: 27. Best value: 0.487461:  32%|███▏      | 64/200 [21:23<36:26, 16.08s/it]Best trial: 27. Best value: 0.487461:  32%|███▎      | 65/200 [21:23<36:28, 16.21s/it]Best trial: 27. Best value: 0.487461:  32%|███▎      | 65/200 [21:38<36:28, 16.21s/it]Best trial: 27. Best value: 0.487461:  33%|███▎      | 66/200 [21:38<35:41, 15.98s/it]Best trial: 27. Best value: 0.487461:  33%|███▎      | 66/200 [22:01<35:41, 15.98s/it]Best trial: 27. Best value: 0.487461:  34%|███▎      | 67/200 [22:01<39:42, 17.91s/it]Best trial: 27. Best value: 0.487461:  34%|███▎      | 67/200 [22:19<39:42, 17.91s/it]Best trial: 27. Best value: 0.487461:  34%|███▍      | 68/200 [22:19<39:29, 17.95s/it]Best trial: 27. Best value: 0.487461:  34%|███▍      | 68/200 [22:36<39:29, 17.95s/it]Best trial: 27. Best value: 0.487461:  34%|███▍      | 69/200 [22:36<39:04, 17.90s/it]Best trial: 27. Best value: 0.487461:  34%|███▍      | 69/200 [22:52<39:04, 17.90s/it]Best trial: 27. Best value: 0.487461:  35%|███▌      | 70/200 [22:52<37:04, 17.11s/it]Best trial: 27. Best value: 0.487461:  35%|███▌      | 70/200 [23:11<37:04, 17.11s/it]Best trial: 27. Best value: 0.487461:  36%|███▌      | 71/200 [23:11<38:00, 17.68s/it]Best trial: 27. Best value: 0.487461:  36%|███▌      | 71/200 [23:26<38:00, 17.68s/it]Best trial: 27. Best value: 0.487461:  36%|███▌      | 72/200 [23:26<36:31, 17.12s/it]Best trial: 27. Best value: 0.487461:  36%|███▌      | 72/200 [23:43<36:31, 17.12s/it]Best trial: 27. Best value: 0.487461:  36%|███▋      | 73/200 [23:43<35:51, 16.94s/it]Best trial: 27. Best value: 0.487461:  36%|███▋      | 73/200 [24:07<35:51, 16.94s/it]Best trial: 27. Best value: 0.487461:  37%|███▋      | 74/200 [24:07<40:11, 19.14s/it]Best trial: 27. Best value: 0.487461:  37%|███▋      | 74/200 [24:30<40:11, 19.14s/it]Best trial: 27. Best value: 0.487461:  38%|███▊      | 75/200 [24:30<42:01, 20.17s/it]Best trial: 27. Best value: 0.487461:  38%|███▊      | 75/200 [24:46<42:01, 20.17s/it]Best trial: 27. Best value: 0.487461:  38%|███▊      | 76/200 [24:46<39:11, 18.97s/it]Best trial: 27. Best value: 0.487461:  38%|███▊      | 76/200 [25:04<39:11, 18.97s/it]Best trial: 27. Best value: 0.487461:  38%|███▊      | 77/200 [25:04<38:09, 18.61s/it]Best trial: 27. Best value: 0.487461:  38%|███▊      | 77/200 [25:20<38:09, 18.61s/it]Best trial: 27. Best value: 0.487461:  39%|███▉      | 78/200 [25:20<36:22, 17.89s/it]Best trial: 27. Best value: 0.487461:  39%|███▉      | 78/200 [25:37<36:22, 17.89s/it]Best trial: 27. Best value: 0.487461:  40%|███▉      | 79/200 [25:37<35:29, 17.60s/it]Best trial: 27. Best value: 0.487461:  40%|███▉      | 79/200 [25:59<35:29, 17.60s/it]Best trial: 27. Best value: 0.487461:  40%|████      | 80/200 [25:59<37:49, 18.91s/it]Best trial: 27. Best value: 0.487461:  40%|████      | 80/200 [26:14<37:49, 18.91s/it]Best trial: 27. Best value: 0.487461:  40%|████      | 81/200 [26:14<35:24, 17.85s/it]Best trial: 27. Best value: 0.487461:  40%|████      | 81/200 [26:31<35:24, 17.85s/it]Best trial: 27. Best value: 0.487461:  41%|████      | 82/200 [26:31<34:36, 17.60s/it]Best trial: 82. Best value: 0.487774:  41%|████      | 82/200 [26:47<34:36, 17.60s/it]Best trial: 82. Best value: 0.487774:  42%|████▏     | 83/200 [26:47<33:26, 17.15s/it]Best trial: 82. Best value: 0.487774:  42%|████▏     | 83/200 [27:02<33:26, 17.15s/it]Best trial: 82. Best value: 0.487774:  42%|████▏     | 84/200 [27:02<31:44, 16.42s/it]Best trial: 82. Best value: 0.487774:  42%|████▏     | 84/200 [27:18<31:44, 16.42s/it]Best trial: 82. Best value: 0.487774:  42%|████▎     | 85/200 [27:18<31:17, 16.32s/it]Best trial: 82. Best value: 0.487774:  42%|████▎     | 85/200 [27:31<31:17, 16.32s/it]Best trial: 82. Best value: 0.487774:  43%|████▎     | 86/200 [27:31<29:18, 15.42s/it]Best trial: 82. Best value: 0.487774:  43%|████▎     | 86/200 [27:59<29:18, 15.42s/it]Best trial: 82. Best value: 0.487774:  44%|████▎     | 87/200 [27:59<35:39, 18.93s/it]Best trial: 82. Best value: 0.487774:  44%|████▎     | 87/200 [28:15<35:39, 18.93s/it]Best trial: 82. Best value: 0.487774:  44%|████▍     | 88/200 [28:15<33:50, 18.13s/it]Best trial: 88. Best value: 0.496324:  44%|████▍     | 88/200 [28:29<33:50, 18.13s/it]Best trial: 88. Best value: 0.496324:  44%|████▍     | 89/200 [28:29<31:25, 16.98s/it]Best trial: 88. Best value: 0.496324:  44%|████▍     | 89/200 [28:43<31:25, 16.98s/it]Best trial: 88. Best value: 0.496324:  45%|████▌     | 90/200 [28:43<29:34, 16.13s/it]Best trial: 88. Best value: 0.496324:  45%|████▌     | 90/200 [29:05<29:34, 16.13s/it]Best trial: 88. Best value: 0.496324:  46%|████▌     | 91/200 [29:05<32:12, 17.73s/it]Best trial: 88. Best value: 0.496324:  46%|████▌     | 91/200 [29:19<32:12, 17.73s/it]Best trial: 88. Best value: 0.496324:  46%|████▌     | 92/200 [29:19<30:09, 16.76s/it]Best trial: 88. Best value: 0.496324:  46%|████▌     | 92/200 [29:33<30:09, 16.76s/it]Best trial: 88. Best value: 0.496324:  46%|████▋     | 93/200 [29:33<28:29, 15.98s/it]Best trial: 88. Best value: 0.496324:  46%|████▋     | 93/200 [29:49<28:29, 15.98s/it]Best trial: 88. Best value: 0.496324:  47%|████▋     | 94/200 [29:49<27:55, 15.81s/it]Best trial: 88. Best value: 0.496324:  47%|████▋     | 94/200 [30:04<27:55, 15.81s/it]Best trial: 88. Best value: 0.496324:  48%|████▊     | 95/200 [30:04<27:06, 15.49s/it]Best trial: 95. Best value: 0.499149:  48%|████▊     | 95/200 [30:20<27:06, 15.49s/it]Best trial: 95. Best value: 0.499149:  48%|████▊     | 96/200 [30:20<27:07, 15.65s/it]Best trial: 95. Best value: 0.499149:  48%|████▊     | 96/200 [30:36<27:07, 15.65s/it]Best trial: 95. Best value: 0.499149:  48%|████▊     | 97/200 [30:36<27:16, 15.88s/it]Best trial: 95. Best value: 0.499149:  48%|████▊     | 97/200 [30:51<27:16, 15.88s/it]Best trial: 95. Best value: 0.499149:  49%|████▉     | 98/200 [30:51<26:39, 15.68s/it]Best trial: 95. Best value: 0.499149:  49%|████▉     | 98/200 [31:09<26:39, 15.68s/it]Best trial: 95. Best value: 0.499149:  50%|████▉     | 99/200 [31:09<27:29, 16.33s/it]Best trial: 95. Best value: 0.499149:  50%|████▉     | 99/200 [31:36<27:29, 16.33s/it]Best trial: 95. Best value: 0.499149:  50%|█████     | 100/200 [31:36<32:29, 19.50s/it]Best trial: 95. Best value: 0.499149:  50%|█████     | 100/200 [32:07<32:29, 19.50s/it]Best trial: 95. Best value: 0.499149:  50%|█████     | 101/200 [32:07<37:46, 22.90s/it]Best trial: 95. Best value: 0.499149:  50%|█████     | 101/200 [32:24<37:46, 22.90s/it]Best trial: 95. Best value: 0.499149:  51%|█████     | 102/200 [32:24<34:43, 21.26s/it]Best trial: 95. Best value: 0.499149:  51%|█████     | 102/200 [32:42<34:43, 21.26s/it]Best trial: 95. Best value: 0.499149:  52%|█████▏    | 103/200 [32:42<32:28, 20.09s/it]Best trial: 95. Best value: 0.499149:  52%|█████▏    | 103/200 [32:58<32:28, 20.09s/it]Best trial: 95. Best value: 0.499149:  52%|█████▏    | 104/200 [32:58<30:29, 19.06s/it]Best trial: 95. Best value: 0.499149:  52%|█████▏    | 104/200 [33:14<30:29, 19.06s/it]Best trial: 95. Best value: 0.499149:  52%|█████▎    | 105/200 [33:14<28:28, 17.98s/it]Best trial: 95. Best value: 0.499149:  52%|█████▎    | 105/200 [33:42<28:28, 17.98s/it]Best trial: 95. Best value: 0.499149:  53%|█████▎    | 106/200 [33:42<32:49, 20.96s/it]Best trial: 95. Best value: 0.499149:  53%|█████▎    | 106/200 [33:58<32:49, 20.96s/it]Best trial: 95. Best value: 0.499149:  54%|█████▎    | 107/200 [33:58<30:13, 19.50s/it]Best trial: 95. Best value: 0.499149:  54%|█████▎    | 107/200 [34:16<30:13, 19.50s/it]Best trial: 95. Best value: 0.499149:  54%|█████▍    | 108/200 [34:16<29:30, 19.25s/it]Best trial: 95. Best value: 0.499149:  54%|█████▍    | 108/200 [34:35<29:30, 19.25s/it]Best trial: 95. Best value: 0.499149:  55%|█████▍    | 109/200 [34:35<28:52, 19.04s/it]Best trial: 95. Best value: 0.499149:  55%|█████▍    | 109/200 [34:50<28:52, 19.04s/it]Best trial: 95. Best value: 0.499149:  55%|█████▌    | 110/200 [34:50<26:40, 17.78s/it]Best trial: 95. Best value: 0.499149:  55%|█████▌    | 110/200 [35:06<26:40, 17.78s/it]Best trial: 95. Best value: 0.499149:  56%|█████▌    | 111/200 [35:06<25:41, 17.32s/it]Best trial: 95. Best value: 0.499149:  56%|█████▌    | 111/200 [35:22<25:41, 17.32s/it]Best trial: 95. Best value: 0.499149:  56%|█████▌    | 112/200 [35:22<24:48, 16.92s/it]Best trial: 95. Best value: 0.499149:  56%|█████▌    | 112/200 [35:37<24:48, 16.92s/it]Best trial: 95. Best value: 0.499149:  56%|█████▋    | 113/200 [35:37<23:39, 16.31s/it]Best trial: 95. Best value: 0.499149:  56%|█████▋    | 113/200 [35:53<23:39, 16.31s/it]Best trial: 95. Best value: 0.499149:  57%|█████▋    | 114/200 [35:53<23:16, 16.24s/it]Best trial: 95. Best value: 0.499149:  57%|█████▋    | 114/200 [36:08<23:16, 16.24s/it]Best trial: 95. Best value: 0.499149:  57%|█████▊    | 115/200 [36:08<22:27, 15.85s/it]Best trial: 95. Best value: 0.499149:  57%|█████▊    | 115/200 [36:26<22:27, 15.85s/it]Best trial: 95. Best value: 0.499149:  58%|█████▊    | 116/200 [36:26<23:04, 16.49s/it]Best trial: 95. Best value: 0.499149:  58%|█████▊    | 116/200 [36:41<23:04, 16.49s/it]Best trial: 95. Best value: 0.499149:  58%|█████▊    | 117/200 [36:41<22:18, 16.13s/it]Best trial: 95. Best value: 0.499149:  58%|█████▊    | 117/200 [36:59<22:18, 16.13s/it]Best trial: 95. Best value: 0.499149:  59%|█████▉    | 118/200 [36:59<22:37, 16.56s/it]Best trial: 95. Best value: 0.499149:  59%|█████▉    | 118/200 [37:21<22:37, 16.56s/it]Best trial: 95. Best value: 0.499149:  60%|█████▉    | 119/200 [37:21<24:41, 18.30s/it]Best trial: 95. Best value: 0.499149:  60%|█████▉    | 119/200 [37:37<24:41, 18.30s/it]Best trial: 95. Best value: 0.499149:  60%|██████    | 120/200 [37:37<23:28, 17.61s/it]Best trial: 95. Best value: 0.499149:  60%|██████    | 120/200 [38:02<23:28, 17.61s/it]Best trial: 95. Best value: 0.499149:  60%|██████    | 121/200 [38:02<26:08, 19.86s/it]Best trial: 95. Best value: 0.499149:  60%|██████    | 121/200 [38:21<26:08, 19.86s/it]Best trial: 95. Best value: 0.499149:  61%|██████    | 122/200 [38:21<25:27, 19.58s/it]Best trial: 95. Best value: 0.499149:  61%|██████    | 122/200 [38:44<25:27, 19.58s/it]Best trial: 95. Best value: 0.499149:  62%|██████▏   | 123/200 [38:44<26:28, 20.63s/it]Best trial: 95. Best value: 0.499149:  62%|██████▏   | 123/200 [39:06<26:28, 20.63s/it]Best trial: 95. Best value: 0.499149:  62%|██████▏   | 124/200 [39:06<26:37, 21.02s/it]Best trial: 95. Best value: 0.499149:  62%|██████▏   | 124/200 [39:26<26:37, 21.02s/it]Best trial: 95. Best value: 0.499149:  62%|██████▎   | 125/200 [39:26<25:41, 20.55s/it]Best trial: 95. Best value: 0.499149:  62%|██████▎   | 125/200 [39:47<25:41, 20.55s/it]Best trial: 95. Best value: 0.499149:  63%|██████▎   | 126/200 [39:47<25:30, 20.68s/it]Best trial: 95. Best value: 0.499149:  63%|██████▎   | 126/200 [40:15<25:30, 20.68s/it]Best trial: 95. Best value: 0.499149:  64%|██████▎   | 127/200 [40:15<27:57, 22.98s/it]Best trial: 95. Best value: 0.499149:  64%|██████▎   | 127/200 [40:35<27:57, 22.98s/it]Best trial: 95. Best value: 0.499149:  64%|██████▍   | 128/200 [40:35<26:21, 21.96s/it]Best trial: 95. Best value: 0.499149:  64%|██████▍   | 128/200 [40:53<26:21, 21.96s/it]Best trial: 95. Best value: 0.499149:  64%|██████▍   | 129/200 [40:53<24:37, 20.81s/it]Best trial: 95. Best value: 0.499149:  64%|██████▍   | 129/200 [41:13<24:37, 20.81s/it]Best trial: 95. Best value: 0.499149:  65%|██████▌   | 130/200 [41:13<24:06, 20.67s/it]Best trial: 95. Best value: 0.499149:  65%|██████▌   | 130/200 [41:36<24:06, 20.67s/it]Best trial: 95. Best value: 0.499149:  66%|██████▌   | 131/200 [41:36<24:25, 21.24s/it]Best trial: 95. Best value: 0.499149:  66%|██████▌   | 131/200 [41:55<24:25, 21.24s/it]Best trial: 95. Best value: 0.499149:  66%|██████▌   | 132/200 [41:55<23:26, 20.68s/it]Best trial: 95. Best value: 0.499149:  66%|██████▌   | 132/200 [42:15<23:26, 20.68s/it]Best trial: 95. Best value: 0.499149:  66%|██████▋   | 133/200 [42:15<22:54, 20.52s/it]Best trial: 95. Best value: 0.499149:  66%|██████▋   | 133/200 [42:35<22:54, 20.52s/it]Best trial: 95. Best value: 0.499149:  67%|██████▋   | 134/200 [42:35<22:16, 20.25s/it]Best trial: 95. Best value: 0.499149:  67%|██████▋   | 134/200 [42:53<22:16, 20.25s/it]Best trial: 95. Best value: 0.499149:  68%|██████▊   | 135/200 [42:53<21:20, 19.70s/it]Best trial: 95. Best value: 0.499149:  68%|██████▊   | 135/200 [43:13<21:20, 19.70s/it]Best trial: 95. Best value: 0.499149:  68%|██████▊   | 136/200 [43:13<21:00, 19.70s/it]Best trial: 95. Best value: 0.499149:  68%|██████▊   | 136/200 [43:34<21:00, 19.70s/it]Best trial: 95. Best value: 0.499149:  68%|██████▊   | 137/200 [43:34<21:13, 20.22s/it]Best trial: 95. Best value: 0.499149:  68%|██████▊   | 137/200 [43:58<21:13, 20.22s/it]Best trial: 95. Best value: 0.499149:  69%|██████▉   | 138/200 [43:58<21:52, 21.17s/it]Best trial: 95. Best value: 0.499149:  69%|██████▉   | 138/200 [44:18<21:52, 21.17s/it]Best trial: 95. Best value: 0.499149:  70%|██████▉   | 139/200 [44:18<21:15, 20.91s/it]Best trial: 95. Best value: 0.499149:  70%|██████▉   | 139/200 [44:40<21:15, 20.91s/it]Best trial: 95. Best value: 0.499149:  70%|███████   | 140/200 [44:40<21:20, 21.34s/it]Best trial: 95. Best value: 0.499149:  70%|███████   | 140/200 [44:57<21:20, 21.34s/it]Best trial: 95. Best value: 0.499149:  70%|███████   | 141/200 [44:57<19:40, 20.01s/it]Best trial: 95. Best value: 0.499149:  70%|███████   | 141/200 [45:16<19:40, 20.01s/it]Best trial: 95. Best value: 0.499149:  71%|███████   | 142/200 [45:16<18:59, 19.65s/it]Best trial: 95. Best value: 0.499149:  71%|███████   | 142/200 [45:34<18:59, 19.65s/it]Best trial: 95. Best value: 0.499149:  72%|███████▏  | 143/200 [45:34<18:12, 19.17s/it]Best trial: 95. Best value: 0.499149:  72%|███████▏  | 143/200 [45:52<18:12, 19.17s/it]Best trial: 95. Best value: 0.499149:  72%|███████▏  | 144/200 [45:52<17:37, 18.88s/it]Best trial: 95. Best value: 0.499149:  72%|███████▏  | 144/200 [46:11<17:37, 18.88s/it]Best trial: 95. Best value: 0.499149:  72%|███████▎  | 145/200 [46:11<17:23, 18.97s/it]Best trial: 95. Best value: 0.499149:  72%|███████▎  | 145/200 [46:32<17:23, 18.97s/it]Best trial: 95. Best value: 0.499149:  73%|███████▎  | 146/200 [46:32<17:36, 19.56s/it]Best trial: 95. Best value: 0.499149:  73%|███████▎  | 146/200 [46:53<17:36, 19.56s/it]Best trial: 95. Best value: 0.499149:  74%|███████▎  | 147/200 [46:53<17:32, 19.85s/it]Best trial: 95. Best value: 0.499149:  74%|███████▎  | 147/200 [47:18<17:32, 19.85s/it]Best trial: 95. Best value: 0.499149:  74%|███████▍  | 148/200 [47:18<18:33, 21.41s/it]Best trial: 95. Best value: 0.499149:  74%|███████▍  | 148/200 [47:42<18:33, 21.41s/it]Best trial: 95. Best value: 0.499149:  74%|███████▍  | 149/200 [47:42<18:45, 22.07s/it]Best trial: 95. Best value: 0.499149:  74%|███████▍  | 149/200 [48:16<18:45, 22.07s/it]Best trial: 95. Best value: 0.499149:  75%|███████▌  | 150/200 [48:16<21:35, 25.90s/it]Best trial: 95. Best value: 0.499149:  75%|███████▌  | 150/200 [48:37<21:35, 25.90s/it]Best trial: 95. Best value: 0.499149:  76%|███████▌  | 151/200 [48:37<19:45, 24.20s/it]Best trial: 95. Best value: 0.499149:  76%|███████▌  | 151/200 [48:56<19:45, 24.20s/it]Best trial: 95. Best value: 0.499149:  76%|███████▌  | 152/200 [48:56<18:06, 22.63s/it]Best trial: 95. Best value: 0.499149:  76%|███████▌  | 152/200 [49:15<18:06, 22.63s/it]Best trial: 95. Best value: 0.499149:  76%|███████▋  | 153/200 [49:15<17:00, 21.71s/it]Best trial: 95. Best value: 0.499149:  76%|███████▋  | 153/200 [49:37<17:00, 21.71s/it]Best trial: 95. Best value: 0.499149:  77%|███████▋  | 154/200 [49:37<16:38, 21.71s/it]Best trial: 95. Best value: 0.499149:  77%|███████▋  | 154/200 [50:04<16:38, 21.71s/it]Best trial: 95. Best value: 0.499149:  78%|███████▊  | 155/200 [50:04<17:25, 23.23s/it]Best trial: 95. Best value: 0.499149:  78%|███████▊  | 155/200 [50:26<17:25, 23.23s/it]Best trial: 95. Best value: 0.499149:  78%|███████▊  | 156/200 [50:26<16:57, 23.12s/it]Best trial: 95. Best value: 0.499149:  78%|███████▊  | 156/200 [50:49<16:57, 23.12s/it]Best trial: 95. Best value: 0.499149:  78%|███████▊  | 157/200 [50:49<16:26, 22.95s/it]Best trial: 95. Best value: 0.499149:  78%|███████▊  | 157/200 [51:18<16:26, 22.95s/it]Best trial: 95. Best value: 0.499149:  79%|███████▉  | 158/200 [51:18<17:18, 24.74s/it]Best trial: 95. Best value: 0.499149:  79%|███████▉  | 158/200 [51:37<17:18, 24.74s/it]Best trial: 95. Best value: 0.499149:  80%|███████▉  | 159/200 [51:37<15:46, 23.08s/it]Best trial: 95. Best value: 0.499149:  80%|███████▉  | 159/200 [51:59<15:46, 23.08s/it]Best trial: 95. Best value: 0.499149:  80%|████████  | 160/200 [51:59<15:13, 22.83s/it]Best trial: 95. Best value: 0.499149:  80%|████████  | 160/200 [52:19<15:13, 22.83s/it]Best trial: 95. Best value: 0.499149:  80%|████████  | 161/200 [52:19<14:17, 21.99s/it]Best trial: 95. Best value: 0.499149:  80%|████████  | 161/200 [52:40<14:17, 21.99s/it]Best trial: 95. Best value: 0.499149:  81%|████████  | 162/200 [52:40<13:44, 21.70s/it]Best trial: 95. Best value: 0.499149:  81%|████████  | 162/200 [53:02<13:44, 21.70s/it]Best trial: 95. Best value: 0.499149:  82%|████████▏ | 163/200 [53:02<13:20, 21.63s/it]Best trial: 95. Best value: 0.499149:  82%|████████▏ | 163/200 [53:23<13:20, 21.63s/it]Best trial: 95. Best value: 0.499149:  82%|████████▏ | 164/200 [53:23<12:51, 21.42s/it]Best trial: 95. Best value: 0.499149:  82%|████████▏ | 164/200 [53:48<12:51, 21.42s/it]Best trial: 95. Best value: 0.499149:  82%|████████▎ | 165/200 [53:48<13:05, 22.45s/it]Best trial: 95. Best value: 0.499149:  82%|████████▎ | 165/200 [54:16<13:05, 22.45s/it]Best trial: 95. Best value: 0.499149:  83%|████████▎ | 166/200 [54:16<13:44, 24.26s/it]Best trial: 95. Best value: 0.499149:  83%|████████▎ | 166/200 [54:36<13:44, 24.26s/it]Best trial: 95. Best value: 0.499149:  84%|████████▎ | 167/200 [54:36<12:36, 22.93s/it]Best trial: 95. Best value: 0.499149:  84%|████████▎ | 167/200 [54:57<12:36, 22.93s/it]Best trial: 95. Best value: 0.499149:  84%|████████▍ | 168/200 [54:57<11:52, 22.27s/it]Best trial: 95. Best value: 0.499149:  84%|████████▍ | 168/200 [55:15<11:52, 22.27s/it]Best trial: 95. Best value: 0.499149:  84%|████████▍ | 169/200 [55:15<10:48, 20.94s/it]Best trial: 95. Best value: 0.499149:  84%|████████▍ | 169/200 [55:36<10:48, 20.94s/it]Best trial: 95. Best value: 0.499149:  85%|████████▌ | 170/200 [55:36<10:35, 21.17s/it]Best trial: 95. Best value: 0.499149:  85%|████████▌ | 170/200 [55:54<10:35, 21.17s/it]Best trial: 95. Best value: 0.499149:  86%|████████▌ | 171/200 [55:54<09:42, 20.08s/it]Best trial: 95. Best value: 0.499149:  86%|████████▌ | 171/200 [56:15<09:42, 20.08s/it]Best trial: 95. Best value: 0.499149:  86%|████████▌ | 172/200 [56:15<09:31, 20.41s/it]Best trial: 95. Best value: 0.499149:  86%|████████▌ | 172/200 [56:36<09:31, 20.41s/it]Best trial: 95. Best value: 0.499149:  86%|████████▋ | 173/200 [56:36<09:15, 20.59s/it]Best trial: 95. Best value: 0.499149:  86%|████████▋ | 173/200 [57:01<09:15, 20.59s/it]Best trial: 95. Best value: 0.499149:  87%|████████▋ | 174/200 [57:01<09:26, 21.78s/it]Best trial: 95. Best value: 0.499149:  87%|████████▋ | 174/200 [57:24<09:26, 21.78s/it]Best trial: 95. Best value: 0.499149:  88%|████████▊ | 175/200 [57:24<09:16, 22.26s/it]Best trial: 95. Best value: 0.499149:  88%|████████▊ | 175/200 [57:45<09:16, 22.26s/it]Best trial: 95. Best value: 0.499149:  88%|████████▊ | 176/200 [57:45<08:45, 21.89s/it]Best trial: 95. Best value: 0.499149:  88%|████████▊ | 176/200 [58:05<08:45, 21.89s/it]Best trial: 95. Best value: 0.499149:  88%|████████▊ | 177/200 [58:05<08:13, 21.44s/it]Best trial: 95. Best value: 0.499149:  88%|████████▊ | 177/200 [58:29<08:13, 21.44s/it]Best trial: 95. Best value: 0.499149:  89%|████████▉ | 178/200 [58:29<08:06, 22.11s/it]Best trial: 95. Best value: 0.499149:  89%|████████▉ | 178/200 [58:53<08:06, 22.11s/it]Best trial: 95. Best value: 0.499149:  90%|████████▉ | 179/200 [58:53<07:54, 22.58s/it]Best trial: 95. Best value: 0.499149:  90%|████████▉ | 179/200 [59:15<07:54, 22.58s/it]Best trial: 95. Best value: 0.499149:  90%|█████████ | 180/200 [59:15<07:27, 22.39s/it]Best trial: 95. Best value: 0.499149:  90%|█████████ | 180/200 [59:35<07:27, 22.39s/it]Best trial: 95. Best value: 0.499149:  90%|█████████ | 181/200 [59:35<06:52, 21.73s/it]Best trial: 95. Best value: 0.499149:  90%|█████████ | 181/200 [59:55<06:52, 21.73s/it]Best trial: 95. Best value: 0.499149:  91%|█████████ | 182/200 [59:55<06:21, 21.21s/it]Best trial: 95. Best value: 0.499149:  91%|█████████ | 182/200 [1:00:15<06:21, 21.21s/it]Best trial: 95. Best value: 0.499149:  92%|█████████▏| 183/200 [1:00:15<05:54, 20.82s/it]Best trial: 95. Best value: 0.499149:  92%|█████████▏| 183/200 [1:00:38<05:54, 20.82s/it]Best trial: 95. Best value: 0.499149:  92%|█████████▏| 184/200 [1:00:38<05:44, 21.51s/it]Best trial: 95. Best value: 0.499149:  92%|█████████▏| 184/200 [1:01:01<05:44, 21.51s/it]Best trial: 95. Best value: 0.499149:  92%|█████████▎| 185/200 [1:01:01<05:28, 21.88s/it]Best trial: 95. Best value: 0.499149:  92%|█████████▎| 185/200 [1:01:20<05:28, 21.88s/it]Best trial: 95. Best value: 0.499149:  93%|█████████▎| 186/200 [1:01:20<04:57, 21.26s/it]Best trial: 95. Best value: 0.499149:  93%|█████████▎| 186/200 [1:01:41<04:57, 21.26s/it]Best trial: 95. Best value: 0.499149:  94%|█████████▎| 187/200 [1:01:41<04:33, 21.02s/it]Best trial: 95. Best value: 0.499149:  94%|█████████▎| 187/200 [1:02:20<04:33, 21.02s/it]Best trial: 95. Best value: 0.499149:  94%|█████████▍| 188/200 [1:02:20<05:15, 26.33s/it]Best trial: 95. Best value: 0.499149:  94%|█████████▍| 188/200 [1:02:41<05:15, 26.33s/it]Best trial: 95. Best value: 0.499149:  94%|█████████▍| 189/200 [1:02:41<04:32, 24.79s/it]Best trial: 95. Best value: 0.499149:  94%|█████████▍| 189/200 [1:03:11<04:32, 24.79s/it]Best trial: 95. Best value: 0.499149:  95%|█████████▌| 190/200 [1:03:11<04:25, 26.52s/it]Best trial: 95. Best value: 0.499149:  95%|█████████▌| 190/200 [1:03:33<04:25, 26.52s/it]Best trial: 95. Best value: 0.499149:  96%|█████████▌| 191/200 [1:03:33<03:46, 25.14s/it]Best trial: 95. Best value: 0.499149:  96%|█████████▌| 191/200 [1:04:00<03:46, 25.14s/it]Best trial: 95. Best value: 0.499149:  96%|█████████▌| 192/200 [1:04:00<03:23, 25.49s/it]Best trial: 95. Best value: 0.499149:  96%|█████████▌| 192/200 [1:04:24<03:23, 25.49s/it]Best trial: 95. Best value: 0.499149:  96%|█████████▋| 193/200 [1:04:24<02:55, 25.10s/it]Best trial: 95. Best value: 0.499149:  96%|█████████▋| 193/200 [1:04:48<02:55, 25.10s/it]Best trial: 95. Best value: 0.499149:  97%|█████████▋| 194/200 [1:04:48<02:28, 24.80s/it]Best trial: 95. Best value: 0.499149:  97%|█████████▋| 194/200 [1:05:08<02:28, 24.80s/it]Best trial: 95. Best value: 0.499149:  98%|█████████▊| 195/200 [1:05:08<01:56, 23.32s/it]Best trial: 95. Best value: 0.499149:  98%|█████████▊| 195/200 [1:05:30<01:56, 23.32s/it]Best trial: 95. Best value: 0.499149:  98%|█████████▊| 196/200 [1:05:30<01:31, 22.94s/it]Best trial: 95. Best value: 0.499149:  98%|█████████▊| 196/200 [1:05:56<01:31, 22.94s/it]Best trial: 95. Best value: 0.499149:  98%|█████████▊| 197/200 [1:05:56<01:12, 24.03s/it]Best trial: 95. Best value: 0.499149:  98%|█████████▊| 197/200 [1:06:22<01:12, 24.03s/it]Best trial: 95. Best value: 0.499149:  99%|█████████▉| 198/200 [1:06:22<00:49, 24.54s/it]Best trial: 95. Best value: 0.499149:  99%|█████████▉| 198/200 [1:06:47<00:49, 24.54s/it]Best trial: 95. Best value: 0.499149: 100%|█████████▉| 199/200 [1:06:47<00:24, 24.66s/it]Best trial: 95. Best value: 0.499149: 100%|█████████▉| 199/200 [1:07:16<00:24, 24.66s/it]Best trial: 95. Best value: 0.499149: 100%|██████████| 200/200 [1:07:16<00:00, 25.86s/it]Best trial: 95. Best value: 0.499149: 100%|██████████| 200/200 [1:07:16<00:00, 20.18s/it]
02:09:36 [INFO] models.training.ordinal_trainer: Best params: {'bootstrap_type': 'Bayesian', 'grow_policy': 'SymmetricTree', 'depth': 6, 'iterations': 344, 'learning_rate': 0.04307994850748353, 'border_count': 76, 'l2_leaf_reg': 0.30867297477989963, 'min_data_in_leaf': 15, 'random_strength': 0.6492484399468872, 'colsample_bylevel': 0.5969580729654558, 'bagging_temperature': 0.3597364919590467}
02:09:36 [INFO] models.training.ordinal_trainer: Best Within-2 Rate: 0.4991
02:09:39 [INFO] models.training.ordinal_trainer:   Threshold -11: trained (pos_rate=88.5%)
02:09:41 [INFO] models.training.ordinal_trainer:   Threshold -10: trained (pos_rate=87.6%)
02:09:43 [INFO] models.training.ordinal_trainer:   Threshold -9: trained (pos_rate=85.7%)
02:09:46 [INFO] models.training.ordinal_trainer:   Threshold -8: trained (pos_rate=84.2%)
02:09:49 [INFO] models.training.ordinal_trainer:   Threshold -7: trained (pos_rate=81.5%)
02:09:51 [INFO] models.training.ordinal_trainer:   Threshold -6: trained (pos_rate=80.1%)
02:09:53 [INFO] models.training.ordinal_trainer:   Threshold -5: trained (pos_rate=77.5%)
02:09:55 [INFO] models.training.ordinal_trainer:   Threshold -4: trained (pos_rate=75.4%)
02:09:57 [INFO] models.training.ordinal_trainer:   Threshold -3: trained (pos_rate=71.3%)
02:09:59 [INFO] models.training.ordinal_trainer:   Threshold -2: trained (pos_rate=69.0%)
02:10:01 [INFO] models.training.ordinal_trainer:   Threshold -1: trained (pos_rate=64.1%)
02:10:04 [INFO] models.training.ordinal_trainer:   Threshold +0: trained (pos_rate=58.5%)
02:10:09 [INFO] models.training.ordinal_trainer:   Threshold +1: trained (pos_rate=44.2%)
02:10:11 [INFO] models.training.ordinal_trainer:   Threshold +2: trained (pos_rate=37.4%)
02:10:13 [INFO] models.training.ordinal_trainer:   Threshold +3: trained (pos_rate=32.3%)
02:10:14 [INFO] models.training.ordinal_trainer:   Threshold +4: trained (pos_rate=29.2%)
02:10:18 [INFO] models.training.ordinal_trainer:   Threshold +5: trained (pos_rate=25.3%)
02:10:20 [INFO] models.training.ordinal_trainer:   Threshold +6: trained (pos_rate=22.7%)
02:10:21 [INFO] models.training.ordinal_trainer:   Threshold +7: trained (pos_rate=19.5%)
02:10:23 [INFO] models.training.ordinal_trainer:   Threshold +8: trained (pos_rate=17.2%)
02:10:24 [INFO] models.training.ordinal_trainer:   Threshold +9: trained (pos_rate=15.2%)
02:10:26 [INFO] models.training.ordinal_trainer:   Threshold +10: trained (pos_rate=13.0%)
02:10:28 [INFO] models.training.ordinal_trainer:   Threshold +11: trained (pos_rate=11.0%)
02:10:29 [INFO] models.training.ordinal_trainer:   Threshold +12: trained (pos_rate=9.5%)
02:10:29 [INFO] models.training.ordinal_trainer: Ordinal training complete: 24 classifiers
02:10:31 [INFO] models.training.ordinal_trainer: Saved ordinal model to models/saved/denver/ordinal_catboost_optuna.pkl
02:10:31 [INFO] __main__: 
Saved model to models/saved/denver/ordinal_catboost_optuna.pkl
02:10:31 [INFO] __main__: Saved best params to models/saved/denver/best_params.json
02:10:31 [INFO] __main__: Saved final metrics to models/saved/denver/final_metrics_denver.json

============================================================
EVALUATION
============================================================

Test Set Metrics:
----------------------------------------
  delta_accuracy: 0.0881
  delta_mae: 10.9219
  off_by_1_rate: 0.0306
  off_by_2plus_rate: 0.8813
  within_1_rate: 0.1187
  within_2_rate: 0.1538

============================================================
FEATURE IMPORTANCE
============================================================

Top 30 Features:
                           feature  importance
0          temp_zscore_vs_forecast    8.039297
1             fcst_peak_hour_float    7.787812
2            fcst_prev_hour_of_max    7.179912
3              fcst_cloudcover_max    4.595537
4             obs_fcst_gap_squared    4.408156
5       expected_delta_uncertainty    3.683740
6             log_abs_obs_fcst_gap    3.139988
7             fcst_multi_range_pct    2.723254
8                   fcst_obs_ratio    2.712706
9                num_samples_sofar    2.651224
10            fcst_cloudcover_mean    2.494243
11                obs_fcst_max_gap    2.440917
12        fcst_remaining_potential    2.254166
13                delta_vcmax_lag1    2.058090
14      minutes_since_max_observed    2.004496
15            hours_until_fcst_max    1.892241
16                remaining_upside    1.838834
17                   fcst_multi_cv    1.824102
18         confidence_weighted_gap    1.697717
19             fcst_dewpoint_range    1.583305
20        fcst_peak_band_width_min    1.523965
21           fcst_multi_t1_t2_diff    1.472722
22         hours_since_market_open    1.346901
23               fcst_dewpoint_min    1.326571
24  log_expected_delta_uncertainty    1.307328
25              log_hours_to_close    1.262441
26                   vc_max_f_lag7    1.251751
27           gap_x_hours_remaining    1.183105
28                         doy_cos    1.003114
29             fcst_humidity_range    0.978100

----------------------------------------
Station-city feature importance:
                         feature  importance
66    station_city_max_gap_sofar    0.200166
87          station_city_gap_std    0.070393
96   station_city_mean_gap_sofar    0.050669
110       station_city_gap_trend    0.013788
114  station_city_gap_x_fcst_gap    0.006056
150        station_city_temp_gap    0.000000
  station_city_max_gap_sofar: rank 67/201
  station_city_gap_std: rank 88/201
  station_city_mean_gap_sofar: rank 97/201
  station_city_gap_trend: rank 111/201
  station_city_gap_x_fcst_gap: rank 115/201
  station_city_temp_gap: rank 151/201

----------------------------------------
Multi-horizon feature importance:
                  feature  importance
7    fcst_multi_range_pct    2.723254
17          fcst_multi_cv    1.824102
21  fcst_multi_t1_t2_diff    1.472722
33       fcst_multi_range    0.779228
36       fcst_multi_drift    0.618672
45      fcst_multi_median    0.450537
50         fcst_multi_ema    0.399105
52         fcst_multi_std    0.368454
71        fcst_multi_mean    0.166322
  fcst_multi_range_pct: rank 8/201
  fcst_multi_cv: rank 18/201
  fcst_multi_t1_t2_diff: rank 22/201
  fcst_multi_range: rank 34/201
  fcst_multi_drift: rank 37/201
  fcst_multi_median: rank 46/201
  fcst_multi_ema: rank 51/201
  fcst_multi_std: rank 53/201
  fcst_multi_mean: rank 72/201

============================================================
SUMMARY
============================================================
City: denver
Model: models/saved/denver/ordinal_catboost_optuna.pkl
Params: models/saved/denver/best_params.json
Metrics: models/saved/denver/final_metrics_denver.json
Training samples: 389,796
Test samples: 97,128
Optuna trials: 200
Best params: {'bootstrap_type': 'Bayesian', 'grow_policy': 'SymmetricTree', 'depth': 6, 'iterations': 344, 'learning_rate': 0.04307994850748353, 'border_count': 76, 'l2_leaf_reg': 0.30867297477989963, 'min_data_in_leaf': 15, 'random_strength': 0.6492484399468872, 'colsample_bylevel': 0.5969580729654558, 'bagging_temperature': 0.3597364919590467}

Key Metrics:
  Accuracy: 8.8%
  MAE: 10.92
  Within 1: 11.9%
  Within 2: 15.4%

============================================================
DONE
============================================================
