03:14:56 [INFO] __main__: ============================================================
03:14:56 [INFO] __main__: MIAMI Optuna Training (200 trials)
03:14:56 [INFO] __main__: Optimization objective: within2
03:14:56 [INFO] __main__: ============================================================
03:14:56 [INFO] __main__: Loading from training cache: data/training_cache/miami/full.parquet
03:14:57 [INFO] __main__: Loaded 486,900 rows, 237 columns
03:14:57 [INFO] __main__: Data range after filtering: 2023-01-01 to 2025-12-03
03:14:58 [INFO] __main__: Total days: 1068
03:14:58 [INFO] __main__: Training: 2023-01-01 to 2025-05-04 (855 days)
03:14:58 [INFO] __main__: Testing:  2025-05-05 to 2025-12-03 (213 days)
03:14:58 [INFO] __main__: 
Training samples: 389,772
03:14:58 [INFO] __main__: Training days: 855
03:14:58 [INFO] __main__: Test samples: 97,128
03:14:58 [INFO] __main__: Test days: 213
03:14:58 [INFO] __main__: 
Station-city features: ['station_city_temp_gap', 'station_city_max_gap_sofar', 'station_city_mean_gap_sofar', 'station_city_gap_std', 'station_city_gap_trend', 'station_city_gap_x_fcst_gap']
03:14:58 [INFO] __main__:   station_city_temp_gap: 389,664/389,772 non-null (100.0%)
03:14:58 [INFO] __main__:   station_city_max_gap_sofar: 389,664/389,772 non-null (100.0%)
03:14:58 [INFO] __main__:   station_city_mean_gap_sofar: 389,664/389,772 non-null (100.0%)
03:14:58 [INFO] __main__:   station_city_gap_std: 389,664/389,772 non-null (100.0%)
03:14:58 [INFO] __main__:   station_city_gap_trend: 389,658/389,772 non-null (100.0%)
03:14:58 [INFO] __main__:   station_city_gap_x_fcst_gap: 389,664/389,772 non-null (100.0%)
03:14:58 [INFO] __main__: 
Multi-horizon features: ['fcst_multi_mean', 'fcst_multi_median', 'fcst_multi_ema', 'fcst_multi_std', 'fcst_multi_range', 'fcst_multi_t1_t2_diff', 'fcst_multi_drift', 'fcst_multi_cv', 'fcst_multi_range_pct']
03:14:58 [INFO] __main__:   fcst_multi_mean: 389,772/389,772 non-null (100.0%)
03:14:58 [INFO] __main__:   fcst_multi_median: 389,772/389,772 non-null (100.0%)
03:14:58 [INFO] __main__:   fcst_multi_ema: 389,772/389,772 non-null (100.0%)
03:14:58 [INFO] __main__:   fcst_multi_std: 389,772/389,772 non-null (100.0%)
03:14:58 [INFO] __main__:   fcst_multi_range: 389,772/389,772 non-null (100.0%)
03:14:58 [INFO] __main__:   fcst_multi_t1_t2_diff: 389,772/389,772 non-null (100.0%)
03:14:58 [INFO] __main__:   fcst_multi_drift: 389,772/389,772 non-null (100.0%)
03:14:58 [INFO] __main__:   fcst_multi_cv: 389,772/389,772 non-null (100.0%)
03:14:58 [INFO] __main__:   fcst_multi_range_pct: 389,772/389,772 non-null (100.0%)
03:14:58 [INFO] models.training.ordinal_trainer: Training ordinal model (catboost) on 389772 samples
03:14:59 [INFO] models.training.ordinal_trainer: City delta range: [-12, 12]
03:14:59 [INFO] models.training.ordinal_trainer: Training 24 threshold classifiers: [-11, -10, -9, -8, -7, -6, -5, -4, -3, -2, -1, 0, 1, 2, 3, 4, 5, 6, 7, 8, 9, 10, 11, 12]
03:14:59 [INFO] models.training.ordinal_trainer: Starting Optuna tuning with 200 trials (objective=within2)

============================================================
OPTUNA TRAINING (200 trials, objective=within2)
============================================================
  0%|          | 0/200 [00:00<?, ?it/s]Best trial: 0. Best value: 0.637694:   0%|          | 0/200 [00:31<?, ?it/s]Best trial: 0. Best value: 0.637694:   0%|          | 1/200 [00:31<1:44:05, 31.38s/it]Best trial: 0. Best value: 0.637694:   0%|          | 1/200 [00:52<1:44:05, 31.38s/it]Best trial: 0. Best value: 0.637694:   1%|          | 2/200 [00:52<1:24:18, 25.55s/it]Best trial: 0. Best value: 0.637694:   1%|          | 2/200 [01:12<1:24:18, 25.55s/it]Best trial: 0. Best value: 0.637694:   2%|▏         | 3/200 [01:12<1:14:35, 22.72s/it]Best trial: 0. Best value: 0.637694:   2%|▏         | 3/200 [01:43<1:14:35, 22.72s/it]Best trial: 0. Best value: 0.637694:   2%|▏         | 4/200 [01:43<1:25:42, 26.24s/it]Best trial: 0. Best value: 0.637694:   2%|▏         | 4/200 [02:08<1:25:42, 26.24s/it]Best trial: 0. Best value: 0.637694:   2%|▎         | 5/200 [02:08<1:22:59, 25.54s/it]Best trial: 0. Best value: 0.637694:   2%|▎         | 5/200 [02:39<1:22:59, 25.54s/it]Best trial: 0. Best value: 0.637694:   3%|▎         | 6/200 [02:39<1:28:45, 27.45s/it]Best trial: 0. Best value: 0.637694:   3%|▎         | 6/200 [03:00<1:28:45, 27.45s/it]Best trial: 0. Best value: 0.637694:   4%|▎         | 7/200 [03:00<1:22:13, 25.56s/it]Best trial: 0. Best value: 0.637694:   4%|▎         | 7/200 [03:20<1:22:13, 25.56s/it]Best trial: 0. Best value: 0.637694:   4%|▍         | 8/200 [03:20<1:15:51, 23.71s/it]Best trial: 0. Best value: 0.637694:   4%|▍         | 8/200 [03:39<1:15:51, 23.71s/it]Best trial: 0. Best value: 0.637694:   4%|▍         | 9/200 [03:39<1:10:35, 22.18s/it]Best trial: 0. Best value: 0.637694:   4%|▍         | 9/200 [04:31<1:10:35, 22.18s/it]Best trial: 0. Best value: 0.637694:   5%|▌         | 10/200 [04:31<1:39:15, 31.34s/it]Best trial: 0. Best value: 0.637694:   5%|▌         | 10/200 [06:41<1:39:15, 31.34s/it]Best trial: 0. Best value: 0.637694:   6%|▌         | 11/200 [06:41<3:13:39, 61.48s/it]Best trial: 0. Best value: 0.637694:   6%|▌         | 11/200 [07:23<3:13:39, 61.48s/it]Best trial: 0. Best value: 0.637694:   6%|▌         | 12/200 [07:23<2:54:36, 55.72s/it]Best trial: 0. Best value: 0.637694:   6%|▌         | 12/200 [07:54<2:54:36, 55.72s/it]Best trial: 0. Best value: 0.637694:   6%|▋         | 13/200 [07:54<2:30:07, 48.17s/it]Best trial: 0. Best value: 0.637694:   6%|▋         | 13/200 [08:25<2:30:07, 48.17s/it]Best trial: 0. Best value: 0.637694:   7%|▋         | 14/200 [08:25<2:13:15, 42.99s/it]Best trial: 0. Best value: 0.637694:   7%|▋         | 14/200 [08:57<2:13:15, 42.99s/it]Best trial: 0. Best value: 0.637694:   8%|▊         | 15/200 [08:57<2:01:58, 39.56s/it]Best trial: 0. Best value: 0.637694:   8%|▊         | 15/200 [09:26<2:01:58, 39.56s/it]Best trial: 0. Best value: 0.637694:   8%|▊         | 16/200 [09:26<1:51:33, 36.38s/it]Best trial: 0. Best value: 0.637694:   8%|▊         | 16/200 [10:03<1:51:33, 36.38s/it]Best trial: 0. Best value: 0.637694:   8%|▊         | 17/200 [10:03<1:51:52, 36.68s/it]Best trial: 0. Best value: 0.637694:   8%|▊         | 17/200 [11:02<1:51:52, 36.68s/it]Best trial: 0. Best value: 0.637694:   9%|▉         | 18/200 [11:02<2:11:10, 43.24s/it]Best trial: 0. Best value: 0.637694:   9%|▉         | 18/200 [11:57<2:11:10, 43.24s/it]Best trial: 0. Best value: 0.637694:  10%|▉         | 19/200 [11:57<2:21:41, 46.97s/it]Best trial: 0. Best value: 0.637694:  10%|▉         | 19/200 [12:15<2:21:41, 46.97s/it]Best trial: 0. Best value: 0.637694:  10%|█         | 20/200 [12:15<1:54:25, 38.14s/it]Best trial: 0. Best value: 0.637694:  10%|█         | 20/200 [12:57<1:54:25, 38.14s/it]Best trial: 0. Best value: 0.637694:  10%|█         | 21/200 [12:57<1:57:26, 39.37s/it]Best trial: 0. Best value: 0.637694:  10%|█         | 21/200 [13:32<1:57:26, 39.37s/it]Best trial: 0. Best value: 0.637694:  11%|█         | 22/200 [13:32<1:53:16, 38.18s/it]Best trial: 0. Best value: 0.637694:  11%|█         | 22/200 [14:02<1:53:16, 38.18s/it]Best trial: 0. Best value: 0.637694:  12%|█▏        | 23/200 [14:02<1:45:25, 35.74s/it]Best trial: 0. Best value: 0.637694:  12%|█▏        | 23/200 [14:42<1:45:25, 35.74s/it]Best trial: 0. Best value: 0.637694:  12%|█▏        | 24/200 [14:42<1:48:20, 36.94s/it]Best trial: 0. Best value: 0.637694:  12%|█▏        | 24/200 [15:05<1:48:20, 36.94s/it]Best trial: 0. Best value: 0.637694:  12%|█▎        | 25/200 [15:05<1:34:59, 32.57s/it]Best trial: 0. Best value: 0.637694:  12%|█▎        | 25/200 [15:26<1:34:59, 32.57s/it]Best trial: 0. Best value: 0.637694:  13%|█▎        | 26/200 [15:26<1:24:25, 29.11s/it]Best trial: 0. Best value: 0.637694:  13%|█▎        | 26/200 [15:53<1:24:25, 29.11s/it]Best trial: 0. Best value: 0.637694:  14%|█▎        | 27/200 [15:53<1:22:52, 28.74s/it]Best trial: 0. Best value: 0.637694:  14%|█▎        | 27/200 [16:19<1:22:52, 28.74s/it]Best trial: 0. Best value: 0.637694:  14%|█▍        | 28/200 [16:19<1:19:32, 27.75s/it]Best trial: 0. Best value: 0.637694:  14%|█▍        | 28/200 [16:55<1:19:32, 27.75s/it]Best trial: 0. Best value: 0.637694:  14%|█▍        | 29/200 [16:55<1:25:52, 30.13s/it]Best trial: 0. Best value: 0.637694:  14%|█▍        | 29/200 [17:22<1:25:52, 30.13s/it]Best trial: 0. Best value: 0.637694:  15%|█▌        | 30/200 [17:22<1:23:05, 29.32s/it]Best trial: 0. Best value: 0.637694:  15%|█▌        | 30/200 [17:39<1:23:05, 29.32s/it]Best trial: 0. Best value: 0.637694:  16%|█▌        | 31/200 [17:39<1:12:13, 25.64s/it]Best trial: 0. Best value: 0.637694:  16%|█▌        | 31/200 [18:18<1:12:13, 25.64s/it]Best trial: 0. Best value: 0.637694:  16%|█▌        | 32/200 [18:18<1:22:39, 29.52s/it]Best trial: 0. Best value: 0.637694:  16%|█▌        | 32/200 [18:50<1:22:39, 29.52s/it]Best trial: 0. Best value: 0.637694:  16%|█▋        | 33/200 [18:50<1:24:17, 30.28s/it]Best trial: 0. Best value: 0.637694:  16%|█▋        | 33/200 [19:11<1:24:17, 30.28s/it]Best trial: 0. Best value: 0.637694:  17%|█▋        | 34/200 [19:11<1:16:15, 27.57s/it]Best trial: 0. Best value: 0.637694:  17%|█▋        | 34/200 [19:53<1:16:15, 27.57s/it]Best trial: 0. Best value: 0.637694:  18%|█▊        | 35/200 [19:53<1:27:52, 31.95s/it]Best trial: 0. Best value: 0.637694:  18%|█▊        | 35/200 [20:23<1:27:52, 31.95s/it]Best trial: 0. Best value: 0.637694:  18%|█▊        | 36/200 [20:23<1:25:17, 31.20s/it]Best trial: 0. Best value: 0.637694:  18%|█▊        | 36/200 [20:51<1:25:17, 31.20s/it]Best trial: 0. Best value: 0.637694:  18%|█▊        | 37/200 [20:51<1:22:16, 30.29s/it]Best trial: 0. Best value: 0.637694:  18%|█▊        | 37/200 [21:19<1:22:16, 30.29s/it]Best trial: 0. Best value: 0.637694:  19%|█▉        | 38/200 [21:19<1:19:55, 29.60s/it]Best trial: 0. Best value: 0.637694:  19%|█▉        | 38/200 [21:40<1:19:55, 29.60s/it]Best trial: 0. Best value: 0.637694:  20%|█▉        | 39/200 [21:40<1:12:59, 27.20s/it]Best trial: 39. Best value: 0.670136:  20%|█▉        | 39/200 [21:57<1:12:59, 27.20s/it]Best trial: 39. Best value: 0.670136:  20%|██        | 40/200 [21:57<1:03:45, 23.91s/it]Best trial: 39. Best value: 0.670136:  20%|██        | 40/200 [22:16<1:03:45, 23.91s/it]Best trial: 39. Best value: 0.670136:  20%|██        | 41/200 [22:16<59:40, 22.52s/it]  Best trial: 39. Best value: 0.670136:  20%|██        | 41/200 [22:35<59:40, 22.52s/it]Best trial: 39. Best value: 0.670136:  21%|██        | 42/200 [22:35<56:54, 21.61s/it]Best trial: 39. Best value: 0.670136:  21%|██        | 42/200 [22:57<56:54, 21.61s/it]Best trial: 39. Best value: 0.670136:  22%|██▏       | 43/200 [22:57<56:34, 21.62s/it]Best trial: 39. Best value: 0.670136:  22%|██▏       | 43/200 [23:19<56:34, 21.62s/it]Best trial: 39. Best value: 0.670136:  22%|██▏       | 44/200 [23:19<56:35, 21.76s/it]Best trial: 39. Best value: 0.670136:  22%|██▏       | 44/200 [23:43<56:35, 21.76s/it]Best trial: 39. Best value: 0.670136:  22%|██▎       | 45/200 [23:43<57:49, 22.38s/it]Best trial: 39. Best value: 0.670136:  22%|██▎       | 45/200 [24:04<57:49, 22.38s/it]Best trial: 39. Best value: 0.670136:  23%|██▎       | 46/200 [24:04<56:31, 22.02s/it]Best trial: 39. Best value: 0.670136:  23%|██▎       | 46/200 [24:19<56:31, 22.02s/it]Best trial: 39. Best value: 0.670136:  24%|██▎       | 47/200 [24:19<50:25, 19.78s/it]Best trial: 39. Best value: 0.670136:  24%|██▎       | 47/200 [24:39<50:25, 19.78s/it]Best trial: 39. Best value: 0.670136:  24%|██▍       | 48/200 [24:39<50:42, 20.02s/it]Best trial: 39. Best value: 0.670136:  24%|██▍       | 48/200 [25:06<50:42, 20.02s/it]Best trial: 39. Best value: 0.670136:  24%|██▍       | 49/200 [25:06<55:50, 22.19s/it]Best trial: 39. Best value: 0.670136:  24%|██▍       | 49/200 [25:32<55:50, 22.19s/it]Best trial: 39. Best value: 0.670136:  25%|██▌       | 50/200 [25:32<58:02, 23.21s/it]Best trial: 39. Best value: 0.670136:  25%|██▌       | 50/200 [26:07<58:02, 23.21s/it]Best trial: 39. Best value: 0.670136:  26%|██▌       | 51/200 [26:07<1:06:04, 26.61s/it]Best trial: 39. Best value: 0.670136:  26%|██▌       | 51/200 [26:25<1:06:04, 26.61s/it]Best trial: 39. Best value: 0.670136:  26%|██▌       | 52/200 [26:25<59:30, 24.13s/it]  Best trial: 39. Best value: 0.670136:  26%|██▌       | 52/200 [26:49<59:30, 24.13s/it]Best trial: 39. Best value: 0.670136:  26%|██▋       | 53/200 [26:49<58:45, 23.98s/it]Best trial: 39. Best value: 0.670136:  26%|██▋       | 53/200 [27:05<58:45, 23.98s/it]Best trial: 39. Best value: 0.670136:  27%|██▋       | 54/200 [27:05<52:53, 21.74s/it]Best trial: 39. Best value: 0.670136:  27%|██▋       | 54/200 [27:28<52:53, 21.74s/it]Best trial: 39. Best value: 0.670136:  28%|██▊       | 55/200 [27:28<53:08, 21.99s/it]Best trial: 39. Best value: 0.670136:  28%|██▊       | 55/200 [27:58<53:08, 21.99s/it]Best trial: 39. Best value: 0.670136:  28%|██▊       | 56/200 [27:58<58:50, 24.52s/it]Best trial: 39. Best value: 0.670136:  28%|██▊       | 56/200 [28:18<58:50, 24.52s/it]Best trial: 39. Best value: 0.670136:  28%|██▊       | 57/200 [28:18<54:54, 23.04s/it]Best trial: 39. Best value: 0.670136:  28%|██▊       | 57/200 [28:43<54:54, 23.04s/it]Best trial: 39. Best value: 0.670136:  29%|██▉       | 58/200 [28:43<56:21, 23.81s/it]Best trial: 39. Best value: 0.670136:  29%|██▉       | 58/200 [29:02<56:21, 23.81s/it]Best trial: 39. Best value: 0.670136:  30%|██▉       | 59/200 [29:02<52:12, 22.22s/it]Best trial: 39. Best value: 0.670136:  30%|██▉       | 59/200 [29:26<52:12, 22.22s/it]Best trial: 39. Best value: 0.670136:  30%|███       | 60/200 [29:26<52:56, 22.69s/it]Best trial: 39. Best value: 0.670136:  30%|███       | 60/200 [29:46<52:56, 22.69s/it]Best trial: 39. Best value: 0.670136:  30%|███       | 61/200 [29:46<51:01, 22.03s/it]Best trial: 39. Best value: 0.670136:  30%|███       | 61/200 [30:12<51:01, 22.03s/it]Best trial: 39. Best value: 0.670136:  31%|███       | 62/200 [30:12<53:01, 23.05s/it]Best trial: 39. Best value: 0.670136:  31%|███       | 62/200 [30:33<53:01, 23.05s/it]Best trial: 39. Best value: 0.670136:  32%|███▏      | 63/200 [30:33<51:29, 22.55s/it]Best trial: 39. Best value: 0.670136:  32%|███▏      | 63/200 [31:08<51:29, 22.55s/it]Best trial: 39. Best value: 0.670136:  32%|███▏      | 64/200 [31:08<59:33, 26.28s/it]Best trial: 39. Best value: 0.670136:  32%|███▏      | 64/200 [31:34<59:33, 26.28s/it]Best trial: 39. Best value: 0.670136:  32%|███▎      | 65/200 [31:34<59:06, 26.27s/it]Best trial: 39. Best value: 0.670136:  32%|███▎      | 65/200 [31:59<59:06, 26.27s/it]Best trial: 39. Best value: 0.670136:  33%|███▎      | 66/200 [31:59<57:31, 25.76s/it]Best trial: 39. Best value: 0.670136:  33%|███▎      | 66/200 [32:25<57:31, 25.76s/it]Best trial: 39. Best value: 0.670136:  34%|███▎      | 67/200 [32:25<57:12, 25.81s/it]Best trial: 39. Best value: 0.670136:  34%|███▎      | 67/200 [32:50<57:12, 25.81s/it]Best trial: 39. Best value: 0.670136:  34%|███▍      | 68/200 [32:50<56:18, 25.59s/it]Best trial: 39. Best value: 0.670136:  34%|███▍      | 68/200 [33:21<56:18, 25.59s/it]Best trial: 39. Best value: 0.670136:  34%|███▍      | 69/200 [33:21<59:19, 27.17s/it]Best trial: 39. Best value: 0.670136:  34%|███▍      | 69/200 [33:47<59:19, 27.17s/it]Best trial: 39. Best value: 0.670136:  35%|███▌      | 70/200 [33:47<58:29, 26.99s/it]Best trial: 39. Best value: 0.670136:  35%|███▌      | 70/200 [34:16<58:29, 26.99s/it]Best trial: 39. Best value: 0.670136:  36%|███▌      | 71/200 [34:16<59:16, 27.57s/it]Best trial: 39. Best value: 0.670136:  36%|███▌      | 71/200 [34:45<59:16, 27.57s/it]Best trial: 39. Best value: 0.670136:  36%|███▌      | 72/200 [34:45<59:36, 27.94s/it]Best trial: 39. Best value: 0.670136:  36%|███▌      | 72/200 [35:27<59:36, 27.94s/it]Best trial: 39. Best value: 0.670136:  36%|███▋      | 73/200 [35:27<1:07:55, 32.09s/it]Best trial: 39. Best value: 0.670136:  36%|███▋      | 73/200 [35:52<1:07:55, 32.09s/it]Best trial: 39. Best value: 0.670136:  37%|███▋      | 74/200 [35:52<1:03:15, 30.13s/it]Best trial: 39. Best value: 0.670136:  37%|███▋      | 74/200 [36:24<1:03:15, 30.13s/it]Best trial: 39. Best value: 0.670136:  38%|███▊      | 75/200 [36:24<1:03:47, 30.62s/it]Best trial: 39. Best value: 0.670136:  38%|███▊      | 75/200 [36:53<1:03:47, 30.62s/it]Best trial: 39. Best value: 0.670136:  38%|███▊      | 76/200 [36:53<1:02:13, 30.11s/it]Best trial: 39. Best value: 0.670136:  38%|███▊      | 76/200 [37:22<1:02:13, 30.11s/it]Best trial: 39. Best value: 0.670136:  38%|███▊      | 77/200 [37:22<1:00:57, 29.73s/it]Best trial: 39. Best value: 0.670136:  38%|███▊      | 77/200 [37:49<1:00:57, 29.73s/it]Best trial: 39. Best value: 0.670136:  39%|███▉      | 78/200 [37:49<59:10, 29.10s/it]  Best trial: 39. Best value: 0.670136:  39%|███▉      | 78/200 [38:16<59:10, 29.10s/it]Best trial: 39. Best value: 0.670136:  40%|███▉      | 79/200 [38:16<57:26, 28.48s/it]Best trial: 39. Best value: 0.670136:  40%|███▉      | 79/200 [38:39<57:26, 28.48s/it]Best trial: 39. Best value: 0.670136:  40%|████      | 80/200 [38:39<53:32, 26.77s/it]Best trial: 39. Best value: 0.670136:  40%|████      | 80/200 [38:57<53:32, 26.77s/it]Best trial: 39. Best value: 0.670136:  40%|████      | 81/200 [38:57<47:31, 23.96s/it]Best trial: 39. Best value: 0.670136:  40%|████      | 81/200 [39:19<47:31, 23.96s/it]Best trial: 39. Best value: 0.670136:  41%|████      | 82/200 [39:19<46:08, 23.46s/it]Best trial: 39. Best value: 0.670136:  41%|████      | 82/200 [39:41<46:08, 23.46s/it]Best trial: 39. Best value: 0.670136:  42%|████▏     | 83/200 [39:41<45:09, 23.16s/it]Best trial: 39. Best value: 0.670136:  42%|████▏     | 83/200 [40:06<45:09, 23.16s/it]Best trial: 39. Best value: 0.670136:  42%|████▏     | 84/200 [40:06<45:45, 23.67s/it]Best trial: 39. Best value: 0.670136:  42%|████▏     | 84/200 [40:28<45:45, 23.67s/it]Best trial: 39. Best value: 0.670136:  42%|████▎     | 85/200 [40:28<44:24, 23.17s/it]Best trial: 39. Best value: 0.670136:  42%|████▎     | 85/200 [40:57<44:24, 23.17s/it]Best trial: 39. Best value: 0.670136:  43%|████▎     | 86/200 [40:57<47:22, 24.94s/it]Best trial: 39. Best value: 0.670136:  43%|████▎     | 86/200 [41:23<47:22, 24.94s/it]Best trial: 39. Best value: 0.670136:  44%|████▎     | 87/200 [41:23<47:20, 25.14s/it]Best trial: 39. Best value: 0.670136:  44%|████▎     | 87/200 [41:50<47:20, 25.14s/it]Best trial: 39. Best value: 0.670136:  44%|████▍     | 88/200 [41:50<47:50, 25.63s/it]Best trial: 39. Best value: 0.670136:  44%|████▍     | 88/200 [42:21<47:50, 25.63s/it]Best trial: 39. Best value: 0.670136:  44%|████▍     | 89/200 [42:21<50:23, 27.24s/it]Best trial: 39. Best value: 0.670136:  44%|████▍     | 89/200 [42:45<50:23, 27.24s/it]Best trial: 39. Best value: 0.670136:  45%|████▌     | 90/200 [42:45<48:11, 26.28s/it]Best trial: 39. Best value: 0.670136:  45%|████▌     | 90/200 [43:12<48:11, 26.28s/it]Best trial: 39. Best value: 0.670136:  46%|████▌     | 91/200 [43:12<48:03, 26.45s/it]Best trial: 39. Best value: 0.670136:  46%|████▌     | 91/200 [43:37<48:03, 26.45s/it]Best trial: 39. Best value: 0.670136:  46%|████▌     | 92/200 [43:37<47:12, 26.23s/it]Best trial: 39. Best value: 0.670136:  46%|████▌     | 92/200 [44:00<47:12, 26.23s/it]Best trial: 39. Best value: 0.670136:  46%|████▋     | 93/200 [44:00<45:02, 25.25s/it]Best trial: 39. Best value: 0.670136:  46%|████▋     | 93/200 [44:24<45:02, 25.25s/it]Best trial: 39. Best value: 0.670136:  47%|████▋     | 94/200 [44:24<44:03, 24.94s/it]Best trial: 39. Best value: 0.670136:  47%|████▋     | 94/200 [44:49<44:03, 24.94s/it]Best trial: 39. Best value: 0.670136:  48%|████▊     | 95/200 [44:49<43:14, 24.71s/it]Best trial: 39. Best value: 0.670136:  48%|████▊     | 95/200 [45:15<43:14, 24.71s/it]Best trial: 39. Best value: 0.670136:  48%|████▊     | 96/200 [45:15<43:49, 25.28s/it]Best trial: 39. Best value: 0.670136:  48%|████▊     | 96/200 [45:39<43:49, 25.28s/it]Best trial: 39. Best value: 0.670136:  48%|████▊     | 97/200 [45:39<42:39, 24.85s/it]Best trial: 39. Best value: 0.670136:  48%|████▊     | 97/200 [46:08<42:39, 24.85s/it]Best trial: 39. Best value: 0.670136:  49%|████▉     | 98/200 [46:08<44:05, 25.94s/it]Best trial: 39. Best value: 0.670136:  49%|████▉     | 98/200 [46:28<44:05, 25.94s/it]Best trial: 39. Best value: 0.670136:  50%|████▉     | 99/200 [46:28<40:52, 24.29s/it]Best trial: 39. Best value: 0.670136:  50%|████▉     | 99/200 [46:54<40:52, 24.29s/it]Best trial: 39. Best value: 0.670136:  50%|█████     | 100/200 [46:54<41:09, 24.70s/it]Best trial: 39. Best value: 0.670136:  50%|█████     | 100/200 [47:19<41:09, 24.70s/it]Best trial: 39. Best value: 0.670136:  50%|█████     | 101/200 [47:19<41:02, 24.87s/it]Best trial: 39. Best value: 0.670136:  50%|█████     | 101/200 [47:47<41:02, 24.87s/it]Best trial: 39. Best value: 0.670136:  51%|█████     | 102/200 [47:47<42:20, 25.92s/it]Best trial: 39. Best value: 0.670136:  51%|█████     | 102/200 [48:11<42:20, 25.92s/it]Best trial: 39. Best value: 0.670136:  52%|█████▏    | 103/200 [48:11<40:55, 25.31s/it]Best trial: 39. Best value: 0.670136:  52%|█████▏    | 103/200 [48:34<40:55, 25.31s/it]Best trial: 39. Best value: 0.670136:  52%|█████▏    | 104/200 [48:34<39:07, 24.45s/it]Best trial: 39. Best value: 0.670136:  52%|█████▏    | 104/200 [49:03<39:07, 24.45s/it]Best trial: 39. Best value: 0.670136:  52%|█████▎    | 105/200 [49:03<40:52, 25.82s/it]Best trial: 39. Best value: 0.670136:  52%|█████▎    | 105/200 [49:30<40:52, 25.82s/it]Best trial: 39. Best value: 0.670136:  53%|█████▎    | 106/200 [49:30<41:13, 26.32s/it]Best trial: 39. Best value: 0.670136:  53%|█████▎    | 106/200 [49:55<41:13, 26.32s/it]Best trial: 39. Best value: 0.670136:  54%|█████▎    | 107/200 [49:55<39:56, 25.77s/it]Best trial: 107. Best value: 0.69317:  54%|█████▎    | 107/200 [50:22<39:56, 25.77s/it]Best trial: 107. Best value: 0.69317:  54%|█████▍    | 108/200 [50:22<40:20, 26.31s/it]Best trial: 107. Best value: 0.69317:  54%|█████▍    | 108/200 [50:52<40:20, 26.31s/it]Best trial: 107. Best value: 0.69317:  55%|█████▍    | 109/200 [50:52<41:25, 27.32s/it]Best trial: 107. Best value: 0.69317:  55%|█████▍    | 109/200 [51:28<41:25, 27.32s/it]Best trial: 107. Best value: 0.69317:  55%|█████▌    | 110/200 [51:28<44:47, 29.86s/it]Best trial: 107. Best value: 0.69317:  55%|█████▌    | 110/200 [51:53<44:47, 29.86s/it]Best trial: 107. Best value: 0.69317:  56%|█████▌    | 111/200 [51:53<42:20, 28.54s/it]Best trial: 107. Best value: 0.69317:  56%|█████▌    | 111/200 [52:21<42:20, 28.54s/it]Best trial: 107. Best value: 0.69317:  56%|█████▌    | 112/200 [52:21<41:24, 28.23s/it]Best trial: 107. Best value: 0.69317:  56%|█████▌    | 112/200 [52:42<41:24, 28.23s/it]Best trial: 107. Best value: 0.69317:  56%|█████▋    | 113/200 [52:42<37:52, 26.12s/it]Best trial: 107. Best value: 0.69317:  56%|█████▋    | 113/200 [53:08<37:52, 26.12s/it]Best trial: 107. Best value: 0.69317:  57%|█████▋    | 114/200 [53:08<37:25, 26.11s/it]Best trial: 107. Best value: 0.69317:  57%|█████▋    | 114/200 [53:33<37:25, 26.11s/it]Best trial: 107. Best value: 0.69317:  57%|█████▊    | 115/200 [53:33<36:37, 25.85s/it]Best trial: 115. Best value: 0.703544:  57%|█████▊    | 115/200 [53:59<36:37, 25.85s/it]Best trial: 115. Best value: 0.703544:  58%|█████▊    | 116/200 [53:59<36:24, 26.01s/it]Best trial: 115. Best value: 0.703544:  58%|█████▊    | 116/200 [54:25<36:24, 26.01s/it]Best trial: 115. Best value: 0.703544:  58%|█████▊    | 117/200 [54:25<35:50, 25.91s/it]Best trial: 115. Best value: 0.703544:  58%|█████▊    | 117/200 [54:57<35:50, 25.91s/it]Best trial: 115. Best value: 0.703544:  59%|█████▉    | 118/200 [54:57<37:45, 27.63s/it]Best trial: 115. Best value: 0.703544:  59%|█████▉    | 118/200 [55:31<37:45, 27.63s/it]Best trial: 115. Best value: 0.703544:  60%|█████▉    | 119/200 [55:31<39:46, 29.47s/it]Best trial: 115. Best value: 0.703544:  60%|█████▉    | 119/200 [56:05<39:46, 29.47s/it]Best trial: 115. Best value: 0.703544:  60%|██████    | 120/200 [56:05<41:22, 31.03s/it]Best trial: 115. Best value: 0.703544:  60%|██████    | 120/200 [56:29<41:22, 31.03s/it]Best trial: 115. Best value: 0.703544:  60%|██████    | 121/200 [56:29<38:10, 29.00s/it]Best trial: 115. Best value: 0.703544:  60%|██████    | 121/200 [56:50<38:10, 29.00s/it]Best trial: 115. Best value: 0.703544:  61%|██████    | 122/200 [56:50<34:29, 26.54s/it]Best trial: 115. Best value: 0.703544:  61%|██████    | 122/200 [57:14<34:29, 26.54s/it]Best trial: 115. Best value: 0.703544:  62%|██████▏   | 123/200 [57:14<32:48, 25.56s/it]Best trial: 115. Best value: 0.703544:  62%|██████▏   | 123/200 [57:45<32:48, 25.56s/it]Best trial: 115. Best value: 0.703544:  62%|██████▏   | 124/200 [57:45<34:33, 27.28s/it]Best trial: 115. Best value: 0.703544:  62%|██████▏   | 124/200 [58:07<34:33, 27.28s/it]Best trial: 115. Best value: 0.703544:  62%|██████▎   | 125/200 [58:07<32:08, 25.71s/it]Best trial: 115. Best value: 0.703544:  62%|██████▎   | 125/200 [58:31<32:08, 25.71s/it]Best trial: 115. Best value: 0.703544:  63%|██████▎   | 126/200 [58:31<31:12, 25.31s/it]Best trial: 115. Best value: 0.703544:  63%|██████▎   | 126/200 [58:52<31:12, 25.31s/it]Best trial: 115. Best value: 0.703544:  64%|██████▎   | 127/200 [58:52<29:15, 24.04s/it]Best trial: 115. Best value: 0.703544:  64%|██████▎   | 127/200 [59:19<29:15, 24.04s/it]Best trial: 115. Best value: 0.703544:  64%|██████▍   | 128/200 [59:19<29:40, 24.73s/it]Best trial: 115. Best value: 0.703544:  64%|██████▍   | 128/200 [59:46<29:40, 24.73s/it]Best trial: 115. Best value: 0.703544:  64%|██████▍   | 129/200 [59:46<30:16, 25.59s/it]Best trial: 115. Best value: 0.703544:  64%|██████▍   | 129/200 [1:00:10<30:16, 25.59s/it]Best trial: 115. Best value: 0.703544:  65%|██████▌   | 130/200 [1:00:10<29:06, 24.95s/it]Best trial: 115. Best value: 0.703544:  65%|██████▌   | 130/200 [1:00:40<29:06, 24.95s/it]Best trial: 115. Best value: 0.703544:  66%|██████▌   | 131/200 [1:00:40<30:34, 26.58s/it]Best trial: 115. Best value: 0.703544:  66%|██████▌   | 131/200 [1:01:05<30:34, 26.58s/it]Best trial: 115. Best value: 0.703544:  66%|██████▌   | 132/200 [1:01:05<29:29, 26.02s/it]Best trial: 132. Best value: 0.71283:  66%|██████▌   | 132/200 [1:01:30<29:29, 26.02s/it] Best trial: 132. Best value: 0.71283:  66%|██████▋   | 133/200 [1:01:30<28:43, 25.73s/it]Best trial: 132. Best value: 0.71283:  66%|██████▋   | 133/200 [1:02:06<28:43, 25.73s/it]Best trial: 132. Best value: 0.71283:  67%|██████▋   | 134/200 [1:02:06<31:47, 28.90s/it]Best trial: 132. Best value: 0.71283:  67%|██████▋   | 134/200 [1:02:29<31:47, 28.90s/it]Best trial: 132. Best value: 0.71283:  68%|██████▊   | 135/200 [1:02:29<29:17, 27.04s/it]Best trial: 132. Best value: 0.71283:  68%|██████▊   | 135/200 [1:02:56<29:17, 27.04s/it]Best trial: 132. Best value: 0.71283:  68%|██████▊   | 136/200 [1:02:56<28:54, 27.10s/it]Best trial: 132. Best value: 0.71283:  68%|██████▊   | 136/200 [1:03:23<28:54, 27.10s/it]Best trial: 132. Best value: 0.71283:  68%|██████▊   | 137/200 [1:03:23<28:21, 27.00s/it]Best trial: 132. Best value: 0.71283:  68%|██████▊   | 137/200 [1:03:45<28:21, 27.00s/it]Best trial: 132. Best value: 0.71283:  69%|██████▉   | 138/200 [1:03:45<26:16, 25.42s/it]Best trial: 132. Best value: 0.71283:  69%|██████▉   | 138/200 [1:04:07<26:16, 25.42s/it]Best trial: 132. Best value: 0.71283:  70%|██████▉   | 139/200 [1:04:07<24:50, 24.44s/it]Best trial: 132. Best value: 0.71283:  70%|██████▉   | 139/200 [1:04:32<24:50, 24.44s/it]Best trial: 132. Best value: 0.71283:  70%|███████   | 140/200 [1:04:32<24:42, 24.72s/it]Best trial: 132. Best value: 0.71283:  70%|███████   | 140/200 [1:04:59<24:42, 24.72s/it]Best trial: 132. Best value: 0.71283:  70%|███████   | 141/200 [1:04:59<24:48, 25.22s/it]Best trial: 132. Best value: 0.71283:  70%|███████   | 141/200 [1:05:25<24:48, 25.22s/it]Best trial: 132. Best value: 0.71283:  71%|███████   | 142/200 [1:05:25<24:49, 25.68s/it]Best trial: 132. Best value: 0.71283:  71%|███████   | 142/200 [1:05:50<24:49, 25.68s/it]Best trial: 132. Best value: 0.71283:  72%|███████▏  | 143/200 [1:05:50<24:00, 25.28s/it]Best trial: 132. Best value: 0.71283:  72%|███████▏  | 143/200 [1:06:16<24:00, 25.28s/it]Best trial: 132. Best value: 0.71283:  72%|███████▏  | 144/200 [1:06:16<23:46, 25.48s/it]Best trial: 132. Best value: 0.71283:  72%|███████▏  | 144/200 [1:06:45<23:46, 25.48s/it]Best trial: 132. Best value: 0.71283:  72%|███████▎  | 145/200 [1:06:45<24:30, 26.74s/it]Best trial: 132. Best value: 0.71283:  72%|███████▎  | 145/200 [1:07:12<24:30, 26.74s/it]Best trial: 132. Best value: 0.71283:  73%|███████▎  | 146/200 [1:07:12<24:00, 26.67s/it]Best trial: 132. Best value: 0.71283:  73%|███████▎  | 146/200 [1:07:34<24:00, 26.67s/it]Best trial: 132. Best value: 0.71283:  74%|███████▎  | 147/200 [1:07:34<22:27, 25.42s/it]Best trial: 132. Best value: 0.71283:  74%|███████▎  | 147/200 [1:08:01<22:27, 25.42s/it]Best trial: 132. Best value: 0.71283:  74%|███████▍  | 148/200 [1:08:01<22:23, 25.83s/it]Best trial: 132. Best value: 0.71283:  74%|███████▍  | 148/200 [1:08:24<22:23, 25.83s/it]Best trial: 132. Best value: 0.71283:  74%|███████▍  | 149/200 [1:08:24<21:15, 25.02s/it]Best trial: 132. Best value: 0.71283:  74%|███████▍  | 149/200 [1:08:53<21:15, 25.02s/it]Best trial: 132. Best value: 0.71283:  75%|███████▌  | 150/200 [1:08:53<21:54, 26.29s/it]Best trial: 132. Best value: 0.71283:  75%|███████▌  | 150/200 [1:09:14<21:54, 26.29s/it]Best trial: 132. Best value: 0.71283:  76%|███████▌  | 151/200 [1:09:14<19:57, 24.45s/it]Best trial: 132. Best value: 0.71283:  76%|███████▌  | 151/200 [1:09:40<19:57, 24.45s/it]Best trial: 132. Best value: 0.71283:  76%|███████▌  | 152/200 [1:09:40<19:57, 24.95s/it]Best trial: 132. Best value: 0.71283:  76%|███████▌  | 152/200 [1:10:05<19:57, 24.95s/it]Best trial: 132. Best value: 0.71283:  76%|███████▋  | 153/200 [1:10:05<19:39, 25.10s/it]Best trial: 132. Best value: 0.71283:  76%|███████▋  | 153/200 [1:10:40<19:39, 25.10s/it]Best trial: 132. Best value: 0.71283:  77%|███████▋  | 154/200 [1:10:40<21:22, 27.88s/it]Best trial: 132. Best value: 0.71283:  77%|███████▋  | 154/200 [1:11:00<21:22, 27.88s/it]Best trial: 132. Best value: 0.71283:  78%|███████▊  | 155/200 [1:11:00<19:14, 25.65s/it]Best trial: 132. Best value: 0.71283:  78%|███████▊  | 155/200 [1:11:29<19:14, 25.65s/it]Best trial: 132. Best value: 0.71283:  78%|███████▊  | 156/200 [1:11:29<19:36, 26.75s/it]Best trial: 132. Best value: 0.71283:  78%|███████▊  | 156/200 [1:11:51<19:36, 26.75s/it]Best trial: 132. Best value: 0.71283:  78%|███████▊  | 157/200 [1:11:51<18:00, 25.13s/it]Best trial: 132. Best value: 0.71283:  78%|███████▊  | 157/200 [1:12:10<18:00, 25.13s/it]Best trial: 132. Best value: 0.71283:  79%|███████▉  | 158/200 [1:12:10<16:23, 23.41s/it]Best trial: 132. Best value: 0.71283:  79%|███████▉  | 158/200 [1:12:49<16:23, 23.41s/it]Best trial: 132. Best value: 0.71283:  80%|███████▉  | 159/200 [1:12:49<19:09, 28.03s/it]Best trial: 132. Best value: 0.71283:  80%|███████▉  | 159/200 [1:13:18<19:09, 28.03s/it]Best trial: 132. Best value: 0.71283:  80%|████████  | 160/200 [1:13:18<18:51, 28.29s/it]Best trial: 132. Best value: 0.71283:  80%|████████  | 160/200 [1:13:45<18:51, 28.29s/it]Best trial: 132. Best value: 0.71283:  80%|████████  | 161/200 [1:13:45<18:08, 27.92s/it]Best trial: 132. Best value: 0.71283:  80%|████████  | 161/200 [1:14:09<18:08, 27.92s/it]Best trial: 132. Best value: 0.71283:  81%|████████  | 162/200 [1:14:09<17:02, 26.90s/it]Best trial: 132. Best value: 0.71283:  81%|████████  | 162/200 [1:14:33<17:02, 26.90s/it]Best trial: 132. Best value: 0.71283:  82%|████████▏ | 163/200 [1:14:33<16:03, 26.03s/it]Best trial: 132. Best value: 0.71283:  82%|████████▏ | 163/200 [1:14:57<16:03, 26.03s/it]Best trial: 132. Best value: 0.71283:  82%|████████▏ | 164/200 [1:14:57<15:11, 25.31s/it]Best trial: 132. Best value: 0.71283:  82%|████████▏ | 164/200 [1:15:23<15:11, 25.31s/it]Best trial: 132. Best value: 0.71283:  82%|████████▎ | 165/200 [1:15:23<14:51, 25.48s/it]Best trial: 132. Best value: 0.71283:  82%|████████▎ | 165/200 [1:15:46<14:51, 25.48s/it]Best trial: 132. Best value: 0.71283:  83%|████████▎ | 166/200 [1:15:46<14:01, 24.74s/it]Best trial: 132. Best value: 0.71283:  83%|████████▎ | 166/200 [1:16:09<14:01, 24.74s/it]Best trial: 132. Best value: 0.71283:  84%|████████▎ | 167/200 [1:16:09<13:22, 24.31s/it]Best trial: 132. Best value: 0.71283:  84%|████████▎ | 167/200 [1:16:34<13:22, 24.31s/it]Best trial: 132. Best value: 0.71283:  84%|████████▍ | 168/200 [1:16:34<13:00, 24.40s/it]Best trial: 132. Best value: 0.71283:  84%|████████▍ | 168/200 [1:16:51<13:00, 24.40s/it]Best trial: 132. Best value: 0.71283:  84%|████████▍ | 169/200 [1:16:51<11:29, 22.24s/it]Best trial: 132. Best value: 0.71283:  84%|████████▍ | 169/200 [1:17:15<11:29, 22.24s/it]Best trial: 132. Best value: 0.71283:  85%|████████▌ | 170/200 [1:17:15<11:24, 22.83s/it]Best trial: 132. Best value: 0.71283:  85%|████████▌ | 170/200 [1:17:43<11:24, 22.83s/it]Best trial: 132. Best value: 0.71283:  86%|████████▌ | 171/200 [1:17:43<11:49, 24.47s/it]Best trial: 132. Best value: 0.71283:  86%|████████▌ | 171/200 [1:18:07<11:49, 24.47s/it]Best trial: 132. Best value: 0.71283:  86%|████████▌ | 172/200 [1:18:07<11:17, 24.19s/it]Best trial: 132. Best value: 0.71283:  86%|████████▌ | 172/200 [1:18:34<11:17, 24.19s/it]Best trial: 132. Best value: 0.71283:  86%|████████▋ | 173/200 [1:18:34<11:12, 24.90s/it]Best trial: 132. Best value: 0.71283:  86%|████████▋ | 173/200 [1:18:56<11:12, 24.90s/it]Best trial: 132. Best value: 0.71283:  87%|████████▋ | 174/200 [1:18:56<10:27, 24.15s/it]Best trial: 132. Best value: 0.71283:  87%|████████▋ | 174/200 [1:19:20<10:27, 24.15s/it]Best trial: 132. Best value: 0.71283:  88%|████████▊ | 175/200 [1:19:20<09:59, 23.98s/it]Best trial: 132. Best value: 0.71283:  88%|████████▊ | 175/200 [1:19:41<09:59, 23.98s/it]Best trial: 132. Best value: 0.71283:  88%|████████▊ | 176/200 [1:19:41<09:18, 23.25s/it]Best trial: 132. Best value: 0.71283:  88%|████████▊ | 176/200 [1:20:04<09:18, 23.25s/it]Best trial: 132. Best value: 0.71283:  88%|████████▊ | 177/200 [1:20:04<08:51, 23.11s/it]Best trial: 132. Best value: 0.71283:  88%|████████▊ | 177/200 [1:20:49<08:51, 23.11s/it]Best trial: 132. Best value: 0.71283:  89%|████████▉ | 178/200 [1:20:49<10:52, 29.65s/it]Best trial: 132. Best value: 0.71283:  89%|████████▉ | 178/200 [1:21:13<10:52, 29.65s/it]Best trial: 132. Best value: 0.71283:  90%|████████▉ | 179/200 [1:21:13<09:49, 28.06s/it]Best trial: 132. Best value: 0.71283:  90%|████████▉ | 179/200 [1:21:39<09:49, 28.06s/it]Best trial: 132. Best value: 0.71283:  90%|█████████ | 180/200 [1:21:39<09:09, 27.47s/it]Best trial: 132. Best value: 0.71283:  90%|█████████ | 180/200 [1:22:03<09:09, 27.47s/it]Best trial: 132. Best value: 0.71283:  90%|█████████ | 181/200 [1:22:03<08:22, 26.44s/it]Best trial: 132. Best value: 0.71283:  90%|█████████ | 181/200 [1:22:30<08:22, 26.44s/it]Best trial: 132. Best value: 0.71283:  91%|█████████ | 182/200 [1:22:30<07:56, 26.45s/it]Best trial: 132. Best value: 0.71283:  91%|█████████ | 182/200 [1:22:58<07:56, 26.45s/it]Best trial: 132. Best value: 0.71283:  92%|█████████▏| 183/200 [1:22:58<07:39, 27.01s/it]Best trial: 132. Best value: 0.71283:  92%|█████████▏| 183/200 [1:23:30<07:39, 27.01s/it]Best trial: 132. Best value: 0.71283:  92%|█████████▏| 184/200 [1:23:30<07:35, 28.45s/it]Best trial: 132. Best value: 0.71283:  92%|█████████▏| 184/200 [1:23:58<07:35, 28.45s/it]Best trial: 132. Best value: 0.71283:  92%|█████████▎| 185/200 [1:23:58<07:03, 28.25s/it]Best trial: 132. Best value: 0.71283:  92%|█████████▎| 185/200 [1:24:25<07:03, 28.25s/it]Best trial: 132. Best value: 0.71283:  93%|█████████▎| 186/200 [1:24:25<06:31, 27.97s/it]Best trial: 132. Best value: 0.71283:  93%|█████████▎| 186/200 [1:24:45<06:31, 27.97s/it]Best trial: 132. Best value: 0.71283:  94%|█████████▎| 187/200 [1:24:45<05:32, 25.54s/it]Best trial: 132. Best value: 0.71283:  94%|█████████▎| 187/200 [1:25:07<05:32, 25.54s/it]Best trial: 132. Best value: 0.71283:  94%|█████████▍| 188/200 [1:25:07<04:55, 24.62s/it]Best trial: 132. Best value: 0.71283:  94%|█████████▍| 188/200 [1:25:38<04:55, 24.62s/it]Best trial: 132. Best value: 0.71283:  94%|█████████▍| 189/200 [1:25:38<04:49, 26.31s/it]Best trial: 132. Best value: 0.71283:  94%|█████████▍| 189/200 [1:26:02<04:49, 26.31s/it]Best trial: 132. Best value: 0.71283:  95%|█████████▌| 190/200 [1:26:02<04:18, 25.89s/it]Best trial: 132. Best value: 0.71283:  95%|█████████▌| 190/200 [1:26:27<04:18, 25.89s/it]Best trial: 132. Best value: 0.71283:  96%|█████████▌| 191/200 [1:26:27<03:49, 25.49s/it]Best trial: 132. Best value: 0.71283:  96%|█████████▌| 191/200 [1:26:54<03:49, 25.49s/it]Best trial: 132. Best value: 0.71283:  96%|█████████▌| 192/200 [1:26:54<03:26, 25.85s/it]Best trial: 132. Best value: 0.71283:  96%|█████████▌| 192/200 [1:27:19<03:26, 25.85s/it]Best trial: 132. Best value: 0.71283:  96%|█████████▋| 193/200 [1:27:19<02:59, 25.61s/it]Best trial: 132. Best value: 0.71283:  96%|█████████▋| 193/200 [1:27:42<02:59, 25.61s/it]Best trial: 132. Best value: 0.71283:  97%|█████████▋| 194/200 [1:27:42<02:28, 24.81s/it]Best trial: 132. Best value: 0.71283:  97%|█████████▋| 194/200 [1:28:10<02:28, 24.81s/it]Best trial: 132. Best value: 0.71283:  98%|█████████▊| 195/200 [1:28:10<02:08, 25.78s/it]Best trial: 132. Best value: 0.71283:  98%|█████████▊| 195/200 [1:28:34<02:08, 25.78s/it]Best trial: 132. Best value: 0.71283:  98%|█████████▊| 196/200 [1:28:34<01:41, 25.43s/it]Best trial: 132. Best value: 0.71283:  98%|█████████▊| 196/200 [1:29:00<01:41, 25.43s/it]Best trial: 132. Best value: 0.71283:  98%|█████████▊| 197/200 [1:29:00<01:16, 25.38s/it]Best trial: 132. Best value: 0.71283:  98%|█████████▊| 197/200 [1:29:22<01:16, 25.38s/it]Best trial: 132. Best value: 0.71283:  99%|█████████▉| 198/200 [1:29:22<00:49, 24.59s/it]Best trial: 132. Best value: 0.71283:  99%|█████████▉| 198/200 [1:29:44<00:49, 24.59s/it]Best trial: 132. Best value: 0.71283: 100%|█████████▉| 199/200 [1:29:44<00:23, 23.60s/it]Best trial: 132. Best value: 0.71283: 100%|█████████▉| 199/200 [1:30:16<00:23, 23.60s/it]Best trial: 132. Best value: 0.71283: 100%|██████████| 200/200 [1:30:16<00:00, 26.14s/it]Best trial: 132. Best value: 0.71283: 100%|██████████| 200/200 [1:30:16<00:00, 27.08s/it]
04:45:16 [INFO] models.training.ordinal_trainer: Best params: {'bootstrap_type': 'Bayesian', 'grow_policy': 'Lossguide', 'depth': 8, 'iterations': 187, 'learning_rate': 0.011257208155875597, 'border_count': 63, 'l2_leaf_reg': 0.22421098401798784, 'min_data_in_leaf': 6, 'random_strength': 1.8612942765856189, 'colsample_bylevel': 0.35995596090415927, 'max_leaves': 40, 'bagging_temperature': 0.5676484944278488}
04:45:16 [INFO] models.training.ordinal_trainer: Best Within-2 Rate: 0.7128
04:45:16 [WARNING] models.training.ordinal_trainer: Threshold -11: highly imbalanced (99.1% positive)
04:45:18 [INFO] models.training.ordinal_trainer:   Threshold -11: trained (pos_rate=99.1%)
04:45:22 [INFO] models.training.ordinal_trainer:   Threshold -10: trained (pos_rate=98.9%)
04:45:28 [INFO] models.training.ordinal_trainer:   Threshold -9: trained (pos_rate=98.1%)
04:45:31 [INFO] models.training.ordinal_trainer:   Threshold -8: trained (pos_rate=97.7%)
04:45:34 [INFO] models.training.ordinal_trainer:   Threshold -7: trained (pos_rate=96.5%)
04:45:37 [INFO] models.training.ordinal_trainer:   Threshold -6: trained (pos_rate=95.6%)
04:45:40 [INFO] models.training.ordinal_trainer:   Threshold -5: trained (pos_rate=93.9%)
04:45:43 [INFO] models.training.ordinal_trainer:   Threshold -4: trained (pos_rate=92.8%)
04:45:48 [INFO] models.training.ordinal_trainer:   Threshold -3: trained (pos_rate=90.1%)
04:45:51 [INFO] models.training.ordinal_trainer:   Threshold -2: trained (pos_rate=87.1%)
04:45:55 [INFO] models.training.ordinal_trainer:   Threshold -1: trained (pos_rate=78.3%)
04:46:04 [INFO] models.training.ordinal_trainer:   Threshold +0: trained (pos_rate=68.7%)
04:46:15 [INFO] models.training.ordinal_trainer:   Threshold +1: trained (pos_rate=44.3%)
04:46:22 [INFO] models.training.ordinal_trainer:   Threshold +2: trained (pos_rate=28.3%)
04:46:25 [INFO] models.training.ordinal_trainer:   Threshold +3: trained (pos_rate=16.6%)
04:46:33 [INFO] models.training.ordinal_trainer:   Threshold +4: trained (pos_rate=12.0%)
04:46:40 [INFO] models.training.ordinal_trainer:   Threshold +5: trained (pos_rate=6.8%)
04:46:45 [INFO] models.training.ordinal_trainer:   Threshold +6: trained (pos_rate=4.1%)
04:46:50 [INFO] models.training.ordinal_trainer:   Threshold +7: trained (pos_rate=2.3%)
04:46:53 [INFO] models.training.ordinal_trainer:   Threshold +8: trained (pos_rate=1.6%)
04:46:58 [INFO] models.training.ordinal_trainer:   Threshold +9: trained (pos_rate=1.0%)
04:46:58 [WARNING] models.training.ordinal_trainer: Threshold 10: highly imbalanced (0.8% positive)
04:47:02 [INFO] models.training.ordinal_trainer:   Threshold +10: trained (pos_rate=0.8%)
04:47:02 [WARNING] models.training.ordinal_trainer: Threshold 11: highly imbalanced (0.5% positive)
04:47:05 [INFO] models.training.ordinal_trainer:   Threshold +11: trained (pos_rate=0.5%)
04:47:05 [WARNING] models.training.ordinal_trainer: Threshold 12: extreme imbalance (pos_rate=0.0040), using constant predictor
04:47:05 [INFO] models.training.ordinal_trainer: Ordinal training complete: 24 classifiers
04:47:07 [INFO] models.training.ordinal_trainer: Saved ordinal model to models/saved/miami/ordinal_catboost_optuna.pkl
04:47:07 [INFO] __main__: 
Saved model to models/saved/miami/ordinal_catboost_optuna.pkl
04:47:07 [INFO] __main__: Saved best params to models/saved/miami/best_params.json
04:47:07 [INFO] __main__: Saved final metrics to models/saved/miami/final_metrics_miami.json

============================================================
EVALUATION
============================================================

Test Set Metrics:
----------------------------------------
  delta_accuracy: 0.2555
  delta_mae: 5.0809
  off_by_1_rate: 0.1840
  off_by_2plus_rate: 0.5605
  within_1_rate: 0.4395
  within_2_rate: 0.5184

============================================================
FEATURE IMPORTANCE
============================================================

Top 30 Features:
                         feature  importance
0                 fcst_obs_ratio    7.035098
1               obs_fcst_max_gap    6.102561
2           log_abs_obs_fcst_gap    4.221874
3        temp_zscore_vs_forecast    2.838697
4        confidence_weighted_gap    2.593060
5           fcst_peak_hour_float    2.592885
6           obs_fcst_gap_squared    2.442058
7              fcst_multi_median    2.114973
8          fcst_prev_hour_of_max    1.895208
9               remaining_upside    1.722004
10               fcst_multi_mean    1.700220
11      fcst_remaining_potential    1.643729
12             fcst_dewpoint_min    1.596355
13         fcst_multi_t1_t2_diff    1.530923
14               fcst_prev_std_f    1.524060
15           fcst_dewpoint_range    1.332655
16         gap_x_hours_remaining    1.234107
17              delta_vcmax_lag1    1.130086
18                fcst_multi_ema    1.123949
19                       doy_sin    1.024380
20      fcst_peak_band_width_min    0.984657
21               above_fcst_flag    0.949498
22  fcst_humidity_afternoon_mean    0.930094
23       hours_since_market_open    0.916708
24             fcst_humidity_min    0.916056
25               fcst_prev_q75_f    0.859539
26       fcst_drift_mean_delta_f    0.851870
27                vc_max_f_sofar    0.810072
28           fcst_humidity_range    0.806665
29                       doy_cos    0.800068

----------------------------------------
Station-city feature importance:
                         feature  importance
97    station_city_max_gap_sofar    0.276124
107  station_city_mean_gap_sofar    0.227607
111         station_city_gap_std    0.209845
119       station_city_gap_trend    0.128366
154  station_city_gap_x_fcst_gap    0.026256
177        station_city_temp_gap    0.002041
  station_city_max_gap_sofar: rank 98/201
  station_city_mean_gap_sofar: rank 108/201
  station_city_gap_std: rank 112/201
  station_city_gap_trend: rank 120/201
  station_city_gap_x_fcst_gap: rank 155/201
  station_city_temp_gap: rank 178/201

----------------------------------------
Multi-horizon feature importance:
                  feature  importance
7       fcst_multi_median    2.114973
10        fcst_multi_mean    1.700220
13  fcst_multi_t1_t2_diff    1.530923
18         fcst_multi_ema    1.123949
50   fcst_multi_range_pct    0.629694
68       fcst_multi_drift    0.484524
71       fcst_multi_range    0.468348
88          fcst_multi_cv    0.362246
95         fcst_multi_std    0.297495
  fcst_multi_median: rank 8/201
  fcst_multi_mean: rank 11/201
  fcst_multi_t1_t2_diff: rank 14/201
  fcst_multi_ema: rank 19/201
  fcst_multi_range_pct: rank 51/201
  fcst_multi_drift: rank 69/201
  fcst_multi_range: rank 72/201
  fcst_multi_cv: rank 89/201
  fcst_multi_std: rank 96/201

============================================================
SUMMARY
============================================================
City: miami
Model: models/saved/miami/ordinal_catboost_optuna.pkl
Params: models/saved/miami/best_params.json
Metrics: models/saved/miami/final_metrics_miami.json
Training samples: 389,772
Test samples: 97,128
Optuna trials: 200
Best params: {'bootstrap_type': 'Bayesian', 'grow_policy': 'Lossguide', 'depth': 8, 'iterations': 187, 'learning_rate': 0.011257208155875597, 'border_count': 63, 'l2_leaf_reg': 0.22421098401798784, 'min_data_in_leaf': 6, 'random_strength': 1.8612942765856189, 'colsample_bylevel': 0.35995596090415927, 'max_leaves': 40, 'bagging_temperature': 0.5676484944278488}

Key Metrics:
  Accuracy: 25.5%
  MAE: 5.08
  Within 1: 44.0%
  Within 2: 51.8%

============================================================
DONE
============================================================
